Member of Parliament,Political Affiliation,Member Voted,Paired
Mr. Jim Abbott (Kootenay—Columbia),Conservative,Yea,
Mrs. Diane Ablonczy (Calgary—Nose Hill),Conservative,Yea,
Mr. Peter Adams (Peterborough),Liberal,Yea,
Mr. Reg Alcock (Winnipeg South),Liberal,Nay,
Ms. Rona Ambrose (Edmonton—Spruce Grove),Conservative,Yea,
Mr. Rob Anders (Calgary West),Conservative,Yea,
Mr. David Anderson (Cypress Hills—Grasslands),Conservative,Yea,
Mr. David Anderson (Victoria),Liberal,Nay,
Mr. Guy André (Berthier—Maskinongé),Bloc Québécois,Nay,
Mr. Charlie Angus (Timmins—James Bay),NDP,Yea,
Mr. Gérard Asselin (Manicouagan),Bloc Québécois,Nay,
Ms. Jean Augustine (Etobicoke—Lakeshore),Liberal,Yea,
Mr. Claude Bachand (Saint-Jean),Bloc Québécois,Nay,
Mr. Larry Bagnell (Yukon),Liberal,Yea,
Mr. Navdeep Bains (Mississauga—Brampton South),Liberal,Yea,
Ms. Eleni Bakopanos (Ahuntsic),Liberal,Nay,
Mrs. Sue Barnes (London West),Liberal,Nay,
Mr. Dave Batters (Palliser),Conservative,Yea,
Ms. Colleen Beaumier (Brampton West),Liberal,Yea,
Mr. Mauril Bélanger (Ottawa—Vanier),Liberal,Nay,
Mr. Don Bell (North Vancouver),Liberal,Yea,
Mr. André Bellavance (Richmond—Arthabaska),Bloc Québécois,Nay,
Ms. Carolyn Bennett (St. Paul's),Liberal,Nay,
Mr. Leon Benoit (Vegreville—Wainwright),Conservative,Yea,
Mr. Stéphane Bergeron (Verchères—Les Patriotes),Bloc Québécois,Nay,
Mr. Bernard Bigras (Rosemont—La Petite-Patrie),Bloc Québécois,Nay,
Mr. Bill Blaikie (Elmwood—Transcona),NDP,Yea,
Mr. Raynald Blais (Gaspésie—Îles-de-la-Madeleine),Bloc Québécois,Nay,
Ms. Ethel Blondin-Andrew (Western Arctic),Liberal,Nay,
Mr. Alain Boire (Beauharnois—Salaberry),Bloc Québécois,Nay,
Ms. Françoise Boivin (Gatineau),Liberal,Nay,
Mr. Raymond Bonin (Nickel Belt),Liberal,Nay,
Ms. France Bonsant (Compton—Stanstead),Bloc Québécois,Nay,
Mr. Ken Boshcoff (Thunder Bay—Rainy River),Liberal,Yea,
Mr. Robert Bouchard (Chicoutimi—Le Fjord),Bloc Québécois,Nay,
Mr. Don Boudria (Glengarry—Prescott—Russell),Liberal,Nay,
Mr. Marc Boulianne (Mégantic—L'Érable),Bloc Québécois,Nay,
Ms. Diane Bourgeois (Terrebonne—Blainville),Bloc Québécois,Nay,
Ms. Claudette Bradshaw (Moncton—Riverview—Dieppe),Liberal,Nay,
Mr. Garry Breitkreuz (Yorkton—Melville),Conservative,Yea,
Mr. Scott Brison (Kings—Hants),Liberal,Nay,
Mr. Ed Broadbent (Ottawa Centre),NDP,Yea,
Mr. Gordon Brown (Leeds—Grenville),Conservative,Yea,
Ms. Paule Brunelle (Trois-Rivières),Bloc Québécois,Nay,
Ms. Sarmite Bulte (Parkdale—High Park),Liberal,Nay,
Mr. Gerry Byrne (Humber—St. Barbe—Baie Verte),Liberal,Yea,
Mr. John Cannis (Scarborough Centre),Liberal,Yea,
Mr. Serge Cardin (Sherbrooke),Bloc Québécois,Nay,
Mr. Gary Carr (Halton),Liberal,Yea,
Mr. Colin Carrie (Oshawa),Conservative,Yea,
Mr. Robert Carrier (Alfred-Pellan),Bloc Québécois,Nay,
Ms. Aileen Carroll (Barrie),Liberal,Nay,
Mr. Bill Casey (Cumberland—Colchester—Musquodoboit Valley),Conservative,Yea,
Mr. Rick Casson (Lethbridge),Conservative,Yea,
Mrs. Brenda Chamberlain (Guelph),Liberal,Yea,
Mr. Raymond Chan (Richmond),Liberal,Nay,
Mr. Michael Chong (Wellington—Halton Hills),Conservative,Yea,
Mr. David Christopherson (Hamilton Centre),NDP,Yea,
Mr. Roger Clavet (Louis-Hébert),Bloc Québécois,Nay,
Mr. Bernard Cleary (Louis-Saint-Laurent),Bloc Québécois,Nay,
Mr. Denis Coderre (Bourassa),Liberal,Yea,
Mr. Joe Comartin (Windsor—Tecumseh),NDP,Yea,
Mr. Joe Comuzzi (Thunder Bay—Superior North),Liberal,Nay,
Mr. Guy Côté (Portneuf—Jacques-Cartier),Bloc Québécois,Nay,
Mr. Irwin Cotler (Mount Royal),Liberal,Nay,
Mr. Paul Crête (Montmagny—L'Islet—Kamouraska—Rivière-du-Loup),Bloc Québécois,Nay,
Ms. Jean Crowder (Nanaimo—Cowichan),NDP,Yea,
Mr. Nathan Cullen (Skeena—Bulkley Valley),NDP,Yea,
Mr. Jean-Claude D'Amours (Madawaska—Restigouche),Liberal,Yea,
Ms. Libby Davies (Vancouver East),NDP,Yea,
Mr. Stockwell Day (Okanagan—Coquihalla),Conservative,Yea,
Ms. Nicole Demers (Laval),Bloc Québécois,Nay,
Ms. Johanne Deschamps (Laurentides—Labelle),Bloc Québécois,Nay,
Mrs. Bev Desjarlais (Churchill),Independent,Yea,
Mr. Odina Desrochers (Lotbinière—Chutes-de-la-Chaudière),Bloc Québécois,Nay,
Mr. Paul DeVillers (Simcoe North),Liberal,Nay,
Mr. Barry Devolin (Haliburton—Kawartha Lakes—Brock),Conservative,Yea,
Ms. Ruby Dhalla (Brampton—Springdale),Liberal,Nay,
Mr. Stéphane Dion (Saint-Laurent—Cartierville),Liberal,Nay,
Mr. Ujjal Dosanjh (Vancouver South),Liberal,Nay,
Senator Norman E. Doyle (St. John's East),Conservative,Yea,
Mr. Claude Drouin (Beauce),Liberal,Yea,
Mr. Ken Dryden (York Centre),Liberal,Nay,
Mr. Gilles Duceppe (Laurier—Sainte-Marie),Bloc Québécois,Nay,
Mr. John Duncan (Vancouver Island North),Conservative,Yea,
Mr. Wayne Easter (Malpeque),Liberal,Yea,
Mr. David Emerson (Vancouver Kingsway),Liberal,Nay,
Mr. Ken Epp (Edmonton—Sherwood Park),Conservative,Yea,
Mr. Mark Eyking (Sydney—Victoria),Liberal,Yea,
Ms. Meili Faille (Vaudreuil-Soulanges),Bloc Québécois,Nay,
Mr. Brian Fitzpatrick (Prince Albert),Conservative,Yea,
Mr. Steven Fletcher (Charleswood—St. James—Assiniboia),Conservative,Yea,
Ms. Raymonde Folco (Laval—Les Îles),Liberal,Yea,
Mr. Joe Fontana (London North Centre),Liberal,Nay,
Mr. Paul Forseth (New Westminster—Coquitlam),Conservative,Yea,
Ms. Liza Frulla (Jeanne-Le Ber),Liberal,Nay,
Mr. Marcel Gagnon (Saint-Maurice—Champlain),Bloc Québécois,Nay,
Mr. Sébastien Gagnon (Jonquière—Alma),Bloc Québécois,Nay,
Ms. Christiane Gagnon (Québec),Bloc Québécois,Nay,
Mrs. Cheryl Gallant (Renfrew—Nipissing—Pembroke),Conservative,Yea,
Mr. Roger Gallaway (Sarnia—Lambton),Liberal,Yea,
Mr. Roger Gaudet (Montcalm),Bloc Québécois,Nay,
Mr. Michel Gauthier (Roberval—Lac-Saint-Jean),Bloc Québécois,Nay,
Mr. Marc Godbout (Ottawa—Orléans),Liberal,Yea,
Mr. John Godfrey (Don Valley West),Liberal,Nay,
Mr. Yvon Godin (Acadie—Bathurst),NDP,Yea,
Mr. Peter Goldring (Edmonton East),Conservative,Yea,
Mr. Ralph Goodale (Wascana),Liberal,Nay,
Mr. Gary Goodyear (Cambridge),Conservative,Yea,
Mr. Jim Gouk (British Columbia Southern Interior),Conservative,Yea,
Mr. Bill Graham (Toronto Centre),Liberal,Nay,
Mrs. Nina Grewal (Fleetwood—Port Kells),Conservative,Yea,
Mr. Gurmant Grewal (Newton—North Delta),Conservative,Yea,
Mrs. Helena Guergis (Simcoe—Grey),Conservative,Yea,
Mr. Michel Guimond (Montmorency—Charlevoix—Haute-Côte-Nord),Bloc Québécois,Nay,
Mr. Art Hanger (Calgary Northeast),Conservative,Yea,
Mr. Stephen Harper (Calgary Southwest),Conservative,Yea,
Mr. Jeremy Harrison (Desnethé—Missinippi—Churchill River),Conservative,Yea,
Mr. Loyola Hearn (St. John's South—Mount Pearl),Conservative,Yea,
Mr. Russ Hiebert (South Surrey—White Rock—Cloverdale),Conservative,Yea,
Mr. Jay Hill (Prince George—Peace River),Conservative,Yea,
Mr. Mark Holland (Ajax—Pickering),Liberal,Yea,
Mr. Charles Hubbard (Miramichi),Liberal,Nay,
Mr. Tony Ianno (Trinity—Spadina),Liberal,Nay,
Mr. Rahim Jaffer (Edmonton—Strathcona),Conservative,Yea,
Mr. Brian Jean (Fort McMurray—Athabasca),Conservative,Yea,
Mrs. Marlene Jennings (Notre-Dame-de-Grâce—Lachine),Liberal,Yea,
Mr. Dale Johnston (Wetaskiwin),Conservative,Yea,
Mr. Peter Julian (Burnaby—New Westminster),NDP,Yea,
Mrs. Susan Kadis (Thornhill),Liberal,Yea,
Mr. Randy Kamp (Pitt Meadows—Maple Ridge—Mission),Conservative,Yea,
Ms. Nancy Karetak-Lindell (Nunavut),Liberal,Yea,
Mr. Jim Karygiannis (Scarborough—Agincourt),Liberal,Yea,
Mr. Gerald Keddy (South Shore—St. Margaret's),Conservative,Yea,
Mr. Jason Kenney (Calgary Southeast),Conservative,Yea,
Mr. Wajid Khan (Mississauga—Streetsville),Liberal,Nay,
Mr. Ed Komarnicki (Souris—Moose Mountain),Conservative,Yea,
Mr. Maka Kotto (Saint-Lambert),Bloc Québécois,Nay,
Mr. Daryl Kramp (Prince Edward—Hastings),Conservative,Yea,
Mr. Mario Laframboise (Argenteuil—Papineau—Mirabel),Bloc Québécois,Nay,
Ms. Francine Lalonde (La Pointe-de-l'Île),Bloc Québécois,Nay,
Mr. Réal Lapierre (Lévis—Bellechasse),Bloc Québécois,Nay,
Mr. Jean Lapierre (Outremont),Liberal,Nay,
Mr. Walt Lastewka (St. Catharines),Liberal,Yea,
Mr. Guy Lauzon (Stormont—Dundas—South Glengarry),Conservative,Yea,
Mrs. Carole Lavallée (Saint-Bruno—Saint-Hubert),Bloc Québécois,Nay,
Mr. Jack Layton (Toronto—Danforth),NDP,Yea,
Mr. Dominic LeBlanc (Beauséjour),Liberal,Yea,
Mr. Derek Lee (Scarborough—Rouge River),Liberal,Nay,
Mr. Marc Lemay (Abitibi—Témiscamingue),Bloc Québécois,Nay,
Mr. Yves Lessard (Chambly—Borduas),Bloc Québécois,Nay,
Mr. Yvon Lévesque (Abitibi—Baie-James—Nunavik—Eeyou),Bloc Québécois,Nay,
Mrs. Judi Longfield (Whitby—Oshawa),Liberal,Yea,
Mr. Yvan Loubier (Saint-Hyacinthe—Bagot),Bloc Québécois,Nay,
Mr. Tom Lukiwski (Regina—Lumsden—Lake Centre),Conservative,Yea,
Mr. Gary Lunn (Saanich—Gulf Islands),Conservative,Yea,
Mr. James Lunney (Nanaimo—Alberni),Conservative,Yea,
Mr. Lawrence MacAulay (Cardigan),Liberal,Yea,
Mr. Peter MacKay (Central Nova),Conservative,Yea,
Mr. Dave MacKenzie (Oxford),Conservative,Yea,
Mr. Gurbax Malhi (Bramalea—Gore—Malton),Liberal,Nay,
Mr. John Maloney (Welland),Liberal,Yea,
Mr. Richard Marceau (Charlesbourg—Haute-Saint-Charles),Bloc Québécois,Nay,
Ms. Diane Marleau (Sudbury),Liberal,Yea,
Mr. Keith Martin (Esquimalt—Juan de Fuca),Liberal,Yea,
Mr. Tony Martin (Sault Ste. Marie),NDP,Yea,
Mr. Pat Martin (Winnipeg Centre),NDP,Yea,
Mr. Brian Masse (Windsor West),NDP,Yea,
Mr. Bill Matthews (Random—Burin—St. George's),Liberal,Yea,
Mr. John McCallum (Markham—Unionville),Liberal,Nay,
Ms. Alexa McDonough (Halifax),NDP,Yea,
Mr. David McGuinty (Ottawa South),Liberal,Nay,
Mr. Joe McGuire (Egmont),Liberal,Nay,
Mr. John McKay (Scarborough—Guildwood),Liberal,Yea,
Ms. Anne McLellan (Edmonton Centre),Liberal,Nay,
Mr. Dan McTeague (Pickering—Scarborough East),Liberal,Yea,
Mr. Serge Ménard (Marc-Aurèle-Fortin),Bloc Québécois,Nay,
Mr. Réal Ménard (Hochelaga),Bloc Québécois,Nay,
Mr. Ted Menzies (Macleod),Conservative,Yea,
Mr. Rob Merrifield (Yellowhead),Conservative,Yea,
Mr. Larry Miller (Bruce—Grey—Owen Sound),Conservative,Yea,
Mr. Bob Mills (Red Deer),Conservative,Yea,
Ms. Maria Minna (Beaches—East York),Liberal,Yea,
Mr. Andy Mitchell (Parry Sound—Muskoka),Liberal,Nay,
Mr. James Moore (Port Moody—Westwood—Port Coquitlam),Conservative,Yea,
Mr. Rob Moore (Fundy Royal),Conservative,Yea,
Mr. Shawn Murphy (Charlottetown),Liberal,Yea,
Mr. Lynn Myers (Kitchener—Conestoga),Liberal,Yea,
Mr. Rob Nicholson (Niagara Falls),Conservative,Yea,
Mr. Deepak Obhrai (Calgary East),Conservative,Yea,
Mr. Gordon O'Connor (Carleton—Mississippi Mills),Conservative,Yea,
Ms. Bev Oda (Durham),Conservative,Yea,
Mr. Stephen Owen (Vancouver Quadra),Liberal,Nay,
Mr. Brian Pallister (Portage—Lisgar),Conservative,Yea,
Mr. Pierre Paquette (Joliette),Bloc Québécois,Nay,
Mr. Denis Paradis (Brome—Missisquoi),Liberal,Yea,
Mrs. Carolyn Parrish (Mississauga—Erindale),Independent,Yea,
Mr. Bernard Patry (Pierrefonds—Dollard),Liberal,Nay,
Mr. Charlie Penson (Peace River),Conservative,Yea,
Mr. Gilles-A. Perron (Rivière-des-Mille-Îles),Bloc Québécois,Nay,
Mr. Jim Peterson (Willowdale),Liberal,Nay,
Mr. Pierre Pettigrew (Papineau),Liberal,Nay,
Ms. Beth Phinney (Hamilton Mountain),Liberal,Nay,
Ms. Pauline Picard (Drummond),Bloc Québécois,Nay,
Mr. Jerry Pickard (Chatham-Kent—Essex),Liberal,Nay,
Mr. Louis Plamondon (Bas-Richelieu—Nicolet—Bécancour),Bloc Québécois,Nay,
Mr. Pierre Poilievre (Nepean—Carleton),Conservative,Yea,
Ms. Denise Poirier-Rivard (Châteauguay—Saint-Constant),Bloc Québécois,Nay,
Mr. Russ Powers (Ancaster—Dundas—Flamborough—Westdale),Liberal,Yea,
Mr. Jim Prentice (Calgary Centre-North),Conservative,Yea,
Mr. Joe Preston (Elgin—Middlesex—London),Conservative,Yea,
Mr. Marcel Proulx (Hull—Aylmer),Liberal,Yea,
Mr. James Rajotte (Edmonton—Leduc),Conservative,Yea,
Mrs. Karen Redman (Kitchener Centre),Liberal,Nay,
Mr. Geoff Regan (Halifax West),Liberal,Nay,
Mr. Scott Reid (Lanark—Frontenac—Lennox and Addington),Conservative,Yea,
Ms. Lucienne Robillard (Westmount—Ville-Marie),Liberal,Nay,
Mr. Pablo Rodriguez (Honoré-Mercier),Liberal,Yea,
Mr. Anthony Rota (Nipissing—Timiskaming),Liberal,Yea,
Mr. Jean-Yves Roy (Haute-Gaspésie—La Mitis—Matane—Matapédia),Bloc Québécois,Nay,
Mr. Jacques Saada (Brossard—La Prairie),Liberal,Nay,
Mr. Benoît Sauvageau (Repentigny),Bloc Québécois,Nay,
Mr. Michael Savage (Dartmouth—Cole Harbour),Liberal,Yea,
Mr. Andy Savoy (Tobique—Mactaquac),Liberal,Nay,
Mr. Francis Scarpaleggia (Lac-Saint-Louis),Liberal,Nay,
Mr. Andrew Scheer (Regina—Qu'Appelle),Conservative,Yea,
Mr. Gary Schellenberger (Perth—Wellington),Conservative,Yea,
Mr. Werner Schmidt (Kelowna—Lake Country),Conservative,Yea,
Ms. Judy A. Sgro (York West),Liberal,Nay,
Mr. Bill Siksay (Burnaby—Douglas),NDP,Yea,
Mr. Mario Silva (Davenport),Liberal,Yea,
Mr. Raymond Simard (Saint Boniface),Liberal,Nay,
Mr. Christian Simard (Beauport—Limoilou),Bloc Québécois,Nay,
Mr. Scott Simms (Bonavista—Gander—Grand Falls—Windsor),Liberal,Yea,
Mrs. Carol Skelton (Saskatoon—Rosetown—Biggar),Conservative,Yea,
Mrs. Joy Smith (Kildonan—St. Paul),Conservative,Yea,
Mr. David Smith (Pontiac),Liberal,Yea,
Mr. Monte Solberg (Medicine Hat),Conservative,Yea,
Mr. Kevin Sorenson (Crowfoot),Conservative,Yea,
Mr. Lloyd St. Amand (Brant),Liberal,Yea,
Mr. Brent St. Denis (Algoma—Manitoulin—Kapuskasing),Liberal,Nay,
Mr. Paul Steckle (Huron—Bruce),Liberal,Yea,
Ms. Caroline St-Hilaire (Longueuil—Pierre-Boucher),Bloc Québécois,Nay,
Mr. Peter Stoffer (Sackville—Eastern Shore),NDP,Yea,
Ms. Belinda Stronach (Newmarket—Aurora),Liberal,Nay,
Mr. Paul Szabo (Mississauga South),Liberal,Yea,
Mr. Andrew Telegdi (Kitchener—Waterloo),Liberal,Yea,
Mr. Lui Temelkovski (Oak Ridges—Markham),Liberal,Nay,
Ms. Louise Thibault (Rimouski-Neigette—Témiscouata—Les Basques),Bloc Québécois,Nay,
Mr. Robert Thibault (West Nova),Liberal,Yea,
Mr. Myron Thompson (Wild Rose),Conservative,Yea,
Mr. Greg Thompson (New Brunswick Southwest),Conservative,Yea,
Mr. David Tilson (Dufferin—Caledon),Conservative,Yea,
Mr. Alan Tonks (York South—Weston),Liberal,Yea,
Ms. Paddy Torsney (Burlington),Liberal,Yea,
Mr. Brad Trost (Saskatoon—Humboldt),Conservative,Yea,
Mr. Merv Tweed (Brandon—Souris),Conservative,Yea,
Mrs. Rose-Marie Ur (Lambton—Kent—Middlesex),Liberal,Yea,
Mr. Tony Valeri (Hamilton East—Stoney Creek),Liberal,Nay,
Mr. Roger Valley (Kenora),Liberal,Yea,
Mr. Peter Van Loan (York—Simcoe),Conservative,Yea,
Mr. Maurice Vellacott (Saskatoon—Wanuskewin),Conservative,Yea,
Mr. Robert Vincent (Shefford),Bloc Québécois,Nay,
Mr. Joseph Volpe (Eglinton—Lawrence),Liberal,Nay,
Mr. Tom Wappel (Scarborough Southwest),Liberal,Nay,
Mr. Mark Warawa (Langley),Conservative,Yea,
Ms. Judy Wasylycia-Leis (Winnipeg North),NDP,Yea,
Mr. Jeff Watson (Essex),Conservative,Yea,
Mr. Bryon Wilfert (Richmond Hill),Liberal,Yea,
Mr. John G. Williams (Edmonton—St. Albert),Conservative,Yea,
Mr. Borys Wrzesnewskyj (Etobicoke Centre),Liberal,Yea,
Mrs. Lynne Yelich (Blackstrap),Conservative,Yea,
Mr. Paul Zed (Saint John),Liberal,Yea,
