Member of Parliament,Political Affiliation,Member Voted,Paired
Mr. Jim Abbott (Kootenay—Columbia),Conservative,Yea,
Mr. Peter Adams (Peterborough),Liberal,Nay,
Mr. Dean Allison (Niagara West—Glanbrook),Conservative,Yea,
Ms. Rona Ambrose (Edmonton—Spruce Grove),Conservative,Yea,
Mr. Rob Anders (Calgary West),Conservative,Yea,
Mr. David Anderson (Victoria),Liberal,Nay,
Mr. Guy André (Berthier—Maskinongé),Bloc Québécois,Yea,
Mr. Charlie Angus (Timmins—James Bay),NDP,Yea,
Mr. Gérard Asselin (Manicouagan),Bloc Québécois,Yea,
Ms. Jean Augustine (Etobicoke—Lakeshore),Liberal,Nay,
Mr. Claude Bachand (Saint-Jean),Bloc Québécois,Yea,
Mr. Larry Bagnell (Yukon),Liberal,Nay,
Mr. Navdeep Bains (Mississauga—Brampton South),Liberal,Nay,
Ms. Eleni Bakopanos (Ahuntsic),Liberal,Nay,
Mr. Dave Batters (Palliser),Conservative,Yea,
Mr. Mauril Bélanger (Ottawa—Vanier),Liberal,Nay,
Mr. Don Bell (North Vancouver),Liberal,Yea,
Mr. André Bellavance (Richmond—Arthabaska),Bloc Québécois,Yea,
Ms. Carolyn Bennett (St. Paul's),Liberal,Nay,
Mr. Leon Benoit (Vegreville—Wainwright),Conservative,Yea,
Mr. Maurizio Bevilacqua (Vaughan),Liberal,Nay,
Mr. James Bezan (Selkirk—Interlake),Conservative,Yea,
Mr. Bernard Bigras (Rosemont—La Petite-Patrie),Bloc Québécois,Yea,
Mr. Bill Blaikie (Elmwood—Transcona),NDP,Yea,
Mr. Raynald Blais (Gaspésie—Îles-de-la-Madeleine),Bloc Québécois,Yea,
Ms. Ethel Blondin-Andrew (Western Arctic),Liberal,Nay,
Ms. Françoise Boivin (Gatineau),Liberal,Nay,
Mr. Raymond Bonin (Nickel Belt),Liberal,Nay,
Ms. France Bonsant (Compton—Stanstead),Bloc Québécois,Yea,
Mr. Ken Boshcoff (Thunder Bay—Rainy River),Liberal,Nay,
Mr. Robert Bouchard (Chicoutimi—Le Fjord),Bloc Québécois,Yea,
Mr. Marc Boulianne (Mégantic—L'Érable),Bloc Québécois,Yea,
Ms. Diane Bourgeois (Terrebonne—Blainville),Bloc Québécois,Yea,
Ms. Claudette Bradshaw (Moncton—Riverview—Dieppe),Liberal,Nay,
Mr. Garry Breitkreuz (Yorkton—Melville),Conservative,Yea,
Mr. Scott Brison (Kings—Hants),Liberal,Nay,
Mr. Ed Broadbent (Ottawa Centre),NDP,Yea,
Ms. Bonnie Brown (Oakville),Liberal,Nay,
Mr. Gordon Brown (Leeds—Grenville),Conservative,Yea,
Ms. Paule Brunelle (Trois-Rivières),Bloc Québécois,Yea,
Ms. Sarmite Bulte (Parkdale—High Park),Liberal,Nay,
Mr. Gerry Byrne (Humber—St. Barbe—Baie Verte),Liberal,Nay,
Mr. John Cannis (Scarborough Centre),Liberal,Nay,
Mr. Serge Cardin (Sherbrooke),Bloc Québécois,Yea,
Mr. Gary Carr (Halton),Liberal,Nay,
Mr. Colin Carrie (Oshawa),Conservative,Yea,
Mr. Robert Carrier (Alfred-Pellan),Bloc Québécois,Yea,
Ms. Aileen Carroll (Barrie),Liberal,Nay,
Mr. Bill Casey (Cumberland—Colchester—Musquodoboit Valley),Conservative,Yea,
Mr. Rick Casson (Lethbridge),Conservative,Yea,
Mrs. Marlene Catterall (Ottawa West—Nepean),Liberal,Nay,
Mrs. Brenda Chamberlain (Guelph),Liberal,Nay,
Mr. Raymond Chan (Richmond),Liberal,Nay,
Mr. Michael Chong (Wellington—Halton Hills),Conservative,Yea,
Mr. David Christopherson (Hamilton Centre),NDP,Yea,
Mr. Roger Clavet (Louis-Hébert),Bloc Québécois,Yea,
Mr. Bernard Cleary (Louis-Saint-Laurent),Bloc Québécois,Yea,
Mr. Joe Comartin (Windsor—Tecumseh),NDP,Yea,
Mr. Joe Comuzzi (Thunder Bay—Superior North),Liberal,Nay,
Mr. Guy Côté (Portneuf—Jacques-Cartier),Bloc Québécois,Yea,
Mr. Paul Crête (Montmagny—L'Islet—Kamouraska—Rivière-du-Loup),Bloc Québécois,Yea,
Ms. Jean Crowder (Nanaimo—Cowichan),NDP,Yea,
Mr. Roy Cullen (Etobicoke North),Liberal,Nay,
Mr. John Cummins (Delta—Richmond East),Conservative,Yea,
Mr. Rodger Cuzner (Cape Breton—Canso),Liberal,Nay,
Mr. Jean-Claude D'Amours (Madawaska—Restigouche),Liberal,Nay,
Ms. Libby Davies (Vancouver East),NDP,Yea,
Mr. Stockwell Day (Okanagan—Coquihalla),Conservative,Yea,
Ms. Nicole Demers (Laval),Bloc Québécois,Yea,
Ms. Johanne Deschamps (Laurentides—Labelle),Bloc Québécois,Yea,
Mrs. Bev Desjarlais (Churchill),Independent,Yea,
Mr. Odina Desrochers (Lotbinière—Chutes-de-la-Chaudière),Bloc Québécois,Yea,
Mr. Paul DeVillers (Simcoe North),Liberal,Nay,
Mr. Barry Devolin (Haliburton—Kawartha Lakes—Brock),Conservative,Yea,
Ms. Ruby Dhalla (Brampton—Springdale),Liberal,Nay,
Senator Norman E. Doyle (St. John's East),Conservative,Yea,
Mr. Gilles Duceppe (Laurier—Sainte-Marie),Bloc Québécois,Yea,
Mr. John Duncan (Vancouver Island North),Conservative,Yea,
Mr. Wayne Easter (Malpeque),Liberal,Nay,
Mr. Ruben Efford (Avalon),Liberal,Nay,
Mr. David Emerson (Vancouver Kingsway),Liberal,Nay,
Mr. Ken Epp (Edmonton—Sherwood Park),Conservative,Yea,
Mr. Mark Eyking (Sydney—Victoria),Liberal,Nay,
Ms. Meili Faille (Vaudreuil-Soulanges),Bloc Québécois,Yea,
Ms. Diane Finley (Haldimand—Norfolk),Conservative,Yea,
Mr. Brian Fitzpatrick (Prince Albert),Conservative,Yea,
Mr. Steven Fletcher (Charleswood—St. James—Assiniboia),Conservative,Yea,
Mr. Paul Forseth (New Westminster—Coquitlam),Conservative,Yea,
Ms. Hedy Fry (Vancouver Centre),Liberal,Nay,
Mr. Sébastien Gagnon (Jonquière—Alma),Bloc Québécois,Yea,
Mr. Marcel Gagnon (Saint-Maurice—Champlain),Bloc Québécois,Yea,
Ms. Christiane Gagnon (Québec),Bloc Québécois,Yea,
Mrs. Cheryl Gallant (Renfrew—Nipissing—Pembroke),Conservative,Yea,
Mr. Roger Gallaway (Sarnia—Lambton),Liberal,Yea,
Mr. Roger Gaudet (Montcalm),Bloc Québécois,Yea,
Mr. Michel Gauthier (Roberval—Lac-Saint-Jean),Bloc Québécois,Yea,
Mr. Marc Godbout (Ottawa—Orléans),Liberal,Nay,
Mr. Yvon Godin (Acadie—Bathurst),NDP,Yea,
Mr. Peter Goldring (Edmonton East),Conservative,Yea,
Mr. Gary Goodyear (Cambridge),Conservative,Yea,
Mr. Jim Gouk (British Columbia Southern Interior),Conservative,Yea,
Mr. Gurmant Grewal (Newton—North Delta),Conservative,Yea,
Mrs. Nina Grewal (Fleetwood—Port Kells),Conservative,Yea,
Ms. Albina Guarnieri (Mississauga East—Cooksville),Liberal,Nay,
Ms. Monique Guay (Rivière-du-Nord),Bloc Québécois,Yea,
Mrs. Helena Guergis (Simcoe—Grey),Conservative,Yea,
Mr. Michel Guimond (Montmorency—Charlevoix—Haute-Côte-Nord),Bloc Québécois,Yea,
Mr. Art Hanger (Calgary Northeast),Conservative,Nay,
Mr. Richard Harris (Cariboo—Prince George),Conservative,Yea,
Mr. Loyola Hearn (St. John's South—Mount Pearl),Conservative,Yea,
Mr. Russ Hiebert (South Surrey—White Rock—Cloverdale),Conservative,Yea,
Mr. Jay Hill (Prince George—Peace River),Conservative,Yea,
Mr. Mark Holland (Ajax—Pickering),Liberal,Nay,
Mr. Charles Hubbard (Miramichi),Liberal,Nay,
Mr. Tony Ianno (Trinity—Spadina),Liberal,Nay,
Mr. Rahim Jaffer (Edmonton—Strathcona),Conservative,Yea,
Mr. Brian Jean (Fort McMurray—Athabasca),Conservative,Yea,
Mrs. Marlene Jennings (Notre-Dame-de-Grâce—Lachine),Liberal,Nay,
Mr. Dale Johnston (Wetaskiwin),Conservative,Yea,
Mr. Peter Julian (Burnaby—New Westminster),NDP,Yea,
Mrs. Susan Kadis (Thornhill),Liberal,Nay,
Mr. Randy Kamp (Pitt Meadows—Maple Ridge—Mission),Conservative,Yea,
Mr. Jim Karygiannis (Scarborough—Agincourt),Liberal,Nay,
Mr. Gerald Keddy (South Shore—St. Margaret's),Conservative,Yea,
Mr. Jason Kenney (Calgary Southeast),Conservative,Yea,
Mr. Wajid Khan (Mississauga—Streetsville),Liberal,Nay,
Mr. Ed Komarnicki (Souris—Moose Mountain),Conservative,Yea,
Mr. Maka Kotto (Saint-Lambert),Bloc Québécois,Yea,
Mr. Daryl Kramp (Prince Edward—Hastings),Conservative,Yea,
Mr. Mario Laframboise (Argenteuil—Papineau—Mirabel),Bloc Québécois,Yea,
Ms. Francine Lalonde (La Pointe-de-l'Île),Bloc Québécois,Yea,
Mr. Réal Lapierre (Lévis—Bellechasse),Bloc Québécois,Yea,
Mr. Walt Lastewka (St. Catharines),Liberal,Nay,
Mr. Guy Lauzon (Stormont—Dundas—South Glengarry),Conservative,Yea,
Mrs. Carole Lavallée (Saint-Bruno—Saint-Hubert),Bloc Québécois,Yea,
Mr. Jack Layton (Toronto—Danforth),NDP,Yea,
Mr. Dominic LeBlanc (Beauséjour),Liberal,Nay,
Mr. Derek Lee (Scarborough—Rouge River),Liberal,Nay,
Mr. Marc Lemay (Abitibi—Témiscamingue),Bloc Québécois,Yea,
Mr. Yves Lessard (Chambly—Borduas),Bloc Québécois,Yea,
Mr. Yvon Lévesque (Abitibi—Baie-James—Nunavik—Eeyou),Bloc Québécois,Yea,
Mrs. Judi Longfield (Whitby—Oshawa),Liberal,Nay,
Mr. Yvan Loubier (Saint-Hyacinthe—Bagot),Bloc Québécois,Yea,
Mr. Tom Lukiwski (Regina—Lumsden—Lake Centre),Conservative,Yea,
Mr. James Lunney (Nanaimo—Alberni),Conservative,Yea,
Mr. Lawrence MacAulay (Cardigan),Liberal,Nay,
Mr. Peter MacKay (Central Nova),Conservative,Yea,
Mr. Dave MacKenzie (Oxford),Conservative,Yea,
Mr. Paul Harold Macklin (Northumberland—Quinte West),Liberal,Nay,
Mr. Gurbax Malhi (Bramalea—Gore—Malton),Liberal,Nay,
Mr. John Maloney (Welland),Liberal,Nay,
Mr. Richard Marceau (Charlesbourg—Haute-Saint-Charles),Bloc Québécois,Yea,
Mr. Inky Mark (Dauphin—Swan River—Marquette),Conservative,Yea,
Ms. Diane Marleau (Sudbury),Liberal,Nay,
Mr. Keith Martin (Esquimalt—Juan de Fuca),Liberal,Nay,
Mr. Tony Martin (Sault Ste. Marie),NDP,Yea,
Mr. Brian Masse (Windsor West),NDP,Yea,
Mr. John McCallum (Markham—Unionville),Liberal,Nay,
Ms. Alexa McDonough (Halifax),NDP,Yea,
Mr. David McGuinty (Ottawa South),Liberal,Nay,
Mr. John McKay (Scarborough—Guildwood),Liberal,Nay,
Mr. Dan McTeague (Pickering—Scarborough East),Liberal,Nay,
Mr. Réal Ménard (Hochelaga),Bloc Québécois,Yea,
Mr. Serge Ménard (Marc-Aurèle-Fortin),Bloc Québécois,Yea,
Mr. Ted Menzies (Macleod),Conservative,Yea,
Mr. Rob Merrifield (Yellowhead),Conservative,Yea,
Mr. Larry Miller (Bruce—Grey—Owen Sound),Conservative,Yea,
Mr. Bob Mills (Red Deer),Conservative,Yea,
Ms. Maria Minna (Beaches—East York),Liberal,Nay,
Mr. James Moore (Port Moody—Westwood—Port Coquitlam),Conservative,Yea,
Mr. Rob Moore (Fundy Royal),Conservative,Yea,
Ms. Anita Neville (Winnipeg South Centre),Liberal,Nay,
Mr. Rob Nicholson (Niagara Falls),Conservative,Yea,
Mr. Deepak Obhrai (Calgary East),Conservative,Yea,
Mr. Gordon O'Connor (Carleton—Mississippi Mills),Conservative,Yea,
Ms. Bev Oda (Durham),Conservative,Yea,
Mr. Stephen Owen (Vancouver Quadra),Liberal,Nay,
Mr. Brian Pallister (Portage—Lisgar),Conservative,Yea,
Mr. Pierre Paquette (Joliette),Bloc Québécois,Yea,
Mrs. Carolyn Parrish (Mississauga—Erindale),Independent,Nay,
Mr. Bernard Patry (Pierrefonds—Dollard),Liberal,Nay,
Mr. Charlie Penson (Peace River),Conservative,Yea,
Mr. Gilles-A. Perron (Rivière-des-Mille-Îles),Bloc Québécois,Yea,
Mr. Jim Peterson (Willowdale),Liberal,Nay,
Ms. Pauline Picard (Drummond),Bloc Québécois,Yea,
Mr. Louis Plamondon (Bas-Richelieu—Nicolet—Bécancour),Bloc Québécois,Yea,
Mr. Pierre Poilievre (Nepean—Carleton),Conservative,Yea,
Ms. Denise Poirier-Rivard (Châteauguay—Saint-Constant),Bloc Québécois,Yea,
Mr. Russ Powers (Ancaster—Dundas—Flamborough—Westdale),Liberal,Nay,
Mr. Joe Preston (Elgin—Middlesex—London),Conservative,Yea,
Mr. Marcel Proulx (Hull—Aylmer),Liberal,Yea,
Mr. James Rajotte (Edmonton—Leduc),Conservative,Yea,
Ms. Yasmin Ratansi (Don Valley East),Liberal,Nay,
Mrs. Karen Redman (Kitchener Centre),Liberal,Nay,
Mr. Scott Reid (Lanark—Frontenac—Lennox and Addington),Conservative,Yea,
Mr. Gerry Ritz (Battlefords—Lloydminster),Conservative,Yea,
Ms. Lucienne Robillard (Westmount—Ville-Marie),Liberal,Nay,
Mr. Pablo Rodriguez (Honoré-Mercier),Liberal,Nay,
Mr. Anthony Rota (Nipissing—Timiskaming),Liberal,Nay,
Mr. Jean-Yves Roy (Haute-Gaspésie—La Mitis—Matane—Matapédia),Bloc Québécois,Yea,
Mr. Todd Russell (Labrador),Liberal,Yea,
Mr. Benoît Sauvageau (Repentigny),Bloc Québécois,Yea,
Mr. Michael Savage (Dartmouth—Cole Harbour),Liberal,Nay,
Mr. Andy Savoy (Tobique—Mactaquac),Liberal,Nay,
Mr. Francis Scarpaleggia (Lac-Saint-Louis),Liberal,Nay,
Mr. Gary Schellenberger (Perth—Wellington),Conservative,Yea,
Mr. Werner Schmidt (Kelowna—Lake Country),Conservative,Yea,
Ms. Judy A. Sgro (York West),Liberal,Nay,
Mr. Bill Siksay (Burnaby—Douglas),NDP,Yea,
Mr. Mario Silva (Davenport),Liberal,Nay,
Mr. Raymond Simard (Saint Boniface),Liberal,Nay,
Mr. Christian Simard (Beauport—Limoilou),Bloc Québécois,Yea,
Mrs. Carol Skelton (Saskatoon—Rosetown—Biggar),Conservative,Yea,
Mrs. Joy Smith (Kildonan—St. Paul),Conservative,Yea,
Mr. David Smith (Pontiac),Liberal,Nay,
Mr. Kevin Sorenson (Crowfoot),Conservative,Yea,
Mr. Lloyd St. Amand (Brant),Liberal,Nay,
Mr. Brent St. Denis (Algoma—Manitoulin—Kapuskasing),Liberal,Nay,
Ms. Caroline St-Hilaire (Longueuil—Pierre-Boucher),Bloc Québécois,Yea,
Mr. Peter Stoffer (Sackville—Eastern Shore),NDP,Yea,
Ms. Belinda Stronach (Newmarket—Aurora),Liberal,Nay,
Mr. Paul Szabo (Mississauga South),Liberal,Nay,
Mr. Andrew Telegdi (Kitchener—Waterloo),Liberal,Nay,
Mr. Lui Temelkovski (Oak Ridges—Markham),Liberal,Nay,
Mr. Robert Thibault (West Nova),Liberal,Nay,
Ms. Louise Thibault (Rimouski-Neigette—Témiscouata—Les Basques),Bloc Québécois,Yea,
Mr. Myron Thompson (Wild Rose),Conservative,Yea,
Mr. Greg Thompson (New Brunswick Southwest),Conservative,Yea,
Mr. David Tilson (Dufferin—Caledon),Conservative,Nay,
Mr. Vic Toews (Provencher),Conservative,Yea,
Mr. Alan Tonks (York South—Weston),Liberal,Yea,
Ms. Paddy Torsney (Burlington),Liberal,Nay,
Mr. Brad Trost (Saskatoon—Humboldt),Conservative,Nay,
Mr. Merv Tweed (Brandon—Souris),Conservative,Yea,
Mrs. Rose-Marie Ur (Lambton—Kent—Middlesex),Liberal,Nay,
Mr. Tony Valeri (Hamilton East—Stoney Creek),Liberal,Nay,
Mr. Roger Valley (Kenora),Liberal,Nay,
Mr. Peter Van Loan (York—Simcoe),Conservative,Yea,
Mr. Maurice Vellacott (Saskatoon—Wanuskewin),Conservative,Yea,
Mr. Robert Vincent (Shefford),Bloc Québécois,Yea,
Mr. Mark Warawa (Langley),Conservative,Yea,
Ms. Judy Wasylycia-Leis (Winnipeg North),NDP,Yea,
Mr. Jeff Watson (Essex),Conservative,Yea,
Mr. Bryon Wilfert (Richmond Hill),Liberal,Nay,
Mr. John G. Williams (Edmonton—St. Albert),Conservative,Yea,
Mrs. Lynne Yelich (Blackstrap),Conservative,Yea,
Mr. Paul Zed (Saint John),Liberal,Yea,
