Member of Parliament,Political Affiliation,Member Voted,Paired
Mr. Dan Albas (Central Okanagan—Similkameen—Nicola),Conservative,Yea,
Mr. John Aldag (Cloverdale—Langley City),Liberal,Nay,
Mr. Omar Alghabra (Mississauga Centre),Liberal,Nay,
Mr. Dean Allison (Niagara West),Conservative,Yea,
Mr. William Amos (Pontiac),Liberal,Nay,
Mr. Gary Anandasangaree (Scarborough—Rouge Park),Liberal,Nay,
Mr. René Arseneault (Madawaska—Restigouche),Liberal,Nay,
Mr. Chandra Arya (Nepean),Liberal,Nay,
Mr. Ramez Ayoub (Thérèse-De Blainville),Liberal,Nay,
Mr. Vance Badawey (Niagara Centre),Liberal,Nay,
Mr. Larry Bagnell (Yukon),Liberal,Nay,
Mr. Michael Barrett (Leeds—Grenville—Thousand Islands and Rideau Lakes),Conservative,Yea,
Mr. Frank Baylis (Pierrefonds—Dollard),Liberal,Nay,
Mr. Terry Beech (Burnaby North—Seymour),Liberal,Nay,
Ms. Rachel Bendayan (Outremont),Liberal,Nay,
Ms. Carolyn Bennett (Toronto—St. Paul's),Liberal,Nay,
Mr. James Bezan (Selkirk—Interlake—Eastman),Conservative,Yea,
Ms. Marie-Claude Bibeau (Compton—Stanstead),Liberal,Nay,
Mr. Chris Bittle (St. Catharines),Liberal,Nay,
Mr. Bill Blair (Scarborough Southwest),Liberal,Nay,
Mr. Randy Boissonnault (Edmonton Centre),Liberal,Nay,
Mr. Mike Bossio (Hastings—Lennox and Addington),Liberal,Nay,
Mrs. Sylvie Boucher (Beauport—Côte-de-Beaupré—Île d'Orléans—Charlevoix),Conservative,Yea,
Mr. Michel Boudrias (Terrebonne),Bloc Québécois,Nay,
Mr. Bob Bratina (Hamilton East—Stoney Creek),Liberal,Nay,
Mr. Pierre Breton (Shefford),Liberal,Nay,
Mr. Blaine Calkins (Red Deer—Lacombe),Conservative,Yea,
Mr. Jim Carr (Winnipeg South Centre),Liberal,Nay,
Mr. Bill Casey (Cumberland—Colchester),Liberal,Nay,
Mr. Sean Casey (Charlottetown),Liberal,Nay,
Ms. Bardish Chagger (Waterloo),Liberal,Nay,
Mr. François-Philippe Champagne (Saint-Maurice—Champlain),Liberal,Nay,
Mr. Shaun Chen (Scarborough North),Liberal,Nay,
Mr. Michael Chong (Wellington—Halton Hills),Conservative,Yea,
Mr. François Choquette (Drummond),NDP,Nay,
Mr. Michael Cooper (St. Albert—Edmonton),Conservative,Yea,
Mr. Serge Cormier (Acadie—Bathurst),Liberal,Nay,
Mr. Nathan Cullen (Skeena—Bulkley Valley),NDP,Nay,
Mr. Rodger Cuzner (Cape Breton—Canso),Liberal,Nay,
Ms. Julie Dabrusin (Toronto—Danforth),Liberal,Nay,
Ms. Pam Damoff (Oakville North—Burlington),Liberal,Nay,
Mr. Scot Davidson (York—Simcoe),Conservative,Yea,
Mr. Matt DeCourcey (Fredericton),Liberal,Nay,
Mr. Gérard Deltell (Louis-Saint-Laurent),Conservative,Yea,
Mr. Sukh Dhaliwal (Surrey—Newton),Liberal,Nay,
Ms. Anju Dhillon (Dorval—Lachine—LaSalle),Liberal,Nay,
Mr. Kerry Diotte (Edmonton Griesbach),Conservative,Yea,
Mr. Todd Doherty (Cariboo—Prince George),Conservative,Yea,
Mr. Francis Drouin (Glengarry—Prescott—Russell),Liberal,Nay,
Mr. Emmanuel Dubourg (Bourassa),Liberal,Nay,
Mr. Jean-Yves Duclos (Québec),Liberal,Nay,
Mr. Terry Duguid (Winnipeg South),Liberal,Nay,
Ms. Kirsty Duncan (Etobicoke North),Liberal,Nay,
Mr. Pierre-Luc Dusseault (Sherbrooke),NDP,Nay,
Ms. Julie Dzerowicz (Davenport),Liberal,Nay,
Mr. Wayne Easter (Malpeque),Liberal,Nay,
Mr. Ali Ehsassi (Willowdale),Liberal,Nay,
Mr. Fayçal El-Khoury (Laval—Les Îles),Liberal,Nay,
Mr. Neil Ellis (Bay of Quinte),Liberal,Nay,
Mr. Nathaniel Erskine-Smith (Beaches—East York),Liberal,Nay,
Mr. Mark Eyking (Sydney—Victoria),Liberal,Nay,
Mr. Doug Eyolfson (Charleswood—St. James—Assiniboia—Headingley),Liberal,Nay,
Mr. Greg Fergus (Hull—Aylmer),Liberal,Nay,
Mr. Pat Finnigan (Miramichi—Grand Lake),Liberal,Nay,
Mr. Darren Fisher (Dartmouth—Cole Harbour),Liberal,Nay,
Mr. Peter Fonseca (Mississauga East—Cooksville),Liberal,Nay,
Mrs. Mona Fortier (Ottawa—Vanier),Liberal,Nay,
Mr. Rhéal Fortin (Rivière-du-Nord),Bloc Québécois,,Paired
Mr. Peter Fragiskatos (London North Centre),Liberal,Nay,
Mr. Sean Fraser (Central Nova),Liberal,Nay,
Mr. Colin Fraser (West Nova),Liberal,Nay,
Ms. Chrystia Freeland (University—Rosedale),Liberal,Nay,
Ms. Hedy Fry (Vancouver Centre),Liberal,,Paired
Mrs. Cheryl Gallant (Renfrew—Nipissing—Pembroke),Conservative,Yea,
Mr. Marc Garneau (Notre-Dame-de-Grâce—Westmount),Liberal,Nay,
Mr. Bernard Généreux (Montmagny—L'Islet—Kamouraska—Rivière-du-Loup),Conservative,Yea,
Mr. Mark Gerretsen (Kingston and the Islands),Liberal,Nay,
Mrs. Marilène Gill (Manicouagan),Bloc Québécois,,Paired
Mr. Joël Godin (Portneuf—Jacques-Cartier),Conservative,Yea,
Ms. Pamela Goldsmith-Jones (West Vancouver—Sunshine Coast—Sea to Sky Country),Liberal,Nay,
Mr. Ralph Goodale (Regina—Wascana),Liberal,Nay,
Mr. Jacques Gourde (Lévis—Lotbinière),Conservative,Yea,
Mr. David de Burgh Graham (Laurentides—Labelle),Liberal,Nay,
Ms. Patty Hajdu (Thunder Bay—Superior North),Liberal,Nay,
Mr. Ken Hardie (Fleetwood—Port Kells),Liberal,Nay,
Mr. Richard Hébert (Lac-Saint-Jean),Liberal,Nay,
Mr. Kent Hehr (Calgary Centre),Liberal,Nay,
Mr. Gordie Hogg (South Surrey—White Rock),Liberal,Nay,
Mr. Mark Holland (Ajax),Liberal,Nay,
Mr. Anthony Housefather (Mount Royal),Liberal,Nay,
Mrs. Carol Hughes (Algoma—Manitoulin—Kapuskasing),NDP,Nay,
Mr. Ahmed Hussen (York South—Weston),Liberal,Nay,
Ms. Gudie Hutchings (Long Range Mountains),Liberal,Nay,
Mr. Angelo Iacono (Alfred-Pellan),Liberal,Nay,
Mr. Gord Johns (Courtenay—Alberni),NDP,Nay,
Ms. Mélanie Joly (Ahuntsic-Cartierville),Liberal,Nay,
Ms. Yvonne Jones (Labrador),Liberal,Nay,
Mrs. Bernadette Jordan (South Shore—St. Margarets),Liberal,Nay,
Mr. Majid Jowhari (Richmond Hill),Liberal,Nay,
Mr. Peter Julian (New Westminster—Burnaby),NDP,Nay,
Ms. Iqra Khalid (Mississauga—Erin Mills),Liberal,Nay,
Ms. Kamal Khera (Brampton West),Liberal,Nay,
Mr. Tom Kmiec (Calgary Shepard),Conservative,Yea,
Ms. Jenny Kwan (Vancouver East),NDP,Nay,
Mr. David Lametti (LaSalle—Émard—Verdun),Liberal,Nay,
Mr. Kevin Lamoureux (Winnipeg North),Liberal,Nay,
Ms. Linda Lapointe (Rivière-des-Mille-Îles),Liberal,Nay,
Mr. Dominic LeBlanc (Beauséjour),Liberal,,Paired
Mrs. Diane Lebouthillier (Gaspésie—Les Îles-de-la-Madeleine),Liberal,Nay,
Mr. Paul Lefebvre (Sudbury),Liberal,Nay,
Mr. Andrew Leslie (Orléans),Liberal,Nay,
Mr. Michael Levitt (York Centre),Liberal,Nay,
Mr. Joël Lightbound (Louis-Hébert),Liberal,Nay,
Mr. Dane Lloyd (Sturgeon River—Parkland),Conservative,Yea,
Mr. Ben Lobb (Huron—Bruce),Conservative,Yea,
Mrs. Alaina Lockhart (Fundy Royal),Liberal,Nay,
Mr. Wayne Long (Saint John—Rothesay),Liberal,Nay,
Mr. Lloyd Longfield (Guelph),Liberal,Nay,
Ms. Karen Ludwig (New Brunswick Southwest),Liberal,Nay,
Mr. Steven MacKinnon (Gatineau),Liberal,Nay,
Mr. Larry Maguire (Brandon—Souris),Conservative,Yea,
Mr. Richard Martel (Chicoutimi—Le Fjord),Conservative,Yea,
Mr. Rémi Massé (Avignon—La Mitis—Matane—Matapédia),Liberal,Nay,
Mr. Bryan May (Cambridge),Liberal,Nay,
Ms. Elizabeth May (Saanich—Gulf Islands),Green Party,Nay,
Mr. Kelly McCauley (Edmonton West),Conservative,Yea,
Mrs. Karen McCrimmon (Kanata—Carleton),Liberal,Nay,
Mr. Ken McDonald (Avalon),Liberal,Nay,
Mr. David McGuinty (Ottawa South),Liberal,Nay,
Mr. John McKay (Scarborough—Guildwood),Liberal,Nay,
Ms. Catherine McKenna (Ottawa Centre),Liberal,Nay,
Mr. Ron McKinnon (Coquitlam—Port Coquitlam),Liberal,Nay,
Mr. Michael McLeod (Northwest Territories),Liberal,Nay,
Mrs. Alexandra Mendès (Brossard—Saint-Lambert),Liberal,Nay,
Mr. Marco Mendicino (Eglinton—Lawrence),Liberal,Nay,
Ms. MaryAnn Mihychuk (Kildonan—St. Paul),Liberal,Nay,
Mr. Marc Miller (Ville-Marie—Le Sud-Ouest—Île-des-Soeurs),Liberal,Nay,
Mr. Bill Morneau (Toronto Centre),Liberal,Nay,
Mr. Robert Morrissey (Egmont),Liberal,Nay,
Mr. Glen Motz (Medicine Hat—Cardston—Warner),Conservative,Yea,
Ms. Joyce Murray (Vancouver Quadra),Liberal,Nay,
Mr. John Nater (Perth—Wellington),Conservative,Yea,
Mr. Robert Nault (Kenora),Liberal,Nay,
Mr. Rob Nicholson (Niagara Falls),Conservative,Yea,
Mr. Alexander Nuttall (Barrie—Springwater—Oro-Medonte),Conservative,Yea,
Ms. Jennifer O'Connell (Pickering—Uxbridge),Liberal,Nay,
Mr. John Oliver (Oakville),Liberal,Nay,
Mr. Seamus O'Regan (St. John's South—Mount Pearl),Liberal,Nay,
Mr. Robert-Falcon Ouellette (Winnipeg Centre),Liberal,Nay,
Mr. Denis Paradis (Brome—Missisquoi),Liberal,Nay,
Mr. Pierre Paul-Hus (Charlesbourg—Haute-Saint-Charles),Conservative,Yea,
Ms. Monique Pauzé (Repentigny),Bloc Québécois,Nay,
Mr. Joe Peschisolido (Steveston—Richmond East),Liberal,Nay,
Mr. Kyle Peterson (Newmarket—Aurora),Liberal,Nay,
Mr. Michel Picard (Montarville),Liberal,Nay,
Mr. Jean-Claude Poissant (La Prairie),Liberal,Nay,
Ms. Carla Qualtrough (Delta),Liberal,Nay,
Ms. Yasmin Ratansi (Don Valley East),Liberal,Nay,
Mr. Alain Rayes (Richmond—Arthabaska),Conservative,Yea,
Mr. Scott Reid (Lanark—Frontenac—Kingston),Conservative,Yea,
Mr. Jean Rioux (Saint-Jean),Liberal,Nay,
Mr. Yves Robillard (Marc-Aurèle-Fortin),Liberal,Nay,
Mr. Pablo Rodriguez (Honoré-Mercier),Liberal,Nay,
Mr. Churence Rogers (Bonavista—Burin—Trinity),Liberal,Nay,
Mrs. Sherry Romanado (Longueuil—Charles-LeMoyne),Liberal,Nay,
Mr. Anthony Rota (Nipissing—Timiskaming),Liberal,Nay,
Ms. Kim Rudd (Northumberland—Peterborough South),Liberal,Nay,
Mr. Dan Ruimy (Pitt Meadows—Maple Ridge),Liberal,Nay,
Mr. Don Rusnak (Thunder Bay—Rainy River),Liberal,Nay,
Ms. Ruby Sahota (Brampton North),Liberal,Nay,
Mr. Raj Saini (Kitchener Centre),Liberal,Nay,
Mr. Darrell Samson (Sackville—Preston—Chezzetcook),Liberal,Nay,
Mr. Ramesh Sangha (Brampton Centre),Liberal,Nay,
Ms. Brigitte Sansoucy (Saint-Hyacinthe—Bagot),NDP,Nay,
Mr. Randeep Sarai (Surrey Centre),Liberal,Nay,
Mr. Francis Scarpaleggia (Lac-Saint-Louis),Liberal,Nay,
Mr. Peter Schiefke (Vaudreuil—Soulanges),Liberal,Nay,
Mrs. Deborah Schulte (King—Vaughan),Liberal,Nay,
Mr. Marc Serré (Nickel Belt),Liberal,Nay,
Mrs. Brenda Shanahan (Châteauguay—Lacolle),Liberal,Nay,
Mr. Terry Sheehan (Sault Ste. Marie),Liberal,Nay,
Mr. Bev Shipley (Lambton—Kent—Middlesex),Conservative,Yea,
Ms. Sonia Sidhu (Brampton South),Liberal,Nay,
Mr. Gagan Sikand (Mississauga—Streetsville),Liberal,Nay,
Mr. Scott Simms (Coast of Bays—Central—Notre Dame),Liberal,Nay,
Mr. Amarjeet Sohi (Edmonton Mill Woods),Liberal,Nay,
Mr. Francesco Sorbara (Vaughan—Woodbridge),Liberal,Nay,
Mr. Sven Spengemann (Mississauga—Lakeshore),Liberal,Nay,
Mr. Bruce Stanton (Simcoe North),Conservative,Yea,
Mr. Gabriel Ste-Marie (Joliette),Bloc Québécois,Nay,
Mrs. Shannon Stubbs (Lakeland),Conservative,Yea,
Mr. Marwan Tabbara (Kitchener South—Hespeler),Liberal,Nay,
Mr. Geng Tan (Don Valley North),Liberal,Nay,
Ms. Filomena Tassi (Hamilton West—Ancaster—Dundas),Liberal,Nay,
Ms. Rachael Thomas (Lethbridge),Conservative,Yea,
Mr. David Tilson (Dufferin—Caledon),Conservative,Yea,
Ms. Anita Vandenbeld (Ottawa West—Nepean),Liberal,Nay,
Mr. Adam Vaughan (Spadina—Fort York),Liberal,Nay,
Mr. Arif Virani (Parkdale—High Park),Liberal,Nay,
Mrs. Cathay Wagantall (Yorkton—Melville),Conservative,Yea,
Mr. Chris Warkentin (Grande Prairie—Mackenzie),Conservative,Yea,
Mr. Nick Whalen (St. John's East),Liberal,Nay,
Mr. Borys Wrzesnewskyj (Etobicoke Centre),Liberal,Nay,
Ms. Jean Yip (Scarborough—Agincourt),Liberal,Nay,
Ms. Kate Young (London West),Liberal,Nay,
Mr. Bob Zimmer (Prince George—Peace River—Northern Rockies),Conservative,Yea,
