Member of Parliament,Political Affiliation,Member Voted,Paired
Mr. Ziad Aboultaif (Edmonton Manning),Conservative,Nay,
Mr. Harold Albrecht (Kitchener—Conestoga),Conservative,Nay,
Mr. John Aldag (Cloverdale—Langley City),Liberal,Yea,
Mr. Omar Alghabra (Mississauga Centre),Liberal,Yea,
Ms. Leona Alleslev (Aurora—Oak Ridges—Richmond Hill),Conservative,Nay,
Mr. William Amos (Pontiac),Liberal,Yea,
Mr. Gary Anandasangaree (Scarborough—Rouge Park),Liberal,Yea,
Mr. David Anderson (Cypress Hills—Grasslands),Conservative,Nay,
Mr. Mel Arnold (North Okanagan—Shuswap),Conservative,Nay,
Mr. Chandra Arya (Nepean),Liberal,Yea,
Mr. Ramez Ayoub (Thérèse-De Blainville),Liberal,Yea,
Mr. Vance Badawey (Niagara Centre),Liberal,Yea,
Mr. Larry Bagnell (Yukon),Liberal,Yea,
Mr. Navdeep Bains (Mississauga—Malton),Liberal,Yea,
Mr. John Barlow (Foothills),Conservative,Nay,
Mr. Frank Baylis (Pierrefonds—Dollard),Liberal,Yea,
Ms. Carolyn Bennett (Toronto—St. Paul's),Liberal,Yea,
Ms. Candice Bergen (Portage—Lisgar),Conservative,Nay,
Mr. Luc Berthold (Mégantic—L'Érable),Conservative,Nay,
Mr. James Bezan (Selkirk—Interlake—Eastman),Conservative,Nay,
Ms. Marie-Claude Bibeau (Compton—Stanstead),Liberal,Yea,
Mr. Chris Bittle (St. Catharines),Liberal,Yea,
Mr. Daniel Blaikie (Elmwood—Transcona),NDP,Nay,
Mr. Bill Blair (Scarborough Southwest),Liberal,Yea,
Ms. Rachel Blaney (North Island—Powell River),NDP,Nay,
Mr. Steven Blaney (Bellechasse—Les Etchemins—Lévis),Conservative,Nay,
Mr. Randy Boissonnault (Edmonton Centre),Liberal,Yea,
Mr. Mike Bossio (Hastings—Lennox and Addington),Liberal,Yea,
Ms. Marjolaine Boutin-Sweet (Hochelaga),NDP,Nay,
Mr. John Brassard (Barrie—Innisfil),Conservative,Nay,
Mr. Bob Bratina (Hamilton East—Stoney Creek),Liberal,Yea,
Mr. Pierre Breton (Shefford),Liberal,Yea,
Mr. Scott Brison (Kings—Hants),Liberal,Yea,
Ms. Ruth Ellen Brosseau (Berthier—Maskinongé),NDP,Nay,
Mrs. Celina Caesar-Chavannes (Whitby),Liberal,Yea,
Mr. Blaine Calkins (Red Deer—Lacombe),Conservative,Nay,
Mr. Richard Cannings (South Okanagan—West Kootenay),NDP,Nay,
Mr. Guy Caron (Rimouski-Neigette—Témiscouata—Les Basques),NDP,Nay,
Mr. Jim Carr (Winnipeg South Centre),Liberal,Yea,
Mr. Colin Carrie (Oshawa),Conservative,Nay,
Mr. Sean Casey (Charlottetown),Liberal,Yea,
Mr. Bill Casey (Cumberland—Colchester),Liberal,Yea,
Ms. Bardish Chagger (Waterloo),Liberal,Yea,
Mr. François-Philippe Champagne (Saint-Maurice—Champlain),Liberal,Yea,
Mr. Michael Chong (Wellington—Halton Hills),Conservative,Nay,
Mr. François Choquette (Drummond),NDP,Nay,
Mr. David Christopherson (Hamilton Centre),NDP,Nay,
Mr. Alupa Clarke (Beauport—Limoilou),Conservative,Nay,
Mr. Michael Cooper (St. Albert—Edmonton),Conservative,Nay,
Mr. Serge Cormier (Acadie—Bathurst),Liberal,,Paired
Mr. Nathan Cullen (Skeena—Bulkley Valley),NDP,Nay,
Mr. Rodger Cuzner (Cape Breton—Canso),Liberal,Yea,
Ms. Julie Dabrusin (Toronto—Danforth),Liberal,Yea,
Ms. Pam Damoff (Oakville North—Burlington),Liberal,Yea,
Mr. Matt DeCourcey (Fredericton),Liberal,Yea,
Mr. Sukh Dhaliwal (Surrey—Newton),Liberal,Yea,
Ms. Anju Dhillon (Dorval—Lachine—LaSalle),Liberal,Yea,
Mr. Kerry Diotte (Edmonton Griesbach),Conservative,Nay,
Mr. Todd Doherty (Cariboo—Prince George),Conservative,Nay,
Mr. Earl Dreeshen (Red Deer—Mountain View),Conservative,Nay,
Mr. Francis Drouin (Glengarry—Prescott—Russell),Liberal,Yea,
Mr. Matthew Dubé (Beloeil—Chambly),NDP,Nay,
Mr. Emmanuel Dubourg (Bourassa),Liberal,Yea,
Mr. Jean-Yves Duclos (Québec),Liberal,Yea,
Mr. Terry Duguid (Winnipeg South),Liberal,Yea,
Ms. Kirsty Duncan (Etobicoke North),Liberal,Yea,
Ms. Linda Duncan (Edmonton Strathcona),NDP,Nay,
Mr. Pierre-Luc Dusseault (Sherbrooke),NDP,Nay,
Mr. Scott Duvall (Hamilton Mountain),NDP,Nay,
Ms. Julie Dzerowicz (Davenport),Liberal,Yea,
Mr. Wayne Easter (Malpeque),Liberal,Yea,
Mr. Jim Eglinski (Yellowhead),Conservative,Nay,
Mr. Ali Ehsassi (Willowdale),Liberal,Yea,
Mr. Fayçal El-Khoury (Laval—Les Îles),Liberal,Yea,
Mr. Neil Ellis (Bay of Quinte),Liberal,Yea,
Mr. Nathaniel Erskine-Smith (Beaches—East York),Liberal,Yea,
Mr. Mark Eyking (Sydney—Victoria),Liberal,Yea,
Mr. Doug Eyolfson (Charleswood—St. James—Assiniboia—Headingley),Liberal,Yea,
Mr. Ted Falk (Provencher),Conservative,Nay,
Mr. Greg Fergus (Hull—Aylmer),Liberal,Yea,
Mr. Andy Fillmore (Halifax),Liberal,Yea,
Mr. Pat Finnigan (Miramichi—Grand Lake),Liberal,Yea,
Mr. Darren Fisher (Dartmouth—Cole Harbour),Liberal,Yea,
Mr. Peter Fonseca (Mississauga East—Cooksville),Liberal,Yea,
Mrs. Mona Fortier (Ottawa—Vanier),Liberal,Yea,
Mr. Peter Fragiskatos (London North Centre),Liberal,Yea,
Mr. Colin Fraser (West Nova),Liberal,Yea,
Mr. Sean Fraser (Central Nova),Liberal,Yea,
Ms. Chrystia Freeland (University—Rosedale),Liberal,Yea,
Ms. Hedy Fry (Vancouver Centre),Liberal,Yea,
Mr. Stephen Fuhr (Kelowna—Lake Country),Liberal,Yea,
Mrs. Cheryl Gallant (Renfrew—Nipissing—Pembroke),Conservative,Nay,
Mr. Marc Garneau (Notre-Dame-de-Grâce—Westmount),Liberal,Yea,
Mr. Randall Garrison (Esquimalt—Saanich—Sooke),NDP,Nay,
Mr. Bernard Généreux (Montmagny—L'Islet—Kamouraska—Rivière-du-Loup),Conservative,Nay,
Mr. Garnett Genuis (Sherwood Park—Fort Saskatchewan),Conservative,Nay,
Mr. Mark Gerretsen (Kingston and the Islands),Liberal,Yea,
Mrs. Marilène Gill (Manicouagan),Bloc Québécois,Nay,
Ms. Marilyn Gladu (Sarnia—Lambton),Conservative,Nay,
Mr. Joël Godin (Portneuf—Jacques-Cartier),Conservative,Nay,
Ms. Pamela Goldsmith-Jones (West Vancouver—Sunshine Coast—Sea to Sky Country),Liberal,Yea,
Mr. Ralph Goodale (Regina—Wascana),Liberal,Yea,
Ms. Karina Gould (Burlington),Liberal,Yea,
Mr. Jacques Gourde (Lévis—Lotbinière),Conservative,Nay,
Mr. David de Burgh Graham (Laurentides—Labelle),Liberal,Yea,
Ms. Patty Hajdu (Thunder Bay—Superior North),Liberal,Yea,
Ms. Cheryl Hardcastle (Windsor—Tecumseh),NDP,Nay,
Mr. Ken Hardie (Fleetwood—Port Kells),Liberal,Yea,
Mr. T.J. Harvey (Tobique—Mactaquac),Liberal,Yea,
Mr. Richard Hébert (Lac-Saint-Jean),Liberal,Yea,
Mr. Kent Hehr (Calgary Centre),Liberal,Yea,
Mr. Randy Hoback (Prince Albert),Conservative,Nay,
Mr. Gordie Hogg (South Surrey—White Rock),Liberal,Yea,
Mr. Mark Holland (Ajax),Liberal,Yea,
Mr. Anthony Housefather (Mount Royal),Liberal,Yea,
Mrs. Carol Hughes (Algoma—Manitoulin—Kapuskasing),NDP,Nay,
Ms. Gudie Hutchings (Long Range Mountains),Liberal,Yea,
Mr. Angelo Iacono (Alfred-Pellan),Liberal,Yea,
Mr. Matt Jeneroux (Edmonton Riverbend),Conservative,Nay,
Mr. Gord Johns (Courtenay—Alberni),NDP,Nay,
Ms. Georgina Jolibois (Desnethé—Missinippi—Churchill River),NDP,Nay,
Ms. Mélanie Joly (Ahuntsic-Cartierville),Liberal,Yea,
Ms. Yvonne Jones (Labrador),Liberal,Yea,
Mrs. Bernadette Jordan (South Shore—St. Margarets),Liberal,Yea,
Mr. Majid Jowhari (Richmond Hill),Liberal,Yea,
Mr. Peter Julian (New Westminster—Burnaby),NDP,Nay,
Mr. Pat Kelly (Calgary Rocky Ridge),Conservative,Nay,
Ms. Iqra Khalid (Mississauga—Erin Mills),Liberal,Yea,
Mr. Robert Kitchen (Souris—Moose Mountain),Conservative,Nay,
Mr. Tom Kmiec (Calgary Shepard),Conservative,Nay,
Mrs. Stephanie Kusie (Calgary Midnapore),Conservative,Nay,
Ms. Jenny Kwan (Vancouver East),NDP,Nay,
Ms. Emmanuella Lambropoulos (Saint-Laurent),Liberal,Yea,
Mr. David Lametti (LaSalle—Émard—Verdun),Liberal,Yea,
Mr. Kevin Lamoureux (Winnipeg North),Liberal,Yea,
Ms. Linda Lapointe (Rivière-des-Mille-Îles),Liberal,Yea,
Mr. Stéphane Lauzon (Argenteuil—La Petite-Nation),Liberal,Yea,
Ms. Hélène Laverdière (Laurier—Sainte-Marie),NDP,Nay,
Mr. Dominic LeBlanc (Beauséjour),Liberal,Yea,
Mrs. Diane Lebouthillier (Gaspésie—Les Îles-de-la-Madeleine),Liberal,Yea,
Mr. Paul Lefebvre (Sudbury),Liberal,Yea,
Mr. Andrew Leslie (Orléans),Liberal,Yea,
Mr. Michael Levitt (York Centre),Liberal,Yea,
Mr. Joël Lightbound (Louis-Hébert),Liberal,Yea,
Mr. Dane Lloyd (Sturgeon River—Parkland),Conservative,Nay,
Mr. Ben Lobb (Huron—Bruce),Conservative,Nay,
Mrs. Alaina Lockhart (Fundy Royal),Liberal,Yea,
Mr. Lloyd Longfield (Guelph),Liberal,Yea,
Ms. Karen Ludwig (New Brunswick Southwest),Liberal,Yea,
Mr. Tom Lukiwski (Moose Jaw—Lake Centre—Lanigan),Conservative,Nay,
Mr. Lawrence MacAulay (Cardigan),Liberal,Yea,
Mr. Alistair MacGregor (Cowichan—Malahat—Langford),NDP,Nay,
Mr. Dave MacKenzie (Oxford),Conservative,Nay,
Mr. Steven MacKinnon (Gatineau),Liberal,Yea,
Ms. Sheila Malcolmson (Nanaimo—Ladysmith),NDP,Nay,
Mr. James Maloney (Etobicoke—Lakeshore),Liberal,Yea,
Mr. Richard Martel (Chicoutimi—Le Fjord),Conservative,Nay,
Mr. Rémi Massé (Avignon—La Mitis—Matane—Matapédia),Liberal,Yea,
Mr. Brian Masse (Windsor West),NDP,Nay,
Ms. Irene Mathyssen (London—Fanshawe),NDP,Nay,
Mr. Bryan May (Cambridge),Liberal,Yea,
Mr. Kelly McCauley (Edmonton West),Conservative,Nay,
Mr. Phil McColeman (Brantford—Brant),Conservative,Nay,
Mrs. Karen McCrimmon (Kanata—Carleton),Liberal,Yea,
Mr. Ken McDonald (Avalon),Liberal,Yea,
Mr. David McGuinty (Ottawa South),Liberal,Yea,
Mr. John McKay (Scarborough—Guildwood),Liberal,Yea,
Mr. Ron McKinnon (Coquitlam—Port Coquitlam),Liberal,Yea,
Mr. Michael McLeod (Northwest Territories),Liberal,Yea,
Mrs. Alexandra Mendès (Brossard—Saint-Lambert),Liberal,Yea,
Mr. Marco Mendicino (Eglinton—Lawrence),Liberal,Yea,
Ms. MaryAnn Mihychuk (Kildonan—St. Paul),Liberal,Yea,
Mr. Marc Miller (Ville-Marie—Le Sud-Ouest—Île-des-Soeurs),Liberal,Yea,
Mr. Larry Miller (Bruce—Grey—Owen Sound),Conservative,Nay,
Ms. Maryam Monsef (Peterborough—Kawartha),Liberal,Yea,
Ms. Christine Moore (Abitibi—Témiscamingue),NDP,Nay,
Mr. Bill Morneau (Toronto Centre),Liberal,Yea,
Mr. Robert Morrissey (Egmont),Liberal,Yea,
Mr. Glen Motz (Medicine Hat—Cardston—Warner),Conservative,Nay,
Ms. Joyce Murray (Vancouver Quadra),Liberal,Yea,
Mr. Pierre Nantel (Longueuil—Saint-Hubert),NDP,Nay,
Mrs. Eva Nassif (Vimy),Liberal,Yea,
Mr. John Nater (Perth—Wellington),Conservative,Nay,
Mr. Robert Nault (Kenora),Liberal,Yea,
Ms. Mary Ng (Markham—Thornhill),Liberal,Yea,
Mr. Rob Nicholson (Niagara Falls),Conservative,Nay,
Ms. Jennifer O'Connell (Pickering—Uxbridge),Liberal,Yea,
Mr. Robert Oliphant (Don Valley West),Liberal,Yea,
Mr. John Oliver (Oakville),Liberal,Yea,
Mr. Seamus O'Regan (St. John's South—Mount Pearl),Liberal,Yea,
Mr. Erin O'Toole (Durham),Conservative,Nay,
Mr. Robert-Falcon Ouellette (Winnipeg Centre),Liberal,Yea,
Mr. Denis Paradis (Brome—Missisquoi),Liberal,Yea,
Mr. Pierre Paul-Hus (Charlesbourg—Haute-Saint-Charles),Conservative,Nay,
Ms. Monique Pauzé (Repentigny),Bloc Québécois,,Paired
Mr. Joe Peschisolido (Steveston—Richmond East),Liberal,Yea,
Mr. Kyle Peterson (Newmarket—Aurora),Liberal,Yea,
Ms. Ginette Petitpas Taylor (Moncton—Riverview—Dieppe),Liberal,Yea,
Mrs. Jane Philpott (Markham—Stouffville),Liberal,Yea,
Mr. Michel Picard (Montarville),Liberal,Yea,
Mr. Jean-Claude Poissant (La Prairie),Liberal,Yea,
Ms. Anne Minh-Thu Quach (Salaberry—Suroît),NDP,Nay,
Ms. Carla Qualtrough (Delta),Liberal,Yea,
Ms. Yasmin Ratansi (Don Valley East),Liberal,Yea,
Mr. Scott Reid (Lanark—Frontenac—Kingston),Conservative,Nay,
Ms. Michelle Rempel (Calgary Nose Hill),Conservative,Nay,
Mr. Jean Rioux (Saint-Jean),Liberal,Yea,
Mr. Yves Robillard (Marc-Aurèle-Fortin),Liberal,Yea,
Mr. Churence Rogers (Bonavista—Burin—Trinity),Liberal,Yea,
Mrs. Sherry Romanado (Longueuil—Charles-LeMoyne),Liberal,Yea,
Mr. Anthony Rota (Nipissing—Timiskaming),Liberal,Yea,
Ms. Kim Rudd (Northumberland—Peterborough South),Liberal,Yea,
Mr. Dan Ruimy (Pitt Meadows—Maple Ridge),Liberal,Yea,
Mr. Don Rusnak (Thunder Bay—Rainy River),Liberal,Yea,
Ms. Ruby Sahota (Brampton North),Liberal,Yea,
Mr. Raj Saini (Kitchener Centre),Liberal,Yea,
Mr. Harjit S. Sajjan (Vancouver South),Liberal,Yea,
Mr. Ramesh Sangha (Brampton Centre),Liberal,Yea,
Mr. Randeep Sarai (Surrey Centre),Liberal,Yea,
Mr. Bob Saroya (Markham—Unionville),Conservative,Nay,
Mr. Francis Scarpaleggia (Lac-Saint-Louis),Liberal,Yea,
Mr. Peter Schiefke (Vaudreuil—Soulanges),Liberal,Yea,
Mr. Jamie Schmale (Haliburton—Kawartha Lakes—Brock),Conservative,Nay,
Mrs. Deborah Schulte (King—Vaughan),Liberal,Yea,
Mr. Marc Serré (Nickel Belt),Liberal,Yea,
Ms. Judy A. Sgro (Humber River—Black Creek),Liberal,Yea,
Mrs. Brenda Shanahan (Châteauguay—Lacolle),Liberal,Yea,
Mr. Terry Sheehan (Sault Ste. Marie),Liberal,Yea,
Mr. Martin Shields (Bow River),Conservative,Nay,
Ms. Sonia Sidhu (Brampton South),Liberal,Yea,
Mr. Gagan Sikand (Mississauga—Streetsville),Liberal,Yea,
Mr. Scott Simms (Coast of Bays—Central—Notre Dame),Liberal,Yea,
Mr. Amarjeet Sohi (Edmonton Mill Woods),Liberal,Yea,
Mr. Francesco Sorbara (Vaughan—Woodbridge),Liberal,Yea,
Mr. Kevin Sorenson (Battle River—Crowfoot),Conservative,Nay,
Mr. Sven Spengemann (Mississauga—Lakeshore),Liberal,Yea,
Mr. Bruce Stanton (Simcoe North),Conservative,Nay,
Mr. Gabriel Ste-Marie (Joliette),Bloc Québécois,Nay,
Mr. Mark Strahl (Chilliwack—Hope),Conservative,Nay,
Mrs. Shannon Stubbs (Lakeland),Conservative,Nay,
Mr. David Sweet (Flamborough—Glanbrook),Conservative,Nay,
Mr. Marwan Tabbara (Kitchener South—Hespeler),Liberal,Yea,
Mr. Geng Tan (Don Valley North),Liberal,Yea,
Ms. Filomena Tassi (Hamilton West—Ancaster—Dundas),Liberal,Yea,
Mr. Brad Trost (Saskatoon—University),Conservative,Nay,
Mr. Justin Trudeau (Papineau),Liberal,Yea,
Mr. Dave Van Kesteren (Chatham-Kent—Leamington),Conservative,Nay,
Mr. Dan Vandal (Saint Boniface—Saint Vital),Liberal,Yea,
Ms. Anita Vandenbeld (Ottawa West—Nepean),Liberal,Yea,
Mr. Arnold Viersen (Peace River—Westlock),Conservative,Nay,
Mr. Arif Virani (Parkdale—High Park),Liberal,Yea,
Mrs. Cathay Wagantall (Yorkton—Melville),Conservative,Nay,
Mr. Mark Warawa (Langley—Aldergrove),Conservative,Nay,
Mr. Chris Warkentin (Grande Prairie—Mackenzie),Conservative,Nay,
Mr. Kevin Waugh (Saskatoon—Grasswood),Conservative,Nay,
Mr. Len Webber (Calgary Confederation),Conservative,Nay,
Mr. Erin Weir (Regina—Lewvan),Co-operative Commonwealth Federation,Nay,
Mr. Nick Whalen (St. John's East),Liberal,Yea,
Mr. Jonathan Wilkinson (North Vancouver),Liberal,Yea,
Ms. Jody Wilson-Raybould (Vancouver Granville),Liberal,Yea,
Mrs. Alice Wong (Richmond Centre),Conservative,Nay,
Mr. Borys Wrzesnewskyj (Etobicoke Centre),Liberal,Yea,
Ms. Jean Yip (Scarborough—Agincourt),Liberal,Yea,
Ms. Kate Young (London West),Liberal,Yea,
Mr. David Yurdiga (Fort McMurray—Cold Lake),Conservative,Nay,
Mrs. Salma Zahid (Scarborough Centre),Liberal,Yea,
Mr. Bob Zimmer (Prince George—Peace River—Northern Rockies),Conservative,Nay,
