Member of Parliament,Political Affiliation,Member Voted,Paired
Mr. Harold Albrecht (Kitchener—Conestoga),Conservative,Nay,
Mr. John Aldag (Cloverdale—Langley City),Liberal,Yea,
Mr. Omar Alghabra (Mississauga Centre),Liberal,Yea,
Ms. Leona Alleslev (Aurora—Oak Ridges—Richmond Hill),Conservative,Nay,
Mr. Dean Allison (Niagara West),Conservative,,Paired
Mr. William Amos (Pontiac),Liberal,Yea,
Ms. Niki Ashton (Churchill—Keewatinook Aski),NDP,Yea,
Mr. Larry Bagnell (Yukon),Liberal,Yea,
Mr. Navdeep Bains (Mississauga—Malton),Liberal,Yea,
Mr. Michael Barrett (Leeds—Grenville—Thousand Islands and Rideau Lakes),Conservative,Nay,
Mr. Xavier Barsalou-Duval (Pierre-Boucher—Les Patriotes—Verchères),Bloc Québécois,Nay,
Mr. Frank Baylis (Pierrefonds—Dollard),Liberal,Yea,
Mr. Mario Beaulieu (La Pointe-de-l'Île),Bloc Québécois,Nay,
Mr. Terry Beech (Burnaby North—Seymour),Liberal,Yea,
Ms. Rachel Bendayan (Outremont),Liberal,Yea,
Ms. Carolyn Bennett (Toronto—St. Paul's),Liberal,Yea,
Mr. Bob Benzen (Calgary Heritage),Conservative,Nay,
Mr. Luc Berthold (Mégantic—L'Érable),Conservative,Nay,
Mr. Chris Bittle (St. Catharines),Liberal,Yea,
Mr. Bill Blair (Scarborough Southwest),Liberal,Yea,
Mr. Steven Blaney (Bellechasse—Les Etchemins—Lévis),Conservative,Nay,
Mr. Randy Boissonnault (Edmonton Centre),Liberal,Yea,
Mr. Mike Bossio (Hastings—Lennox and Addington),Liberal,Yea,
Mr. Alexandre Boulerice (Rosemont—La Petite-Patrie),NDP,Yea,
Ms. Marjolaine Boutin-Sweet (Hochelaga),NDP,Yea,
Mr. John Brassard (Barrie—Innisfil),Conservative,Nay,
Mr. Bob Bratina (Hamilton East—Stoney Creek),Liberal,Yea,
Mrs. Celina Caesar-Chavannes (Whitby),Independent,Yea,
Mr. Richard Cannings (South Okanagan—West Kootenay),NDP,Yea,
Mr. Colin Carrie (Oshawa),Conservative,Nay,
Mr. Bill Casey (Cumberland—Colchester),Liberal,Yea,
Mr. Sean Casey (Charlottetown),Liberal,Yea,
Mr. François-Philippe Champagne (Saint-Maurice—Champlain),Liberal,Yea,
Mr. Michael Chong (Wellington—Halton Hills),Conservative,Nay,
Mr. François Choquette (Drummond),NDP,Yea,
Mr. Alupa Clarke (Beauport—Limoilou),Conservative,Nay,
Mr. Michael Cooper (St. Albert—Edmonton),Conservative,Nay,
Mr. Serge Cormier (Acadie—Bathurst),Liberal,Yea,
Mr. Nathan Cullen (Skeena—Bulkley Valley),NDP,Yea,
Mr. Rodger Cuzner (Cape Breton—Canso),Liberal,Yea,
Ms. Julie Dabrusin (Toronto—Danforth),Liberal,Yea,
Ms. Pam Damoff (Oakville North—Burlington),Liberal,Yea,
Mr. Scot Davidson (York—Simcoe),Conservative,Nay,
Mr. Don Davies (Vancouver Kingsway),NDP,Yea,
Mr. Matt DeCourcey (Fredericton),Liberal,Yea,
Mr. Sukh Dhaliwal (Surrey—Newton),Liberal,Yea,
Ms. Anju Dhillon (Dorval—Lachine—LaSalle),Liberal,Yea,
Mr. Kerry Diotte (Edmonton Griesbach),Conservative,Nay,
Mr. Fin Donnelly (Port Moody—Coquitlam),NDP,Yea,
Mr. Francis Drouin (Glengarry—Prescott—Russell),Liberal,Yea,
Mr. Matthew Dubé (Beloeil—Chambly),NDP,Yea,
Mr. Emmanuel Dubourg (Bourassa),Liberal,Yea,
Mr. Terry Duguid (Winnipeg South),Liberal,Yea,
Ms. Kirsty Duncan (Etobicoke North),Liberal,Yea,
Ms. Linda Duncan (Edmonton Strathcona),NDP,Yea,
Mr. Pierre-Luc Dusseault (Sherbrooke),NDP,Yea,
Ms. Julie Dzerowicz (Davenport),Liberal,Yea,
Mr. Jim Eglinski (Yellowhead),Conservative,Nay,
Mr. Ali Ehsassi (Willowdale),Liberal,Yea,
Mr. Fayçal El-Khoury (Laval—Les Îles),Liberal,Yea,
Mr. Neil Ellis (Bay of Quinte),Liberal,Yea,
Mr. Nathaniel Erskine-Smith (Beaches—East York),Liberal,,Paired
Mr. Doug Eyolfson (Charleswood—St. James—Assiniboia—Headingley),Liberal,Yea,
Mr. Greg Fergus (Hull—Aylmer),Liberal,Yea,
Mr. Andy Fillmore (Halifax),Liberal,Yea,
Mr. Pat Finnigan (Miramichi—Grand Lake),Liberal,Yea,
Mr. Darren Fisher (Dartmouth—Cole Harbour),Liberal,Yea,
Mr. Peter Fonseca (Mississauga East—Cooksville),Liberal,Yea,
Mrs. Mona Fortier (Ottawa—Vanier),Liberal,Yea,
Mr. Rhéal Fortin (Rivière-du-Nord),Bloc Québécois,Nay,
Mr. Peter Fragiskatos (London North Centre),Liberal,Yea,
Mr. Sean Fraser (Central Nova),Liberal,Yea,
Ms. Chrystia Freeland (University—Rosedale),Liberal,Yea,
Mr. Stephen Fuhr (Kelowna—Lake Country),Liberal,Yea,
Mrs. Cheryl Gallant (Renfrew—Nipissing—Pembroke),Conservative,Nay,
Mr. Marc Garneau (Notre-Dame-de-Grâce—Westmount),Liberal,Yea,
Mr. Randall Garrison (Esquimalt—Saanich—Sooke),NDP,Yea,
Mr. Garnett Genuis (Sherwood Park—Fort Saskatchewan),Conservative,Nay,
Mr. Mark Gerretsen (Kingston and the Islands),Liberal,Yea,
Mr. Joël Godin (Portneuf—Jacques-Cartier),Conservative,Nay,
Ms. Pamela Goldsmith-Jones (West Vancouver—Sunshine Coast—Sea to Sky Country),Liberal,Yea,
Mr. Ralph Goodale (Regina—Wascana),Liberal,Yea,
Mr. Raj Grewal (Brampton East),Independent,Yea,
Ms. Patty Hajdu (Thunder Bay—Superior North),Liberal,Yea,
Ms. Cheryl Hardcastle (Windsor—Tecumseh),NDP,Yea,
Mr. Richard Hébert (Lac-Saint-Jean),Liberal,Yea,
Mr. Kent Hehr (Calgary Centre),Liberal,Yea,
Mr. Gordie Hogg (South Surrey—White Rock),Liberal,Yea,
Mr. Ahmed Hussen (York South—Weston),Liberal,Yea,
Ms. Gudie Hutchings (Long Range Mountains),Liberal,Yea,
Mr. Angelo Iacono (Alfred-Pellan),Liberal,Yea,
Mr. Gord Johns (Courtenay—Alberni),NDP,Yea,
Ms. Georgina Jolibois (Desnethé—Missinippi—Churchill River),NDP,Yea,
Ms. Mélanie Joly (Ahuntsic-Cartierville),Liberal,Yea,
Ms. Yvonne Jones (Labrador),Liberal,Yea,
Mrs. Bernadette Jordan (South Shore—St. Margarets),Liberal,Yea,
Mr. Majid Jowhari (Richmond Hill),Liberal,Yea,
Mr. Peter Julian (New Westminster—Burnaby),NDP,Yea,
Mr. Pat Kelly (Calgary Rocky Ridge),Conservative,Nay,
Ms. Iqra Khalid (Mississauga—Erin Mills),Liberal,Yea,
Ms. Kamal Khera (Brampton West),Liberal,Yea,
Mr. Mike Lake (Edmonton—Wetaskiwin),Conservative,Nay,
Ms. Emmanuella Lambropoulos (Saint-Laurent),Liberal,Yea,
Mr. David Lametti (LaSalle—Émard—Verdun),Liberal,Yea,
Mr. Kevin Lamoureux (Winnipeg North),Liberal,Yea,
Ms. Linda Lapointe (Rivière-des-Mille-Îles),Liberal,Yea,
Mr. Stéphane Lauzon (Argenteuil—La Petite-Nation),Liberal,Yea,
Mr. Guy Lauzon (Stormont—Dundas—South Glengarry),Conservative,Nay,
Mrs. Diane Lebouthillier (Gaspésie—Les Îles-de-la-Madeleine),Liberal,Yea,
Mr. Andrew Leslie (Orléans),Liberal,,Paired
Mr. Michael Levitt (York Centre),Liberal,Yea,
Mr. Ron Liepert (Calgary Signal Hill),Conservative,Nay,
Mr. Joël Lightbound (Louis-Hébert),Liberal,Yea,
Mr. Ben Lobb (Huron—Bruce),Conservative,Nay,
Mrs. Alaina Lockhart (Fundy Royal),Liberal,Yea,
Mr. Wayne Long (Saint John—Rothesay),Liberal,Yea,
Mr. Lloyd Longfield (Guelph),Liberal,Yea,
Ms. Karen Ludwig (New Brunswick Southwest),Liberal,Yea,
Mr. Lawrence MacAulay (Cardigan),Liberal,Yea,
Mr. Alistair MacGregor (Cowichan—Malahat—Langford),NDP,Yea,
Mr. Larry Maguire (Brandon—Souris),Conservative,Nay,
Mr. James Maloney (Etobicoke—Lakeshore),Liberal,Yea,
Mr. Richard Martel (Chicoutimi—Le Fjord),Conservative,Nay,
Mr. Rémi Massé (Avignon—La Mitis—Matane—Matapédia),Liberal,Yea,
Mr. Brian Masse (Windsor West),NDP,Yea,
Ms. Irene Mathyssen (London—Fanshawe),NDP,Yea,
Ms. Elizabeth May (Saanich—Gulf Islands),Green Party,Yea,
Mr. Bryan May (Cambridge),Liberal,Yea,
Mr. Kelly McCauley (Edmonton West),Conservative,Nay,
Mrs. Karen McCrimmon (Kanata—Carleton),Liberal,Yea,
Mr. Ken McDonald (Avalon),Liberal,Yea,
Mr. David McGuinty (Ottawa South),Liberal,Yea,
Mr. John McKay (Scarborough—Guildwood),Liberal,Yea,
Ms. Catherine McKenna (Ottawa Centre),Liberal,Yea,
Mr. Ron McKinnon (Coquitlam—Port Coquitlam),Liberal,Yea,
Mr. Michael McLeod (Northwest Territories),Liberal,Yea,
Mrs. Alexandra Mendès (Brossard—Saint-Lambert),Liberal,Yea,
Mr. Marco Mendicino (Eglinton—Lawrence),Liberal,Yea,
Mr. Larry Miller (Bruce—Grey—Owen Sound),Conservative,Nay,
Mr. Marc Miller (Ville-Marie—Le Sud-Ouest—Île-des-Soeurs),Liberal,Yea,
Ms. Maryam Monsef (Peterborough—Kawartha),Liberal,Yea,
Ms. Christine Moore (Abitibi—Témiscamingue),NDP,,Paired
Mr. Robert Morrissey (Egmont),Liberal,Yea,
Mr. Glen Motz (Medicine Hat—Cardston—Warner),Conservative,Nay,
Mr. Pierre Nantel (Longueuil—Saint-Hubert),NDP,Yea,
Mr. John Nater (Perth—Wellington),Conservative,Nay,
Mr. Robert Nault (Kenora),Liberal,Yea,
Ms. Mary Ng (Markham—Thornhill),Liberal,Yea,
Mr. Alexander Nuttall (Barrie—Springwater—Oro-Medonte),Conservative,Nay,
Ms. Jennifer O'Connell (Pickering—Uxbridge),Liberal,Yea,
Mr. Robert Oliphant (Don Valley West),Liberal,Yea,
Mr. Seamus O'Regan (St. John's South—Mount Pearl),Liberal,Yea,
Mr. Robert-Falcon Ouellette (Winnipeg Centre),Liberal,Yea,
Mr. Denis Paradis (Brome—Missisquoi),Liberal,Yea,
Mr. Pierre Paul-Hus (Charlesbourg—Haute-Saint-Charles),Conservative,Nay,
Ms. Monique Pauzé (Repentigny),Bloc Québécois,Nay,
Mr. Joe Peschisolido (Steveston—Richmond East),Liberal,Yea,
Mr. Kyle Peterson (Newmarket—Aurora),Liberal,Yea,
Mr. Michel Picard (Montarville),Liberal,Yea,
Mr. Jean-Claude Poissant (La Prairie),Liberal,Yea,
Mr. Alain Rayes (Richmond—Arthabaska),Conservative,Nay,
Mr. Scott Reid (Lanark—Frontenac—Kingston),Conservative,Nay,
Mr. Blake Richards (Banff—Airdrie),Conservative,Nay,
Mr. Jean Rioux (Saint-Jean),Liberal,Yea,
Mr. Yves Robillard (Marc-Aurèle-Fortin),Liberal,Yea,
Mr. Pablo Rodriguez (Honoré-Mercier),Liberal,Yea,
Mr. Churence Rogers (Bonavista—Burin—Trinity),Liberal,Yea,
Mrs. Sherry Romanado (Longueuil—Charles-LeMoyne),Liberal,Yea,
Ms. Kim Rudd (Northumberland—Peterborough South),Liberal,Yea,
Mr. Harjit S. Sajjan (Vancouver South),Liberal,Yea,
Mr. Randeep Sarai (Surrey Centre),Liberal,Yea,
Mr. Francis Scarpaleggia (Lac-Saint-Louis),Liberal,Yea,
Mr. Peter Schiefke (Vaudreuil—Soulanges),Liberal,Yea,
Mr. Jamie Schmale (Haliburton—Kawartha Lakes—Brock),Conservative,Nay,
Mr. Marc Serré (Nickel Belt),Liberal,Yea,
Ms. Judy A. Sgro (Humber River—Black Creek),Liberal,Yea,
Mrs. Brenda Shanahan (Châteauguay—Lacolle),Liberal,Yea,
Mr. Terry Sheehan (Sault Ste. Marie),Liberal,Yea,
Mr. Bev Shipley (Lambton—Kent—Middlesex),Conservative,Nay,
Mr. Jati Sidhu (Mission—Matsqui—Fraser Canyon),Liberal,Yea,
Ms. Sonia Sidhu (Brampton South),Liberal,Yea,
Mr. Gagan Sikand (Mississauga—Streetsville),Liberal,Yea,
Mr. Scott Simms (Coast of Bays—Central—Notre Dame),Liberal,Yea,
Mr. Amarjeet Sohi (Edmonton Mill Woods),Liberal,Yea,
Mr. Francesco Sorbara (Vaughan—Woodbridge),Liberal,Yea,
Mr. Sven Spengemann (Mississauga—Lakeshore),Liberal,Yea,
Mr. Gabriel Ste-Marie (Joliette),Bloc Québécois,Nay,
Mr. Mark Strahl (Chilliwack—Hope),Conservative,Nay,
Mr. David Sweet (Flamborough—Glanbrook),Conservative,Nay,
Mr. Marwan Tabbara (Kitchener South—Hespeler),Liberal,Yea,
Mr. Geng Tan (Don Valley North),Liberal,Yea,
Ms. Filomena Tassi (Hamilton West—Ancaster—Dundas),Liberal,Yea,
Mr. David Tilson (Dufferin—Caledon),Conservative,Nay,
Mr. Brad Trost (Saskatoon—University),Conservative,Nay,
Ms. Karine Trudel (Jonquière),NDP,Yea,
Ms. Anita Vandenbeld (Ottawa West—Nepean),Liberal,Yea,
Mr. Adam Vaughan (Spadina—Fort York),Liberal,Yea,
Mrs. Karen Vecchio (Elgin—Middlesex—London),Conservative,Nay,
Mr. Arif Virani (Parkdale—High Park),Liberal,Yea,
Mr. Mark Warawa (Langley—Aldergrove),Conservative,,Paired
Mr. Chris Warkentin (Grande Prairie—Mackenzie),Conservative,Nay,
Mr. Len Webber (Calgary Confederation),Conservative,Nay,
Mr. Nick Whalen (St. John's East),Liberal,Yea,
Mr. Jonathan Wilkinson (North Vancouver),Liberal,Yea,
Mrs. Alice Wong (Richmond Centre),Conservative,Nay,
Mr. Borys Wrzesnewskyj (Etobicoke Centre),Liberal,Yea,
Ms. Jean Yip (Scarborough—Agincourt),Liberal,Yea,
Ms. Kate Young (London West),Liberal,,Paired
