Member of Parliament,Political Affiliation,Member Voted,Paired
Mr. Harold Albrecht (Kitchener—Conestoga),Conservative,Nay,
Mr. John Aldag (Cloverdale—Langley City),Liberal,Yea,
Mr. Omar Alghabra (Mississauga Centre),Liberal,Yea,
Mr. Dean Allison (Niagara West),Conservative,Nay,
Mr. William Amos (Pontiac),Liberal,Yea,
Mr. Gary Anandasangaree (Scarborough—Rouge Park),Liberal,Yea,
Mr. Mel Arnold (North Okanagan—Shuswap),Conservative,Nay,
Mr. René Arseneault (Madawaska—Restigouche),Liberal,Yea,
Mr. Chandra Arya (Nepean),Liberal,Yea,
Mr. Robert Aubin (Trois-Rivières),NDP,Nay,
Mr. Vance Badawey (Niagara Centre),Liberal,Yea,
Mr. Larry Bagnell (Yukon),Liberal,Yea,
Mr. Navdeep Bains (Mississauga—Malton),Liberal,Yea,
Mr. Xavier Barsalou-Duval (Pierre-Boucher—Les Patriotes—Verchères),Bloc Québécois,Nay,
Mr. Frank Baylis (Pierrefonds—Dollard),Liberal,Yea,
Mr. Mario Beaulieu (La Pointe-de-l'Île),Bloc Québécois,Nay,
Mr. Terry Beech (Burnaby North—Seymour),Liberal,Yea,
Ms. Rachel Bendayan (Outremont),Liberal,Yea,
Ms. Carolyn Bennett (Toronto—St. Paul's),Liberal,Yea,
Ms. Sheri Benson (Saskatoon West),NDP,Nay,
Mr. James Bezan (Selkirk—Interlake—Eastman),Conservative,Nay,
Mr. Chris Bittle (St. Catharines),Liberal,Yea,
Mr. Daniel Blaikie (Elmwood—Transcona),NDP,Nay,
Mr. Bill Blair (Scarborough Southwest),Liberal,Yea,
Ms. Rachel Blaney (North Island—Powell River),NDP,Nay,
Mr. Randy Boissonnault (Edmonton Centre),Liberal,Yea,
Mr. Mike Bossio (Hastings—Lennox and Addington),Liberal,Yea,
Mrs. Sylvie Boucher (Beauport—Côte-de-Beaupré—Île d'Orléans—Charlevoix),Conservative,Nay,
Mr. Alexandre Boulerice (Rosemont—La Petite-Patrie),NDP,Nay,
Mr. Bob Bratina (Hamilton East—Stoney Creek),Liberal,Yea,
Mr. Pierre Breton (Shefford),Liberal,Yea,
Ms. Ruth Ellen Brosseau (Berthier—Maskinongé),NDP,Nay,
Mr. Blaine Calkins (Red Deer—Lacombe),Conservative,Nay,
Mr. Richard Cannings (South Okanagan—West Kootenay),NDP,Nay,
Mr. Guy Caron (Rimouski-Neigette—Témiscouata—Les Basques),NDP,Nay,
Mr. Jim Carr (Winnipeg South Centre),Liberal,Yea,
Mr. Bill Casey (Cumberland—Colchester),Liberal,Yea,
Mr. Sean Casey (Charlottetown),Liberal,Yea,
Ms. Bardish Chagger (Waterloo),Liberal,Yea,
Mr. François-Philippe Champagne (Saint-Maurice—Champlain),Liberal,Yea,
Mr. Shaun Chen (Scarborough North),Liberal,Yea,
Mr. Serge Cormier (Acadie—Bathurst),Liberal,Yea,
Ms. Julie Dabrusin (Toronto—Danforth),Liberal,Yea,
Ms. Pam Damoff (Oakville North—Burlington),Liberal,Yea,
Mr. Matt DeCourcey (Fredericton),Liberal,Yea,
Mr. Sukh Dhaliwal (Surrey—Newton),Liberal,Yea,
Ms. Anju Dhillon (Dorval—Lachine—LaSalle),Liberal,Yea,
Mr. Todd Doherty (Cariboo—Prince George),Conservative,Nay,
Mr. Fin Donnelly (Port Moody—Coquitlam),NDP,Nay,
Mr. Francis Drouin (Glengarry—Prescott—Russell),Liberal,Yea,
Mr. Emmanuel Dubourg (Bourassa),Liberal,Yea,
Mr. Jean-Yves Duclos (Québec),Liberal,Yea,
Ms. Linda Duncan (Edmonton Strathcona),NDP,Nay,
Ms. Kirsty Duncan (Etobicoke North),Liberal,Yea,
Mr. Pierre-Luc Dusseault (Sherbrooke),NDP,Nay,
Ms. Julie Dzerowicz (Davenport),Liberal,Yea,
Mr. Wayne Easter (Malpeque),Liberal,Yea,
Mr. Fayçal El-Khoury (Laval—Les Îles),Liberal,Yea,
Mr. Neil Ellis (Bay of Quinte),Liberal,Yea,
Mr. Nathaniel Erskine-Smith (Beaches—East York),Liberal,Yea,
Mr. Mark Eyking (Sydney—Victoria),Liberal,Yea,
Mr. Doug Eyolfson (Charleswood—St. James—Assiniboia—Headingley),Liberal,Yea,
Mr. Ted Falk (Provencher),Conservative,Nay,
Mr. Greg Fergus (Hull—Aylmer),Liberal,Yea,
Mr. Andy Fillmore (Halifax),Liberal,Yea,
Mr. Pat Finnigan (Miramichi—Grand Lake),Liberal,Yea,
Mr. Darren Fisher (Dartmouth—Cole Harbour),Liberal,Yea,
Mr. Peter Fonseca (Mississauga East—Cooksville),Liberal,Yea,
Mr. Rhéal Fortin (Rivière-du-Nord),Bloc Québécois,Nay,
Mr. Peter Fragiskatos (London North Centre),Liberal,Yea,
Mr. Sean Fraser (Central Nova),Liberal,Yea,
Mr. Colin Fraser (West Nova),Liberal,Yea,
Ms. Hedy Fry (Vancouver Centre),Liberal,,Paired
Mr. Stephen Fuhr (Kelowna—Lake Country),Liberal,Yea,
Mrs. Cheryl Gallant (Renfrew—Nipissing—Pembroke),Conservative,Nay,
Mr. Marc Garneau (Notre-Dame-de-Grâce—Westmount),Liberal,Yea,
Mr. Bernard Généreux (Montmagny—L'Islet—Kamouraska—Rivière-du-Loup),Conservative,Nay,
Mr. Mark Gerretsen (Kingston and the Islands),Liberal,Yea,
Mrs. Marilène Gill (Manicouagan),Bloc Québécois,Nay,
Ms. Pamela Goldsmith-Jones (West Vancouver—Sunshine Coast—Sea to Sky Country),Liberal,,Paired
Mr. Ralph Goodale (Regina—Wascana),Liberal,Yea,
Ms. Karina Gould (Burlington),Liberal,Yea,
Mr. Jacques Gourde (Lévis—Lotbinière),Conservative,Nay,
Mr. David de Burgh Graham (Laurentides—Labelle),Liberal,Yea,
Ms. Patty Hajdu (Thunder Bay—Superior North),Liberal,Yea,
Mr. Ken Hardie (Fleetwood—Port Kells),Liberal,Yea,
Mr. Richard Hébert (Lac-Saint-Jean),Liberal,Yea,
Mr. Kent Hehr (Calgary Centre),Liberal,Yea,
Mr. Gordie Hogg (South Surrey—White Rock),Liberal,Yea,
Mr. Mark Holland (Ajax),Liberal,Yea,
Mr. Anthony Housefather (Mount Royal),Liberal,Yea,
Mrs. Carol Hughes (Algoma—Manitoulin—Kapuskasing),NDP,Nay,
Mr. Ahmed Hussen (York South—Weston),Liberal,Yea,
Ms. Gudie Hutchings (Long Range Mountains),Liberal,Yea,
Mr. Angelo Iacono (Alfred-Pellan),Liberal,Yea,
Mr. Gord Johns (Courtenay—Alberni),NDP,Nay,
Ms. Yvonne Jones (Labrador),Liberal,Yea,
Mrs. Bernadette Jordan (South Shore—St. Margarets),Liberal,Yea,
Mr. Majid Jowhari (Richmond Hill),Liberal,Yea,
Mr. Peter Julian (New Westminster—Burnaby),NDP,Nay,
Mr. Pat Kelly (Calgary Rocky Ridge),Conservative,Nay,
Ms. Iqra Khalid (Mississauga—Erin Mills),Liberal,Yea,
Ms. Kamal Khera (Brampton West),Liberal,Yea,
Mr. Tom Kmiec (Calgary Shepard),Conservative,,Paired
Mr. Mike Lake (Edmonton—Wetaskiwin),Conservative,Nay,
Ms. Emmanuella Lambropoulos (Saint-Laurent),Liberal,Yea,
Mr. Kevin Lamoureux (Winnipeg North),Liberal,Yea,
Ms. Linda Lapointe (Rivière-des-Mille-Îles),Liberal,Yea,
Mr. Stéphane Lauzon (Argenteuil—La Petite-Nation),Liberal,Yea,
Mr. Dominic LeBlanc (Beauséjour),Liberal,,Paired
Mrs. Diane Lebouthillier (Gaspésie—Les Îles-de-la-Madeleine),Liberal,Yea,
Mr. Paul Lefebvre (Sudbury),Liberal,Yea,
Mr. Ron Liepert (Calgary Signal Hill),Conservative,Nay,
Mr. Joël Lightbound (Louis-Hébert),Liberal,Yea,
Mrs. Alaina Lockhart (Fundy Royal),Liberal,Yea,
Mr. Wayne Long (Saint John—Rothesay),Liberal,Yea,
Mr. Lloyd Longfield (Guelph),Liberal,Yea,
Ms. Karen Ludwig (New Brunswick Southwest),Liberal,Yea,
Mr. Lawrence MacAulay (Cardigan),Liberal,Yea,
Mr. Alistair MacGregor (Cowichan—Malahat—Langford),NDP,Nay,
Mr. Steven MacKinnon (Gatineau),Liberal,Yea,
Mr. Rémi Massé (Avignon—La Mitis—Matane—Matapédia),Liberal,Yea,
Mr. Brian Masse (Windsor West),NDP,Nay,
Ms. Irene Mathyssen (London—Fanshawe),NDP,Nay,
Mr. Bryan May (Cambridge),Liberal,Yea,
Ms. Elizabeth May (Saanich—Gulf Islands),Green Party,Nay,
Mr. Kelly McCauley (Edmonton West),Conservative,Nay,
Mr. Phil McColeman (Brantford—Brant),Conservative,Nay,
Mrs. Karen McCrimmon (Kanata—Carleton),Liberal,Yea,
Mr. Ken McDonald (Avalon),Liberal,Yea,
Mr. David McGuinty (Ottawa South),Liberal,Yea,
Mr. John McKay (Scarborough—Guildwood),Liberal,Yea,
Ms. Catherine McKenna (Ottawa Centre),Liberal,Yea,
Mr. Ron McKinnon (Coquitlam—Port Coquitlam),Liberal,Yea,
Mr. Michael McLeod (Northwest Territories),Liberal,Yea,
Mrs. Cathy McLeod (Kamloops—Thompson—Cariboo),Conservative,Nay,
Mrs. Alexandra Mendès (Brossard—Saint-Lambert),Liberal,Yea,
Mr. Marco Mendicino (Eglinton—Lawrence),Liberal,Yea,
Ms. MaryAnn Mihychuk (Kildonan—St. Paul),Liberal,Yea,
Mr. Marc Miller (Ville-Marie—Le Sud-Ouest—Île-des-Soeurs),Liberal,Yea,
Ms. Maryam Monsef (Peterborough—Kawartha),Liberal,Yea,
Mr. Robert Morrissey (Egmont),Liberal,Yea,
Mr. Glen Motz (Medicine Hat—Cardston—Warner),Conservative,Nay,
Ms. Joyce Murray (Vancouver Quadra),Liberal,Yea,
Mr. John Nater (Perth—Wellington),Conservative,Nay,
Ms. Mary Ng (Markham—Thornhill),Liberal,Yea,
Ms. Jennifer O'Connell (Pickering—Uxbridge),Liberal,Yea,
Mr. Robert Oliphant (Don Valley West),Liberal,Yea,
Mr. John Oliver (Oakville),Liberal,Yea,
Mr. Seamus O'Regan (St. John's South—Mount Pearl),Liberal,Yea,
Mr. Robert-Falcon Ouellette (Winnipeg Centre),Liberal,Yea,
Mr. Denis Paradis (Brome—Missisquoi),Liberal,Yea,
Ms. Monique Pauzé (Repentigny),Bloc Québécois,Nay,
Mr. Joe Peschisolido (Steveston—Richmond East),Liberal,Yea,
Mr. Kyle Peterson (Newmarket—Aurora),Liberal,Yea,
Ms. Ginette Petitpas Taylor (Moncton—Riverview—Dieppe),Liberal,Yea,
Mr. Michel Picard (Montarville),Liberal,Yea,
Mr. Louis Plamondon (Bécancour—Nicolet—Saurel),Bloc Québécois,,Paired
Mr. Jean-Claude Poissant (La Prairie),Liberal,Yea,
Ms. Tracey Ramsey (Essex),NDP,Nay,
Ms. Yasmin Ratansi (Don Valley East),Liberal,Yea,
Mr. Blake Richards (Banff—Airdrie),Conservative,Nay,
Mr. Jean Rioux (Saint-Jean),Liberal,Yea,
Mr. Yves Robillard (Marc-Aurèle-Fortin),Liberal,Yea,
Mr. Pablo Rodriguez (Honoré-Mercier),Liberal,Yea,
Mr. Churence Rogers (Bonavista—Burin—Trinity),Liberal,Yea,
Mrs. Sherry Romanado (Longueuil—Charles-LeMoyne),Liberal,Yea,
Ms. Kim Rudd (Northumberland—Peterborough South),Liberal,Yea,
Mr. Dan Ruimy (Pitt Meadows—Maple Ridge),Liberal,Yea,
Mr. Don Rusnak (Thunder Bay—Rainy River),Liberal,Yea,
Ms. Ruby Sahota (Brampton North),Liberal,Yea,
Mr. Raj Saini (Kitchener Centre),Liberal,Yea,
Mr. Harjit S. Sajjan (Vancouver South),Liberal,Yea,
Mr. Ramesh Sangha (Brampton Centre),Liberal,Yea,
Mr. Randeep Sarai (Surrey Centre),Liberal,Yea,
Mr. Francis Scarpaleggia (Lac-Saint-Louis),Liberal,Yea,
Mr. Peter Schiefke (Vaudreuil—Soulanges),Liberal,Yea,
Mrs. Deborah Schulte (King—Vaughan),Liberal,Yea,
Mr. Marc Serré (Nickel Belt),Liberal,Yea,
Ms. Judy A. Sgro (Humber River—Black Creek),Liberal,Yea,
Mrs. Brenda Shanahan (Châteauguay—Lacolle),Liberal,Yea,
Mr. Terry Sheehan (Sault Ste. Marie),Liberal,Yea,
Mr. Bev Shipley (Lambton—Kent—Middlesex),Conservative,Nay,
Mr. Jati Sidhu (Mission—Matsqui—Fraser Canyon),Liberal,Yea,
Ms. Sonia Sidhu (Brampton South),Liberal,Yea,
Mr. Scott Simms (Coast of Bays—Central—Notre Dame),Liberal,Yea,
Mr. Amarjeet Sohi (Edmonton Mill Woods),Liberal,Yea,
Mr. Francesco Sorbara (Vaughan—Woodbridge),Liberal,Yea,
Mr. Sven Spengemann (Mississauga—Lakeshore),Liberal,Yea,
Mr. Bruce Stanton (Simcoe North),Conservative,Nay,
Mr. Gabriel Ste-Marie (Joliette),Bloc Québécois,Nay,
Mr. Wayne Stetski (Kootenay—Columbia),NDP,Nay,
Mr. Marwan Tabbara (Kitchener South—Hespeler),Liberal,Yea,
Mr. Geng Tan (Don Valley North),Liberal,Yea,
Ms. Filomena Tassi (Hamilton West—Ancaster—Dundas),Liberal,Yea,
Mr. Luc Thériault (Montcalm),Bloc Québécois,,Paired
Ms. Karine Trudel (Jonquière),NDP,Nay,
Mr. Dan Vandal (Saint Boniface—Saint Vital),Liberal,Yea,
Ms. Anita Vandenbeld (Ottawa West—Nepean),Liberal,Yea,
Mr. Arnold Viersen (Peace River—Westlock),Conservative,Nay,
Mr. Arif Virani (Parkdale—High Park),Liberal,Yea,
Mrs. Cathay Wagantall (Yorkton—Melville),Conservative,Nay,
Mr. Kevin Waugh (Saskatoon—Grasswood),Conservative,Nay,
Mr. Nick Whalen (St. John's East),Liberal,Yea,
Mr. Jonathan Wilkinson (North Vancouver),Liberal,Yea,
Mr. Borys Wrzesnewskyj (Etobicoke Centre),Liberal,Yea,
Ms. Jean Yip (Scarborough—Agincourt),Liberal,Yea,
Ms. Kate Young (London West),Liberal,Yea,
Mrs. Salma Zahid (Scarborough Centre),Liberal,Yea,
