Member of Parliament,Political Affiliation,Member Voted,Paired
Mr. Dan Albas (Central Okanagan—Similkameen—Nicola),Conservative,Nay,
Mr. John Aldag (Cloverdale—Langley City),Liberal,Yea,
Mr. Omar Alghabra (Mississauga Centre),Liberal,Yea,
Mr. Gary Anandasangaree (Scarborough—Rouge Park),Liberal,Yea,
Mr. René Arseneault (Madawaska—Restigouche),Liberal,Yea,
Mr. Chandra Arya (Nepean),Liberal,Yea,
Mr. Robert Aubin (Trois-Rivières),NDP,Nay,
Mr. Ramez Ayoub (Thérèse-De Blainville),Liberal,Yea,
Mr. Vance Badawey (Niagara Centre),Liberal,Yea,
Mr. Larry Bagnell (Yukon),Liberal,Yea,
Mr. Frank Baylis (Pierrefonds—Dollard),Liberal,Yea,
Mr. Mario Beaulieu (La Pointe-de-l'Île),Bloc Québécois,Nay,Paired
Mr. Terry Beech (Burnaby North—Seymour),Liberal,Yea,
Ms. Carolyn Bennett (Toronto—St. Paul's),Liberal,Yea,
Ms. Candice Bergen (Portage—Lisgar),Conservative,Nay,
Ms. Marie-Claude Bibeau (Compton—Stanstead),Liberal,Yea,
Mr. Chris Bittle (St. Catharines),Liberal,Yea,
Mr. Daniel Blaikie (Elmwood—Transcona),NDP,Nay,
Mr. Bill Blair (Scarborough Southwest),Liberal,Yea,
Ms. Rachel Blaney (North Island—Powell River),NDP,Nay,
Mr. Randy Boissonnault (Edmonton Centre),Liberal,Yea,
Mr. Mike Bossio (Hastings—Lennox and Addington),Liberal,Yea,
Mr. Michel Boudrias (Terrebonne),Bloc Québécois,Nay,
Mr. Alexandre Boulerice (Rosemont—La Petite-Patrie),NDP,Nay,
Ms. Marjolaine Boutin-Sweet (Hochelaga),NDP,Nay,
Mr. Bob Bratina (Hamilton East—Stoney Creek),Liberal,Yea,
Ms. Ruth Ellen Brosseau (Berthier—Maskinongé),NDP,Nay,
Mr. Richard Cannings (South Okanagan—West Kootenay),NDP,Nay,
Mr. Guy Caron (Rimouski-Neigette—Témiscouata—Les Basques),NDP,Nay,
Mr. Jim Carr (Winnipeg South Centre),Liberal,Yea,
Mr. Colin Carrie (Oshawa),Conservative,Nay,
Mr. Bill Casey (Cumberland—Colchester),Liberal,Yea,
Mr. Sean Casey (Charlottetown),Liberal,Yea,
Ms. Bardish Chagger (Waterloo),Liberal,Yea,
Mr. François-Philippe Champagne (Saint-Maurice—Champlain),Liberal,Yea,
Mr. Shaun Chen (Scarborough North),Liberal,Yea,
Mr. Michael Chong (Wellington—Halton Hills),Conservative,Nay,
Mr. François Choquette (Drummond),NDP,Nay,
Mr. Alupa Clarke (Beauport—Limoilou),Conservative,Nay,
Mr. Serge Cormier (Acadie—Bathurst),Liberal,Yea,
Mr. Nathan Cullen (Skeena—Bulkley Valley),NDP,Nay,
Ms. Julie Dabrusin (Toronto—Danforth),Liberal,Yea,
Ms. Pam Damoff (Oakville North—Burlington),Liberal,Yea,
Mr. Scot Davidson (York—Simcoe),Conservative,Nay,
Mr. Matt DeCourcey (Fredericton),Liberal,Yea,
Mr. Sukh Dhaliwal (Surrey—Newton),Liberal,Yea,
Ms. Anju Dhillon (Dorval—Lachine—LaSalle),Liberal,Yea,
Mr. Todd Doherty (Cariboo—Prince George),Conservative,Nay,
Mr. Earl Dreeshen (Red Deer—Mountain View),Conservative,Nay,
Mr. Francis Drouin (Glengarry—Prescott—Russell),Liberal,Yea,
Mr. Emmanuel Dubourg (Bourassa),Liberal,Yea,
Mr. Terry Duguid (Winnipeg South),Liberal,Yea,
Ms. Linda Duncan (Edmonton Strathcona),NDP,Nay,
Ms. Kirsty Duncan (Etobicoke North),Liberal,Yea,
Mr. Pierre-Luc Dusseault (Sherbrooke),NDP,Nay,
Ms. Julie Dzerowicz (Davenport),Liberal,Yea,
Mr. Wayne Easter (Malpeque),Liberal,Yea,
Mr. Jim Eglinski (Yellowhead),Conservative,Nay,
Mr. Ali Ehsassi (Willowdale),Liberal,Yea,
Mr. Fayçal El-Khoury (Laval—Les Îles),Liberal,Yea,
Mr. Neil Ellis (Bay of Quinte),Liberal,Yea,
Mr. Nathaniel Erskine-Smith (Beaches—East York),Liberal,Yea,
Mr. Mark Eyking (Sydney—Victoria),Liberal,Yea,
Mr. Doug Eyolfson (Charleswood—St. James—Assiniboia—Headingley),Liberal,Yea,
Mr. Ed Fast (Abbotsford),Conservative,Nay,
Mr. Greg Fergus (Hull—Aylmer),Liberal,Yea,
Mr. Andy Fillmore (Halifax),Liberal,Yea,
Ms. Diane Finley (Haldimand—Norfolk),Conservative,Nay,
Mr. Pat Finnigan (Miramichi—Grand Lake),Liberal,Yea,
Mr. Darren Fisher (Dartmouth—Cole Harbour),Liberal,Yea,
Mr. Peter Fonseca (Mississauga East—Cooksville),Liberal,Yea,
Mrs. Mona Fortier (Ottawa—Vanier),Liberal,Yea,
Mr. Peter Fragiskatos (London North Centre),Liberal,Yea,
Mr. Sean Fraser (Central Nova),Liberal,Yea,
Mr. Colin Fraser (West Nova),Liberal,Yea,
Mr. Stephen Fuhr (Kelowna—Lake Country),Liberal,Yea,
Mrs. Cheryl Gallant (Renfrew—Nipissing—Pembroke),Conservative,Nay,
Mr. Randall Garrison (Esquimalt—Saanich—Sooke),NDP,Nay,
Mr. Garnett Genuis (Sherwood Park—Fort Saskatchewan),Conservative,Nay,
Mr. Mark Gerretsen (Kingston and the Islands),Liberal,Yea,
Ms. Pamela Goldsmith-Jones (West Vancouver—Sunshine Coast—Sea to Sky Country),Liberal,Yea,
Mr. Ralph Goodale (Regina—Wascana),Liberal,Yea,
Ms. Karina Gould (Burlington),Liberal,Yea,
Mr. David de Burgh Graham (Laurentides—Labelle),Liberal,Yea,
Ms. Cheryl Hardcastle (Windsor—Tecumseh),NDP,Nay,
Mr. Ken Hardie (Fleetwood—Port Kells),Liberal,Yea,
Mr. Richard Hébert (Lac-Saint-Jean),Liberal,Yea,
Mr. Gordie Hogg (South Surrey—White Rock),Liberal,Yea,
Mr. Mark Holland (Ajax),Liberal,Yea,
Mr. Anthony Housefather (Mount Royal),Liberal,Yea,
Mrs. Carol Hughes (Algoma—Manitoulin—Kapuskasing),NDP,Nay,
Mr. Ahmed Hussen (York South—Weston),Liberal,Yea,
Ms. Gudie Hutchings (Long Range Mountains),Liberal,Yea,
Mr. Angelo Iacono (Alfred-Pellan),Liberal,Yea,
Mr. Gord Johns (Courtenay—Alberni),NDP,Nay,
Ms. Georgina Jolibois (Desnethé—Missinippi—Churchill River),NDP,Nay,
Ms. Mélanie Joly (Ahuntsic-Cartierville),Liberal,Yea,
Ms. Yvonne Jones (Labrador),Liberal,Yea,
Mrs. Bernadette Jordan (South Shore—St. Margarets),Liberal,Yea,
Mr. Majid Jowhari (Richmond Hill),Liberal,Yea,
Mr. Peter Julian (New Westminster—Burnaby),NDP,Nay,
Mr. Peter Kent (Thornhill),Conservative,Nay,
Ms. Iqra Khalid (Mississauga—Erin Mills),Liberal,Yea,
Ms. Kamal Khera (Brampton West),Liberal,Yea,
Mr. Tom Kmiec (Calgary Shepard),Conservative,Nay,
Mr. Mike Lake (Edmonton—Wetaskiwin),Conservative,Nay,
Ms. Emmanuella Lambropoulos (Saint-Laurent),Liberal,Yea,
Mr. David Lametti (LaSalle—Émard—Verdun),Liberal,Yea,
Mr. Kevin Lamoureux (Winnipeg North),Liberal,Yea,
Ms. Linda Lapointe (Rivière-des-Mille-Îles),Liberal,Yea,
Mr. Stéphane Lauzon (Argenteuil—La Petite-Nation),Liberal,Yea,
Mr. Dominic LeBlanc (Beauséjour),Liberal,,Paired
Mr. Paul Lefebvre (Sudbury),Liberal,Yea,
Mr. Andrew Leslie (Orléans),Liberal,Yea,
Mr. Michael Levitt (York Centre),Liberal,Yea,
Mr. Joël Lightbound (Louis-Hébert),Liberal,Yea,
Mr. Ben Lobb (Huron—Bruce),Conservative,Nay,
Mrs. Alaina Lockhart (Fundy Royal),Liberal,Yea,
Mr. Wayne Long (Saint John—Rothesay),Liberal,Yea,
Mr. Lloyd Longfield (Guelph),Liberal,Yea,
Ms. Karen Ludwig (New Brunswick Southwest),Liberal,Yea,
Mr. Tom Lukiwski (Moose Jaw—Lake Centre—Lanigan),Conservative,Nay,
Mr. Lawrence MacAulay (Cardigan),Liberal,Yea,
Mr. Steven MacKinnon (Gatineau),Liberal,Yea,
Mr. Paul Manly (Nanaimo—Ladysmith),Green Party,Nay,
Mr. Rémi Massé (Avignon—La Mitis—Matane—Matapédia),Liberal,Yea,
Mr. Brian Masse (Windsor West),NDP,Nay,
Ms. Irene Mathyssen (London—Fanshawe),NDP,Nay,
Mr. Bryan May (Cambridge),Liberal,Yea,
Ms. Elizabeth May (Saanich—Gulf Islands),Green Party,Nay,
Mr. Kelly McCauley (Edmonton West),Conservative,Nay,
Mr. Ken McDonald (Avalon),Liberal,Yea,
Mr. David McGuinty (Ottawa South),Liberal,Yea,
Ms. Catherine McKenna (Ottawa Centre),Liberal,Yea,
Mr. Ron McKinnon (Coquitlam—Port Coquitlam),Liberal,Yea,
Mr. Michael McLeod (Northwest Territories),Liberal,Yea,
Mrs. Cathy McLeod (Kamloops—Thompson—Cariboo),Conservative,Nay,
Mrs. Alexandra Mendès (Brossard—Saint-Lambert),Liberal,Yea,
Mr. Marco Mendicino (Eglinton—Lawrence),Liberal,Yea,
Ms. MaryAnn Mihychuk (Kildonan—St. Paul),Liberal,Yea,
Mr. Marc Miller (Ville-Marie—Le Sud-Ouest—Île-des-Soeurs),Liberal,Yea,
Ms. Maryam Monsef (Peterborough—Kawartha),Liberal,Yea,
Mr. Robert Morrissey (Egmont),Liberal,Yea,
Ms. Joyce Murray (Vancouver Quadra),Liberal,Yea,
Mr. Pierre Nantel (Longueuil—Saint-Hubert),NDP,Nay,
Mrs. Eva Nassif (Vimy),Liberal,Yea,
Mr. John Nater (Perth—Wellington),Conservative,Nay,
Ms. Mary Ng (Markham—Thornhill),Liberal,Yea,
Ms. Jennifer O'Connell (Pickering—Uxbridge),Liberal,Yea,
Mr. Robert Oliphant (Don Valley West),Liberal,Yea,
Mr. John Oliver (Oakville),Liberal,Yea,
Mr. Seamus O'Regan (St. John's South—Mount Pearl),Liberal,Yea,
Mr. Robert-Falcon Ouellette (Winnipeg Centre),Liberal,Yea,
Ms. Monique Pauzé (Repentigny),Bloc Québécois,Nay,
Mr. Joe Peschisolido (Steveston—Richmond East),Liberal,Yea,
Mr. Kyle Peterson (Newmarket—Aurora),Liberal,Yea,
Ms. Ginette Petitpas Taylor (Moncton—Riverview—Dieppe),Liberal,Yea,
Mr. Michel Picard (Montarville),Liberal,Yea,
Mr. Louis Plamondon (Bécancour—Nicolet—Saurel),Bloc Québécois,Nay,
Mr. Pierre Poilievre (Carleton),Conservative,Nay,
Mr. Jean-Claude Poissant (La Prairie),Liberal,Yea,
Ms. Anne Minh-Thu Quach (Salaberry—Suroît),NDP,Nay,
Ms. Carla Qualtrough (Delta),Liberal,Yea,
Ms. Tracey Ramsey (Essex),NDP,Nay,
Mr. Murray Rankin (Victoria),NDP,Nay,
Ms. Yasmin Ratansi (Don Valley East),Liberal,Yea,
Mr. Scott Reid (Lanark—Frontenac—Kingston),Conservative,Nay,
Mr. Yves Robillard (Marc-Aurèle-Fortin),Liberal,Yea,
Mr. Churence Rogers (Bonavista—Burin—Trinity),Liberal,Yea,
Mrs. Sherry Romanado (Longueuil—Charles-LeMoyne),Liberal,Yea,
Mr. Anthony Rota (Nipissing—Timiskaming),Liberal,Yea,
Ms. Kim Rudd (Northumberland—Peterborough South),Liberal,Yea,
Mr. Dan Ruimy (Pitt Meadows—Maple Ridge),Liberal,Yea,
Ms. Ruby Sahota (Brampton North),Liberal,Yea,
Mr. Raj Saini (Kitchener Centre),Liberal,Yea,
Mr. Darrell Samson (Sackville—Preston—Chezzetcook),Liberal,Yea,
Mr. Ramesh Sangha (Brampton Centre),Liberal,Yea,
Mr. Randeep Sarai (Surrey Centre),Liberal,Yea,
Mr. Bob Saroya (Markham—Unionville),Conservative,Nay,
Mr. Francis Scarpaleggia (Lac-Saint-Louis),Liberal,Yea,
Mr. Peter Schiefke (Vaudreuil—Soulanges),Liberal,Yea,
Mr. Jamie Schmale (Haliburton—Kawartha Lakes—Brock),Conservative,Nay,
Mrs. Deborah Schulte (King—Vaughan),Liberal,Yea,
Mr. Marc Serré (Nickel Belt),Liberal,Yea,
Ms. Judy A. Sgro (Humber River—Black Creek),Liberal,Yea,
Mrs. Brenda Shanahan (Châteauguay—Lacolle),Liberal,Yea,
Mr. Terry Sheehan (Sault Ste. Marie),Liberal,Yea,
Mr. Jati Sidhu (Mission—Matsqui—Fraser Canyon),Liberal,Yea,
Ms. Sonia Sidhu (Brampton South),Liberal,Yea,
Mr. Gagan Sikand (Mississauga—Streetsville),Liberal,Yea,
Mr. Scott Simms (Coast of Bays—Central—Notre Dame),Liberal,Yea,
Mr. Robert Sopuck (Dauphin—Swan River—Neepawa),Conservative,Nay,
Mr. Francesco Sorbara (Vaughan—Woodbridge),Liberal,Yea,
Mr. Kevin Sorenson (Battle River—Crowfoot),Conservative,Nay,
Mr. Sven Spengemann (Mississauga—Lakeshore),Liberal,Yea,
Mr. Bruce Stanton (Simcoe North),Conservative,Nay,
Mr. Gabriel Ste-Marie (Joliette),Bloc Québécois,Nay,
Mr. Wayne Stetski (Kootenay—Columbia),NDP,Nay,
Mr. Marwan Tabbara (Kitchener South—Hespeler),Liberal,Yea,
Mr. Geng Tan (Don Valley North),Liberal,Yea,
Ms. Filomena Tassi (Hamilton West—Ancaster—Dundas),Liberal,Yea,
Mr. Luc Thériault (Montcalm),Bloc Québécois,Nay,
Ms. Rachael Thomas (Lethbridge),Conservative,Nay,
Ms. Karine Trudel (Jonquière),NDP,Nay,
Mr. Dan Vandal (Saint Boniface—Saint Vital),Liberal,Yea,
Ms. Anita Vandenbeld (Ottawa West—Nepean),Liberal,Yea,
Mr. Adam Vaughan (Spadina—Fort York),Liberal,Yea,
Mr. Arnold Viersen (Peace River—Westlock),Conservative,Nay,
Mr. Arif Virani (Parkdale—High Park),Liberal,Yea,
Mrs. Cathay Wagantall (Yorkton—Melville),Conservative,Nay,
Mr. Kevin Waugh (Saskatoon—Grasswood),Conservative,Nay,
Mr. Len Webber (Calgary Confederation),Conservative,Nay,
Mr. Nick Whalen (St. John's East),Liberal,Yea,
Mr. Borys Wrzesnewskyj (Etobicoke Centre),Liberal,Yea,
Ms. Jean Yip (Scarborough—Agincourt),Liberal,Yea,
Ms. Kate Young (London West),Liberal,Yea,
Mrs. Salma Zahid (Scarborough Centre),Liberal,Yea,
