Member of Parliament,Political Affiliation,Member Voted,Paired
Mr. Dan Albas (Central Okanagan—Similkameen—Nicola),Conservative,Nay,
Mr. Harold Albrecht (Kitchener—Conestoga),Conservative,Nay,
Mr. John Aldag (Cloverdale—Langley City),Liberal,Yea,
Mr. Dean Allison (Niagara West),Conservative,,Paired
Mr. William Amos (Pontiac),Liberal,Yea,
Mr. David Anderson (Cypress Hills—Grasslands),Conservative,Nay,
Mr. Chandra Arya (Nepean),Liberal,Yea,
Mr. Robert Aubin (Trois-Rivières),NDP,Yea,
Mr. Ramez Ayoub (Thérèse-De Blainville),Liberal,Yea,
Mr. Vance Badawey (Niagara Centre),Liberal,Yea,
Mr. Larry Bagnell (Yukon),Liberal,Yea,
Mr. John Barlow (Foothills),Conservative,Nay,
Mr. Frank Baylis (Pierrefonds—Dollard),Liberal,Yea,
Mr. Terry Beech (Burnaby North—Seymour),Liberal,Yea,
Mr. Bob Benzen (Calgary Heritage),Conservative,Nay,
Mr. Bill Blair (Scarborough Southwest),Liberal,Yea,
Mr. Randy Boissonnault (Edmonton Centre),Liberal,Yea,
Mr. Mike Bossio (Hastings—Lennox and Addington),Liberal,Yea,
Ms. Marjolaine Boutin-Sweet (Hochelaga),NDP,Yea,
Mr. John Brassard (Barrie—Innisfil),Conservative,Nay,
Mr. Pierre Breton (Shefford),Liberal,Yea,
Mr. Guy Caron (Rimouski-Neigette—Témiscouata—Les Basques),NDP,Yea,
Mr. Colin Carrie (Oshawa),Conservative,Nay,
Mr. Sean Casey (Charlottetown),Liberal,Yea,
Mr. Bill Casey (Cumberland—Colchester),Liberal,Yea,
Ms. Bardish Chagger (Waterloo),Liberal,Yea,
Mr. Shaun Chen (Scarborough North),Liberal,,Paired
Mr. Alupa Clarke (Beauport—Limoilou),Conservative,Nay,
Mr. Michael Cooper (St. Albert—Edmonton),Conservative,Nay,
Mr. Serge Cormier (Acadie—Bathurst),Liberal,Yea,
Ms. Julie Dabrusin (Toronto—Danforth),Liberal,Yea,
Ms. Pam Damoff (Oakville North—Burlington),Liberal,Yea,
Mr. Matt DeCourcey (Fredericton),Liberal,Yea,
Mr. Kerry Diotte (Edmonton Griesbach),Conservative,Nay,
Mr. Francis Drouin (Glengarry—Prescott—Russell),Liberal,Yea,
Mr. Emmanuel Dubourg (Bourassa),Liberal,Yea,
Mr. Terry Duguid (Winnipeg South),Liberal,Yea,
Ms. Linda Duncan (Edmonton Strathcona),NDP,Yea,
Ms. Kirsty Duncan (Etobicoke North),Liberal,Yea,
Mr. Pierre-Luc Dusseault (Sherbrooke),NDP,Yea,
Mr. Scott Duvall (Hamilton Mountain),NDP,Yea,
Ms. Julie Dzerowicz (Davenport),Liberal,Yea,
Mr. Jim Eglinski (Yellowhead),Conservative,Nay,
Mr. Fayçal El-Khoury (Laval—Les Îles),Liberal,Yea,
Mr. Andy Fillmore (Halifax),Liberal,Yea,
Mr. Darren Fisher (Dartmouth—Cole Harbour),Liberal,Yea,
Mrs. Mona Fortier (Ottawa—Vanier),Liberal,Yea,
Ms. Chrystia Freeland (University—Rosedale),Liberal,Yea,
Mr. Marc Garneau (Notre-Dame-de-Grâce—Westmount),Liberal,Yea,
Mr. Bernard Généreux (Montmagny—L'Islet—Kamouraska—Rivière-du-Loup),Conservative,Nay,
Mr. Mark Gerretsen (Kingston and the Islands),Liberal,Yea,
Mr. Ralph Goodale (Regina—Wascana),Liberal,Yea,
Mr. T.J. Harvey (Tobique—Mactaquac),Liberal,Yea,
Mr. Richard Hébert (Lac-Saint-Jean),Liberal,Yea,
Mr. Gordie Hogg (South Surrey—White Rock),Liberal,Yea,
Mr. Anthony Housefather (Mount Royal),Liberal,Yea,
Ms. Gudie Hutchings (Long Range Mountains),Liberal,Yea,
Mr. Gord Johns (Courtenay—Alberni),NDP,Yea,
Ms. Yvonne Jones (Labrador),Liberal,Yea,
Mr. Peter Julian (New Westminster—Burnaby),NDP,Yea,
Mr. Pat Kelly (Calgary Rocky Ridge),Conservative,Nay,
Mr. Peter Kent (Thornhill),Conservative,Nay,
Ms. Kamal Khera (Brampton West),Liberal,Yea,
Mr. Mike Lake (Edmonton—Wetaskiwin),Conservative,Nay,
Mr. David Lametti (LaSalle—Émard—Verdun),Liberal,Yea,
Mr. Kevin Lamoureux (Winnipeg North),Liberal,Yea,
Mr. Stéphane Lauzon (Argenteuil—La Petite-Nation),Liberal,Yea,
Mr. Andrew Leslie (Orléans),Liberal,,Paired
Mrs. Alaina Lockhart (Fundy Royal),Liberal,Yea,
Mr. Lloyd Longfield (Guelph),Liberal,Yea,
Ms. Karen Ludwig (New Brunswick Southwest),Liberal,Yea,
Mr. Lawrence MacAulay (Cardigan),Liberal,Yea,
Mr. Steven MacKinnon (Gatineau),Liberal,Yea,
Mr. Larry Maguire (Brandon—Souris),Conservative,Nay,
Mr. James Maloney (Etobicoke—Lakeshore),Liberal,Yea,
Mr. Rémi Massé (Avignon—La Mitis—Matane—Matapédia),Liberal,Yea,
Ms. Elizabeth May (Saanich—Gulf Islands),Green Party,Yea,
Mr. Kelly McCauley (Edmonton West),Conservative,Nay,
Mrs. Karen McCrimmon (Kanata—Carleton),Liberal,Yea,
Mr. Ken McDonald (Avalon),Liberal,Yea,
Mr. David McGuinty (Ottawa South),Liberal,Yea,
Mr. Ron McKinnon (Coquitlam—Port Coquitlam),Liberal,Yea,
Ms. Christine Moore (Abitibi—Témiscamingue),NDP,,Paired
Mr. Robert Morrissey (Egmont),Liberal,Yea,
Mr. Glen Motz (Medicine Hat—Cardston—Warner),Conservative,Nay,
Mr. Pierre Nantel (Longueuil—Saint-Hubert),NDP,Yea,
Mr. John Nater (Perth—Wellington),Conservative,Nay,
Ms. Mary Ng (Markham—Thornhill),Liberal,Yea,
Ms. Jennifer O'Connell (Pickering—Uxbridge),Liberal,Yea,
Mr. Robert Oliphant (Don Valley West),Liberal,Yea,
Mr. Robert-Falcon Ouellette (Winnipeg Centre),Liberal,Yea,
Mr. Denis Paradis (Brome—Missisquoi),Liberal,Yea,
Mr. Joe Peschisolido (Steveston—Richmond East),Liberal,Yea,
Mr. Kyle Peterson (Newmarket—Aurora),Liberal,Yea,
Ms. Ginette Petitpas Taylor (Moncton—Riverview—Dieppe),Liberal,Yea,
Mr. Michel Picard (Montarville),Liberal,Yea,
Mr. Jean-Claude Poissant (La Prairie),Liberal,Yea,
Ms. Carla Qualtrough (Delta),Liberal,Yea,
Ms. Tracey Ramsey (Essex),NDP,Yea,
Mr. Jean Rioux (Saint-Jean),Liberal,Yea,
Mr. Churence Rogers (Bonavista—Burin—Trinity),Liberal,Yea,
Ms. Kim Rudd (Northumberland—Peterborough South),Liberal,Yea,
Mr. Dan Ruimy (Pitt Meadows—Maple Ridge),Liberal,Yea,
Mr. Raj Saini (Kitchener Centre),Liberal,Yea,
Mr. Harjit S. Sajjan (Vancouver South),Liberal,Yea,
Mr. Ramesh Sangha (Brampton Centre),Liberal,Yea,
Ms. Brigitte Sansoucy (Saint-Hyacinthe—Bagot),NDP,Yea,
Mrs. Brenda Shanahan (Châteauguay—Lacolle),Liberal,Yea,
Mr. Bev Shipley (Lambton—Kent—Middlesex),Conservative,Nay,
Mr. Scott Simms (Coast of Bays—Central—Notre Dame),Liberal,Yea,
Mr. Amarjeet Sohi (Edmonton Mill Woods),Liberal,Yea,
Mr. Francesco Sorbara (Vaughan—Woodbridge),Liberal,Yea,
Mr. Sven Spengemann (Mississauga—Lakeshore),Liberal,Yea,
Mr. Gabriel Ste-Marie (Joliette),Bloc Québécois,Nay,
Mr. Wayne Stetski (Kootenay—Columbia),NDP,Yea,
Mr. Mark Strahl (Chilliwack—Hope),Conservative,Nay,
Mr. David Sweet (Flamborough—Glanbrook),Conservative,Nay,
Mr. Marwan Tabbara (Kitchener South—Hespeler),Liberal,Yea,
Mr. Geng Tan (Don Valley North),Liberal,Yea,
Mr. Brad Trost (Saskatoon—University),Conservative,Nay,
Ms. Karine Trudel (Jonquière),NDP,Yea,
Mr. Dan Vandal (Saint Boniface—Saint Vital),Liberal,Yea,
Mrs. Karen Vecchio (Elgin—Middlesex—London),Conservative,Nay,
Mrs. Cathay Wagantall (Yorkton—Melville),Conservative,Nay,
Mr. Mark Warawa (Langley—Aldergrove),Conservative,,Paired
Mr. Kevin Waugh (Saskatoon—Grasswood),Conservative,Nay,
Mr. Len Webber (Calgary Confederation),Conservative,Nay,
Mr. Nick Whalen (St. John's East),Liberal,Yea,
Mr. Borys Wrzesnewskyj (Etobicoke Centre),Liberal,Yea,
Ms. Kate Young (London West),Liberal,,Paired
Mr. Bob Zimmer (Prince George—Peace River—Northern Rockies),Conservative,Nay,
