Member of Parliament,Political Affiliation,Member Voted,Paired
Mr. Dan Albas (Central Okanagan—Similkameen—Nicola),Conservative,Nay,
Mr. Harold Albrecht (Kitchener—Conestoga),Conservative,Nay,
Mr. Dean Allison (Niagara West),Conservative,,Paired
Mr. David Anderson (Cypress Hills—Grasslands),Conservative,Nay,
Mr. Chandra Arya (Nepean),Liberal,Yea,
Mr. Robert Aubin (Trois-Rivières),NDP,Yea,
Mr. Ramez Ayoub (Thérèse-De Blainville),Liberal,Yea,
Mr. Larry Bagnell (Yukon),Liberal,Yea,
Mr. John Barlow (Foothills),Conservative,Nay,
Mr. Michael Barrett (Leeds—Grenville—Thousand Islands and Rideau Lakes),Conservative,Nay,
Mr. Frank Baylis (Pierrefonds—Dollard),Liberal,Yea,
Mr. Mario Beaulieu (La Pointe-de-l'Île),Bloc Québécois,Nay,
Ms. Rachel Bendayan (Outremont),Liberal,Yea,
Ms. Carolyn Bennett (Toronto—St. Paul's),Liberal,Yea,
Ms. Sheri Benson (Saskatoon West),NDP,Yea,
Mr. Bob Benzen (Calgary Heritage),Conservative,Nay,
Mr. Bill Blair (Scarborough Southwest),Liberal,Yea,
Mr. Randy Boissonnault (Edmonton Centre),Liberal,Yea,
Ms. Marjolaine Boutin-Sweet (Hochelaga),NDP,Yea,
Mr. John Brassard (Barrie—Innisfil),Conservative,Nay,
Mr. Bob Bratina (Hamilton East—Stoney Creek),Liberal,Yea,
Mr. Guy Caron (Rimouski-Neigette—Témiscouata—Les Basques),NDP,Yea,
Mr. Colin Carrie (Oshawa),Conservative,Nay,
Mr. Bill Casey (Cumberland—Colchester),Liberal,Yea,
Mr. Sean Casey (Charlottetown),Liberal,Yea,
Ms. Bardish Chagger (Waterloo),Liberal,Yea,
Mr. Shaun Chen (Scarborough North),Liberal,,Paired
Mr. François Choquette (Drummond),NDP,Yea,
Mr. Alupa Clarke (Beauport—Limoilou),Conservative,Nay,
Mr. Michael Cooper (St. Albert—Edmonton),Conservative,Nay,
Mr. Rodger Cuzner (Cape Breton—Canso),Liberal,Yea,
Mr. Matt DeCourcey (Fredericton),Liberal,Yea,
Mr. Sukh Dhaliwal (Surrey—Newton),Liberal,Yea,
Mr. Earl Dreeshen (Red Deer—Mountain View),Conservative,Nay,
Mr. Francis Drouin (Glengarry—Prescott—Russell),Liberal,Yea,
Mr. Emmanuel Dubourg (Bourassa),Liberal,Yea,
Mr. Terry Duguid (Winnipeg South),Liberal,Yea,
Ms. Linda Duncan (Edmonton Strathcona),NDP,Yea,
Mr. Doug Eyolfson (Charleswood—St. James—Assiniboia—Headingley),Liberal,Yea,
Mr. Pat Finnigan (Miramichi—Grand Lake),Liberal,Yea,
Mr. Darren Fisher (Dartmouth—Cole Harbour),Liberal,Yea,
Mr. Peter Fonseca (Mississauga East—Cooksville),Liberal,Yea,
Mr. Sean Fraser (Central Nova),Liberal,Yea,
Ms. Chrystia Freeland (University—Rosedale),Liberal,Yea,
Mrs. Cheryl Gallant (Renfrew—Nipissing—Pembroke),Conservative,Nay,
Ms. Pamela Goldsmith-Jones (West Vancouver—Sunshine Coast—Sea to Sky Country),Liberal,Yea,
Mr. Ken Hardie (Fleetwood—Port Kells),Liberal,Yea,
Mr. T.J. Harvey (Tobique—Mactaquac),Liberal,Yea,
Mr. Kent Hehr (Calgary Centre),Liberal,Yea,
Mr. Gordie Hogg (South Surrey—White Rock),Liberal,Yea,
Mr. Mark Holland (Ajax),Liberal,Yea,
Mr. Anthony Housefather (Mount Royal),Liberal,Yea,
Ms. Gudie Hutchings (Long Range Mountains),Liberal,Yea,
Mr. Gord Johns (Courtenay—Alberni),NDP,Yea,
Mrs. Bernadette Jordan (South Shore—St. Margarets),Liberal,Yea,
Mr. Majid Jowhari (Richmond Hill),Liberal,Yea,
Mr. Pat Kelly (Calgary Rocky Ridge),Conservative,Nay,
Mr. Robert Kitchen (Souris—Moose Mountain),Conservative,Nay,
Mr. Mike Lake (Edmonton—Wetaskiwin),Conservative,Nay,
Ms. Emmanuella Lambropoulos (Saint-Laurent),Liberal,Yea,
Mr. David Lametti (LaSalle—Émard—Verdun),Liberal,Yea,
Mr. Kevin Lamoureux (Winnipeg North),Liberal,Yea,
Ms. Linda Lapointe (Rivière-des-Mille-Îles),Liberal,Yea,
Ms. Hélène Laverdière (Laurier—Sainte-Marie),NDP,Yea,
Mr. Paul Lefebvre (Sudbury),Liberal,Yea,
Mr. Andrew Leslie (Orléans),Liberal,,Paired
Mr. Joël Lightbound (Louis-Hébert),Liberal,Yea,
Mrs. Alaina Lockhart (Fundy Royal),Liberal,Yea,
Mr. Wayne Long (Saint John—Rothesay),Liberal,Yea,
Mr. Lloyd Longfield (Guelph),Liberal,Yea,
Ms. Karen Ludwig (New Brunswick Southwest),Liberal,Yea,
Mr. Larry Maguire (Brandon—Souris),Conservative,Nay,
Mr. James Maloney (Etobicoke—Lakeshore),Liberal,Yea,
Mr. Rémi Massé (Avignon—La Mitis—Matane—Matapédia),Liberal,Yea,
Mr. Bryan May (Cambridge),Liberal,Yea,
Ms. Elizabeth May (Saanich—Gulf Islands),Green Party,Yea,
Mr. Kelly McCauley (Edmonton West),Conservative,Nay,
Mr. Ken McDonald (Avalon),Liberal,Yea,
Mr. David McGuinty (Ottawa South),Liberal,Yea,
Mr. John McKay (Scarborough—Guildwood),Liberal,Yea,
Mr. Ron McKinnon (Coquitlam—Port Coquitlam),Liberal,Yea,
Ms. Christine Moore (Abitibi—Témiscamingue),NDP,,Paired
Mr. Robert Morrissey (Egmont),Liberal,Yea,
Mr. Pierre Nantel (Longueuil—Saint-Hubert),NDP,Yea,
Mr. John Nater (Perth—Wellington),Conservative,Nay,
Mr. Robert Nault (Kenora),Liberal,Yea,
Ms. Mary Ng (Markham—Thornhill),Liberal,Yea,
Mr. Rob Nicholson (Niagara Falls),Conservative,Nay,
Mr. Robert Oliphant (Don Valley West),Liberal,Yea,
Mr. Seamus O'Regan (St. John's South—Mount Pearl),Liberal,Yea,
Ms. Monique Pauzé (Repentigny),Bloc Québécois,Nay,
Mr. Joe Peschisolido (Steveston—Richmond East),Liberal,Yea,
Ms. Ginette Petitpas Taylor (Moncton—Riverview—Dieppe),Liberal,Yea,
Mr. Michel Picard (Montarville),Liberal,Yea,
Mr. Jean-Claude Poissant (La Prairie),Liberal,Yea,
Ms. Anne Minh-Thu Quach (Salaberry—Suroît),NDP,Yea,
Ms. Carla Qualtrough (Delta),Liberal,Yea,
Ms. Michelle Rempel (Calgary Nose Hill),Conservative,Nay,
Mr. Churence Rogers (Bonavista—Burin—Trinity),Liberal,Yea,
Mr. Harjit S. Sajjan (Vancouver South),Liberal,Yea,
Mr. Ramesh Sangha (Brampton Centre),Liberal,Yea,
Ms. Brigitte Sansoucy (Saint-Hyacinthe—Bagot),NDP,Yea,
Ms. Judy A. Sgro (Humber River—Black Creek),Liberal,Yea,
Mrs. Brenda Shanahan (Châteauguay—Lacolle),Liberal,Yea,
Mr. Scott Simms (Coast of Bays—Central—Notre Dame),Liberal,Yea,
Mr. Francesco Sorbara (Vaughan—Woodbridge),Liberal,Yea,
Mr. Sven Spengemann (Mississauga—Lakeshore),Liberal,Yea,
Mr. Gabriel Ste-Marie (Joliette),Bloc Québécois,Nay,
Mr. Mark Strahl (Chilliwack—Hope),Conservative,Nay,
Mr. David Sweet (Flamborough—Glanbrook),Conservative,Nay,
Mr. Marwan Tabbara (Kitchener South—Hespeler),Liberal,Yea,
Mr. Geng Tan (Don Valley North),Liberal,Yea,
Mr. Brad Trost (Saskatoon—University),Conservative,Nay,
Mr. Dan Vandal (Saint Boniface—Saint Vital),Liberal,Yea,
Mrs. Karen Vecchio (Elgin—Middlesex—London),Conservative,Nay,
Mr. Arif Virani (Parkdale—High Park),Liberal,Yea,
Mr. Mark Warawa (Langley—Aldergrove),Conservative,,Paired
Mr. Kevin Waugh (Saskatoon—Grasswood),Conservative,Nay,
Mr. Len Webber (Calgary Confederation),Conservative,Nay,
Mr. Borys Wrzesnewskyj (Etobicoke Centre),Liberal,Yea,
Ms. Jean Yip (Scarborough—Agincourt),Liberal,Yea,
Ms. Kate Young (London West),Liberal,,Paired
