Member of Parliament,Political Affiliation,Member Voted,Paired
Mr. Ziad Aboultaif (Edmonton Manning),Conservative,Yea,
Mr. Dan Albas (Central Okanagan—Similkameen—Nicola),Conservative,Yea,
Mr. Harold Albrecht (Kitchener—Conestoga),Conservative,Yea,
Mr. John Aldag (Cloverdale—Langley City),Liberal,Yea,
Mr. Omar Alghabra (Mississauga Centre),Liberal,Yea,
Ms. Leona Alleslev (Aurora—Oak Ridges—Richmond Hill),Conservative,Yea,
Mr. William Amos (Pontiac),Liberal,Yea,
Mr. Gary Anandasangaree (Scarborough—Rouge Park),Liberal,Yea,
Mr. David Anderson (Cypress Hills—Grasslands),Conservative,Yea,
Mr. Mel Arnold (North Okanagan—Shuswap),Conservative,Yea,
Mr. René Arseneault (Madawaska—Restigouche),Liberal,Yea,
Mr. Chandra Arya (Nepean),Liberal,Yea,
Mr. Robert Aubin (Trois-Rivières),NDP,Yea,
Mr. Ramez Ayoub (Thérèse-De Blainville),Liberal,Yea,
Mr. Vance Badawey (Niagara Centre),Liberal,Yea,
Mr. Larry Bagnell (Yukon),Liberal,Yea,
Mr. Navdeep Bains (Mississauga—Malton),Liberal,Yea,
Mr. Xavier Barsalou-Duval (Pierre-Boucher—Les Patriotes—Verchères),Bloc Québécois,Yea,
Mr. Frank Baylis (Pierrefonds—Dollard),Liberal,Yea,
Mr. Mario Beaulieu (La Pointe-de-l'Île),Bloc Québécois,Yea,
Ms. Carolyn Bennett (Toronto—St. Paul's),Liberal,Yea,
Ms. Sheri Benson (Saskatoon West),NDP,Yea,
Mr. Bob Benzen (Calgary Heritage),Conservative,Yea,
Ms. Candice Bergen (Portage—Lisgar),Conservative,Yea,
Mr. James Bezan (Selkirk—Interlake—Eastman),Conservative,Yea,
Ms. Marie-Claude Bibeau (Compton—Stanstead),Liberal,Yea,
Mr. Chris Bittle (St. Catharines),Liberal,Yea,
Mr. Daniel Blaikie (Elmwood—Transcona),NDP,Yea,
Mr. Bill Blair (Scarborough Southwest),Liberal,Yea,
Ms. Rachel Blaney (North Island—Powell River),NDP,Yea,
Mr. Steven Blaney (Bellechasse—Les Etchemins—Lévis),Conservative,Yea,
Mrs. Kelly Block (Carlton Trail—Eagle Creek),Conservative,Yea,
Mr. Mike Bossio (Hastings—Lennox and Addington),Liberal,Yea,
Mrs. Sylvie Boucher (Beauport—Côte-de-Beaupré—Île d'Orléans—Charlevoix),Conservative,Yea,
Ms. Marjolaine Boutin-Sweet (Hochelaga),NDP,Yea,
Mr. John Brassard (Barrie—Innisfil),Conservative,Yea,
Mr. Bob Bratina (Hamilton East—Stoney Creek),Liberal,Yea,
Mr. Pierre Breton (Shefford),Liberal,Yea,
Mr. Scott Brison (Kings—Hants),Liberal,Yea,
Ms. Ruth Ellen Brosseau (Berthier—Maskinongé),NDP,Yea,
Mrs. Celina Caesar-Chavannes (Whitby),Liberal,Yea,
Mr. Blaine Calkins (Red Deer—Lacombe),Conservative,Yea,
Mr. Richard Cannings (South Okanagan—West Kootenay),NDP,Yea,
Mr. Guy Caron (Rimouski-Neigette—Témiscouata—Les Basques),NDP,Yea,
Mr. Colin Carrie (Oshawa),Conservative,Yea,
Mr. Sean Casey (Charlottetown),Liberal,Yea,
Mr. Bill Casey (Cumberland—Colchester),Liberal,Yea,
Ms. Bardish Chagger (Waterloo),Liberal,Yea,
Mr. François-Philippe Champagne (Saint-Maurice—Champlain),Liberal,Yea,
Mr. Shaun Chen (Scarborough North),Liberal,Yea,
Mr. François Choquette (Drummond),NDP,Yea,
Mr. Alupa Clarke (Beauport—Limoilou),Conservative,Yea,
Mr. Michael Cooper (St. Albert—Edmonton),Conservative,Yea,
Mr. Nathan Cullen (Skeena—Bulkley Valley),NDP,Yea,
Mr. Rodger Cuzner (Cape Breton—Canso),Liberal,Yea,
Ms. Julie Dabrusin (Toronto—Danforth),Liberal,Yea,
Ms. Pam Damoff (Oakville North—Burlington),Liberal,Yea,
Mr. Don Davies (Vancouver Kingsway),NDP,Yea,
Mr. Matt DeCourcey (Fredericton),Liberal,Yea,
Mr. Gérard Deltell (Louis-Saint-Laurent),Conservative,Yea,
Mr. Sukh Dhaliwal (Surrey—Newton),Liberal,Yea,
Ms. Anju Dhillon (Dorval—Lachine—LaSalle),Liberal,Yea,
Mr. Kerry Diotte (Edmonton Griesbach),Conservative,Yea,
Mr. Fin Donnelly (Port Moody—Coquitlam),NDP,Yea,
Mr. Earl Dreeshen (Red Deer—Mountain View),Conservative,Yea,
Mr. Francis Drouin (Glengarry—Prescott—Russell),Liberal,Yea,
Mr. Matthew Dubé (Beloeil—Chambly),NDP,Yea,
Mr. Emmanuel Dubourg (Bourassa),Liberal,Yea,
Mr. Jean-Yves Duclos (Québec),Liberal,Yea,
Mr. Terry Duguid (Winnipeg South),Liberal,Yea,
Ms. Kirsty Duncan (Etobicoke North),Liberal,Yea,
Ms. Linda Duncan (Edmonton Strathcona),NDP,Yea,
Mr. Pierre-Luc Dusseault (Sherbrooke),NDP,Yea,
Mr. Scott Duvall (Hamilton Mountain),NDP,Yea,
Mr. Wayne Easter (Malpeque),Liberal,Yea,
Mr. Jim Eglinski (Yellowhead),Conservative,Yea,
Mr. Ali Ehsassi (Willowdale),Liberal,Yea,
Mr. Fayçal El-Khoury (Laval—Les Îles),Liberal,Yea,
Mr. Neil Ellis (Bay of Quinte),Liberal,Yea,
Mr. Mark Eyking (Sydney—Victoria),Liberal,Yea,
Mr. Doug Eyolfson (Charleswood—St. James—Assiniboia—Headingley),Liberal,Yea,
Mr. Ted Falk (Provencher),Conservative,Yea,
Mrs. Rosemarie Falk (Battlefords—Lloydminster),Conservative,Yea,
Mr. Greg Fergus (Hull—Aylmer),Liberal,Yea,
Mr. Andy Fillmore (Halifax),Liberal,Yea,
Ms. Diane Finley (Haldimand—Norfolk),Conservative,Yea,
Mr. Pat Finnigan (Miramichi—Grand Lake),Liberal,Yea,
Mr. Darren Fisher (Dartmouth—Cole Harbour),Liberal,Yea,
Mr. Rhéal Fortin (Rivière-du-Nord),Bloc Québécois,Yea,
Mr. Colin Fraser (West Nova),Liberal,Yea,
Mr. Sean Fraser (Central Nova),Liberal,Yea,
Ms. Chrystia Freeland (University—Rosedale),Liberal,Yea,
Mr. Stephen Fuhr (Kelowna—Lake Country),Liberal,Yea,
Mrs. Cheryl Gallant (Renfrew—Nipissing—Pembroke),Conservative,Yea,
Mr. Marc Garneau (Notre-Dame-de-Grâce—Westmount),Liberal,Yea,
Mr. Randall Garrison (Esquimalt—Saanich—Sooke),NDP,Yea,
Mr. Garnett Genuis (Sherwood Park—Fort Saskatchewan),Conservative,Yea,
Mr. Mark Gerretsen (Kingston and the Islands),Liberal,Yea,
Ms. Marilyn Gladu (Sarnia—Lambton),Conservative,Yea,
Mr. Joël Godin (Portneuf—Jacques-Cartier),Conservative,Yea,
Ms. Pamela Goldsmith-Jones (West Vancouver—Sunshine Coast—Sea to Sky Country),Liberal,Yea,
Mr. Ralph Goodale (Regina—Wascana),Liberal,Yea,
Ms. Karina Gould (Burlington),Liberal,Yea,
Mr. Jacques Gourde (Lévis—Lotbinière),Conservative,Yea,
Mr. David de Burgh Graham (Laurentides—Labelle),Liberal,Yea,
Ms. Patty Hajdu (Thunder Bay—Superior North),Liberal,Yea,
Ms. Cheryl Hardcastle (Windsor—Tecumseh),NDP,Yea,
Mr. Ken Hardie (Fleetwood—Port Kells),Liberal,Yea,
Mr. T.J. Harvey (Tobique—Mactaquac),Liberal,Yea,
Mr. Richard Hébert (Lac-Saint-Jean),Liberal,Yea,
Mr. Kent Hehr (Calgary Centre),Liberal,Yea,
Mr. Gordie Hogg (South Surrey—White Rock),Liberal,Yea,
Mr. Mark Holland (Ajax),Liberal,Yea,
Mr. Anthony Housefather (Mount Royal),Liberal,Yea,
Mrs. Carol Hughes (Algoma—Manitoulin—Kapuskasing),NDP,Yea,
Mr. Ahmed Hussen (York South—Weston),Liberal,Yea,
Ms. Gudie Hutchings (Long Range Mountains),Liberal,Yea,
Mr. Angelo Iacono (Alfred-Pellan),Liberal,Yea,
Mr. Matt Jeneroux (Edmonton Riverbend),Conservative,Yea,
Mr. Gord Johns (Courtenay—Alberni),NDP,Yea,
Ms. Georgina Jolibois (Desnethé—Missinippi—Churchill River),NDP,Yea,
Ms. Mélanie Joly (Ahuntsic-Cartierville),Liberal,Yea,
Mrs. Bernadette Jordan (South Shore—St. Margarets),Liberal,Yea,
Mr. Majid Jowhari (Richmond Hill),Liberal,Yea,
Mr. Peter Julian (New Westminster—Burnaby),NDP,Yea,
Mr. Darshan Singh Kang (Calgary Skyview),Independent,Yea,
Mr. Pat Kelly (Calgary Rocky Ridge),Conservative,Yea,
Mr. Peter Kent (Thornhill),Conservative,Yea,
Ms. Iqra Khalid (Mississauga—Erin Mills),Liberal,Yea,
Ms. Kamal Khera (Brampton West),Liberal,Yea,
Mr. Tom Kmiec (Calgary Shepard),Conservative,Yea,
Mrs. Stephanie Kusie (Calgary Midnapore),Conservative,Yea,
Ms. Jenny Kwan (Vancouver East),NDP,Yea,
Mr. Mike Lake (Edmonton—Wetaskiwin),Conservative,Yea,
Ms. Emmanuella Lambropoulos (Saint-Laurent),Liberal,Yea,
Mr. David Lametti (LaSalle—Émard—Verdun),Liberal,Yea,
Mr. Kevin Lamoureux (Winnipeg North),Liberal,Yea,
Ms. Linda Lapointe (Rivière-des-Mille-Îles),Liberal,Yea,
Mr. Stéphane Lauzon (Argenteuil—La Petite-Nation),Liberal,Yea,
Ms. Hélène Laverdière (Laurier—Sainte-Marie),NDP,Yea,
Mr. Dominic LeBlanc (Beauséjour),Liberal,Yea,
Mrs. Diane Lebouthillier (Gaspésie—Les Îles-de-la-Madeleine),Liberal,Yea,
Mr. Paul Lefebvre (Sudbury),Liberal,Yea,
Mr. Andrew Leslie (Orléans),Liberal,Yea,
Mr. Michael Levitt (York Centre),Liberal,Yea,
Mr. Ron Liepert (Calgary Signal Hill),Conservative,Yea,
Mr. Joël Lightbound (Louis-Hébert),Liberal,Yea,
Mr. Ben Lobb (Huron—Bruce),Conservative,Yea,
Mrs. Alaina Lockhart (Fundy Royal),Liberal,Yea,
Mr. Wayne Long (Saint John—Rothesay),Liberal,Yea,
Mr. Lloyd Longfield (Guelph),Liberal,Yea,
Ms. Karen Ludwig (New Brunswick Southwest),Liberal,Yea,
Mr. Tom Lukiwski (Moose Jaw—Lake Centre—Lanigan),Conservative,Yea,
Mr. Lawrence MacAulay (Cardigan),Liberal,Yea,
Mr. Dave MacKenzie (Oxford),Conservative,Yea,
Mr. Steven MacKinnon (Gatineau),Liberal,Yea,
Mr. Larry Maguire (Brandon—Souris),Conservative,Yea,
Ms. Sheila Malcolmson (Nanaimo—Ladysmith),NDP,Yea,
Mr. James Maloney (Etobicoke—Lakeshore),Liberal,Yea,
Mr. Simon Marcil (Mirabel),Bloc Québécois,Yea,
Mr. Richard Martel (Chicoutimi—Le Fjord),Conservative,Yea,
Mr. Rémi Massé (Avignon—La Mitis—Matane—Matapédia),Liberal,Yea,
Ms. Irene Mathyssen (London—Fanshawe),NDP,Yea,
Mr. Bryan May (Cambridge),Liberal,Yea,
Ms. Elizabeth May (Saanich—Gulf Islands),Green Party,Yea,
Mr. Kelly McCauley (Edmonton West),Conservative,Yea,
Mr. Phil McColeman (Brantford—Brant),Conservative,Yea,
Mrs. Karen McCrimmon (Kanata—Carleton),Liberal,Yea,
Mr. Ken McDonald (Avalon),Liberal,Yea,
Mr. David McGuinty (Ottawa South),Liberal,Yea,
Ms. Catherine McKenna (Ottawa Centre),Liberal,Yea,
Mr. Ron McKinnon (Coquitlam—Port Coquitlam),Liberal,Yea,
Mr. Michael McLeod (Northwest Territories),Liberal,Yea,
Mrs. Cathy McLeod (Kamloops—Thompson—Cariboo),Conservative,Yea,
Mrs. Alexandra Mendès (Brossard—Saint-Lambert),Liberal,Yea,
Ms. MaryAnn Mihychuk (Kildonan—St. Paul),Liberal,Yea,
Ms. Christine Moore (Abitibi—Témiscamingue),NDP,Yea,
Mr. Robert Morrissey (Egmont),Liberal,Yea,
Mr. Glen Motz (Medicine Hat—Cardston—Warner),Conservative,Yea,
Ms. Joyce Murray (Vancouver Quadra),Liberal,Yea,
Mr. Pierre Nantel (Longueuil—Saint-Hubert),NDP,Yea,
Mrs. Eva Nassif (Vimy),Liberal,Yea,
Mr. John Nater (Perth—Wellington),Conservative,Yea,
Mr. Robert Nault (Kenora),Liberal,Yea,
Mr. Rob Nicholson (Niagara Falls),Conservative,Yea,
Mr. Alexander Nuttall (Barrie—Springwater—Oro-Medonte),Conservative,Yea,
Mr. Deepak Obhrai (Calgary Forest Lawn),Conservative,Yea,
Mr. Robert Oliphant (Don Valley West),Liberal,Yea,
Mr. John Oliver (Oakville),Liberal,Yea,
Mr. Seamus O'Regan (St. John's South—Mount Pearl),Liberal,Yea,
Mr. Erin O'Toole (Durham),Conservative,Yea,
Mr. Robert-Falcon Ouellette (Winnipeg Centre),Liberal,Yea,
Mr. Denis Paradis (Brome—Missisquoi),Liberal,Yea,
Mr. Pierre Paul-Hus (Charlesbourg—Haute-Saint-Charles),Conservative,Yea,
Ms. Monique Pauzé (Repentigny),Bloc Québécois,Yea,
Mr. Joe Peschisolido (Steveston—Richmond East),Liberal,Yea,
Ms. Ginette Petitpas Taylor (Moncton—Riverview—Dieppe),Liberal,Yea,
Mrs. Jane Philpott (Markham—Stouffville),Liberal,Yea,
Mr. Michel Picard (Montarville),Liberal,Yea,
Mr. Louis Plamondon (Bécancour—Nicolet—Saurel),Bloc Québécois,Yea,
Mr. Pierre Poilievre (Carleton),Conservative,Yea,
Mr. Jean-Claude Poissant (La Prairie),Liberal,Yea,
Ms. Anne Minh-Thu Quach (Salaberry—Suroît),NDP,Yea,
Ms. Carla Qualtrough (Delta),Liberal,Yea,
Mr. Murray Rankin (Victoria),NDP,Yea,
Ms. Yasmin Ratansi (Don Valley East),Liberal,Yea,
Mr. Alain Rayes (Richmond—Arthabaska),Conservative,Yea,
Mr. Scott Reid (Lanark—Frontenac—Kingston),Conservative,Yea,
Ms. Michelle Rempel (Calgary Nose Hill),Conservative,Yea,
Mr. Blake Richards (Banff—Airdrie),Conservative,Yea,
Mr. Jean Rioux (Saint-Jean),Liberal,Yea,
Mr. Yves Robillard (Marc-Aurèle-Fortin),Liberal,Yea,
Mr. Pablo Rodriguez (Honoré-Mercier),Liberal,Yea,
Mr. Churence Rogers (Bonavista—Burin—Trinity),Liberal,Yea,
Mrs. Sherry Romanado (Longueuil—Charles-LeMoyne),Liberal,Yea,
Mr. Dan Ruimy (Pitt Meadows—Maple Ridge),Liberal,Yea,
Mr. Don Rusnak (Thunder Bay—Rainy River),Liberal,Yea,
Mr. Romeo Saganash (Abitibi—Baie-James—Nunavik—Eeyou),NDP,Yea,
Ms. Ruby Sahota (Brampton North),Liberal,Yea,
Mr. Raj Saini (Kitchener Centre),Liberal,Yea,
Mr. Harjit S. Sajjan (Vancouver South),Liberal,Yea,
Mr. Darrell Samson (Sackville—Preston—Chezzetcook),Liberal,Yea,
Mr. Ramesh Sangha (Brampton Centre),Liberal,Yea,
Ms. Brigitte Sansoucy (Saint-Hyacinthe—Bagot),NDP,Yea,
Mr. Bob Saroya (Markham—Unionville),Conservative,Yea,
Mr. Peter Schiefke (Vaudreuil—Soulanges),Liberal,Yea,
Mr. Jamie Schmale (Haliburton—Kawartha Lakes—Brock),Conservative,Yea,
Mrs. Deborah Schulte (King—Vaughan),Liberal,Yea,
Mr. Marc Serré (Nickel Belt),Liberal,Yea,
Ms. Judy A. Sgro (Humber River—Black Creek),Liberal,Yea,
Mrs. Brenda Shanahan (Châteauguay—Lacolle),Liberal,Yea,
Mr. Terry Sheehan (Sault Ste. Marie),Liberal,Yea,
Mr. Martin Shields (Bow River),Conservative,Yea,
Mr. Bev Shipley (Lambton—Kent—Middlesex),Conservative,Yea,
Mr. Jati Sidhu (Mission—Matsqui—Fraser Canyon),Liberal,Yea,
Ms. Sonia Sidhu (Brampton South),Liberal,Yea,
Mr. Gagan Sikand (Mississauga—Streetsville),Liberal,Yea,
Mr. Scott Simms (Coast of Bays—Central—Notre Dame),Liberal,Yea,
Mr. Robert Sopuck (Dauphin—Swan River—Neepawa),Conservative,Yea,
Mr. Francesco Sorbara (Vaughan—Woodbridge),Liberal,Yea,
Mr. Kevin Sorenson (Battle River—Crowfoot),Conservative,Yea,
Mr. Sven Spengemann (Mississauga—Lakeshore),Liberal,Yea,
Mr. Bruce Stanton (Simcoe North),Conservative,Yea,
Mr. Gabriel Ste-Marie (Joliette),Bloc Québécois,Yea,
Mr. Wayne Stetski (Kootenay—Columbia),NDP,Yea,
Mr. Mark Strahl (Chilliwack—Hope),Conservative,Yea,
Mrs. Shannon Stubbs (Lakeland),Conservative,Yea,
Mr. David Sweet (Flamborough—Glanbrook),Conservative,Yea,
Mr. Marwan Tabbara (Kitchener South—Hespeler),Liberal,Yea,
Mr. Geng Tan (Don Valley North),Liberal,Yea,
Ms. Filomena Tassi (Hamilton West—Ancaster—Dundas),Liberal,Yea,
Mr. Luc Thériault (Montcalm),Bloc Québécois,Yea,
Ms. Rachael Thomas (Lethbridge),Conservative,Yea,
Mr. David Tilson (Dufferin—Caledon),Conservative,Yea,
Mr. Hunter Tootoo (Nunavut),Independent,Yea,
Mr. Brad Trost (Saskatoon—University),Conservative,Yea,
Mr. Justin Trudeau (Papineau),Liberal,Yea,
Ms. Karine Trudel (Jonquière),NDP,Yea,
Mr. Dave Van Kesteren (Chatham-Kent—Leamington),Conservative,Yea,
Mr. Dan Vandal (Saint Boniface—Saint Vital),Liberal,Yea,
Ms. Anita Vandenbeld (Ottawa West—Nepean),Liberal,Yea,
Mr. Adam Vaughan (Spadina—Fort York),Liberal,Yea,
Mrs. Karen Vecchio (Elgin—Middlesex—London),Conservative,Yea,
Mr. Arnold Viersen (Peace River—Westlock),Conservative,Yea,
Mr. Arif Virani (Parkdale—High Park),Liberal,Yea,
Mrs. Cathay Wagantall (Yorkton—Melville),Conservative,Yea,
Mr. Mark Warawa (Langley—Aldergrove),Conservative,Yea,
Mr. Chris Warkentin (Grande Prairie—Mackenzie),Conservative,Yea,
Mr. Kevin Waugh (Saskatoon—Grasswood),Conservative,Yea,
Mr. Len Webber (Calgary Confederation),Conservative,Yea,
Mr. Erin Weir (Regina—Lewvan),Co-operative Commonwealth Federation,Yea,
Mr. Nick Whalen (St. John's East),Liberal,Yea,
Mrs. Alice Wong (Richmond Centre),Conservative,Yea,
Mr. Borys Wrzesnewskyj (Etobicoke Centre),Liberal,Yea,
Ms. Jean Yip (Scarborough—Agincourt),Liberal,Yea,
Ms. Kate Young (London West),Liberal,Yea,
Mr. David Yurdiga (Fort McMurray—Cold Lake),Conservative,Yea,
Mrs. Salma Zahid (Scarborough Centre),Liberal,Yea,
