Member of Parliament,Political Affiliation,Member Voted,Paired
Mr. Jim Abbott (Kootenay—Columbia),Conservative,Nay,
Mrs. Diane Ablonczy (Calgary—Nose Hill),Conservative,Nay,
Mr. Harold Albrecht (Kitchener—Conestoga),Conservative,Nay,
Mr. Mike Allen (Tobique—Mactaquac),Conservative,Nay,
Mr. Dean Allison (Niagara West—Glanbrook),Conservative,Nay,
Ms. Rona Ambrose (Edmonton—Spruce Grove),Conservative,Nay,
Mr. Rob Anders (Calgary West),Conservative,Nay,
Mr. David Anderson (Cypress Hills—Grasslands),Conservative,Nay,
Mr. Guy André (Berthier—Maskinongé),Bloc Québécois,Nay,
Mr. Charlie Angus (Timmins—James Bay),NDP,Nay,
Mr. Gérard Asselin (Manicouagan),Bloc Québécois,Nay,
Mr. Alex Atamanenko (British Columbia Southern Interior),NDP,Nay,
Mr. Claude Bachand (Saint-Jean),Bloc Québécois,Nay,
Mr. John Baird (Ottawa West—Nepean),Conservative,Nay,
Mrs. Vivian Barbot (Papineau),Bloc Québécois,,Paired
Mr. Dave Batters (Palliser),Conservative,Nay,
Ms. Catherine Bell (Vancouver Island North),NDP,Nay,
Mr. André Bellavance (Richmond—Arthabaska),Bloc Québécois,Nay,
Mr. Leon Benoit (Vegreville—Wainwright),Conservative,Nay,
Mr. Maxime Bernier (Beauce),Conservative,Nay,
Mr. Dennis Bevington (Western Arctic),NDP,Nay,
Mr. James Bezan (Selkirk—Interlake),Conservative,Nay,
Mr. Bernard Bigras (Rosemont—La Petite-Patrie),Bloc Québécois,Nay,
Ms. Dawn Black (New Westminster—Coquitlam),NDP,Nay,
Mr. Jean-Pierre Blackburn (Jonquière—Alma),Conservative,Nay,
Mr. Raynald Blais (Gaspésie—Îles-de-la-Madeleine),Bloc Québécois,Nay,
Mr. Steven Blaney (Lévis—Bellechasse),Conservative,Nay,
Ms. France Bonsant (Compton—Stanstead),Bloc Québécois,Nay,
Mr. Robert Bouchard (Chicoutimi—Le Fjord),Bloc Québécois,Nay,
Mrs. Sylvie Boucher (Beauport—Limoilou),Conservative,Nay,
Ms. Diane Bourgeois (Terrebonne—Blainville),Bloc Québécois,Nay,
Mr. Garry Breitkreuz (Yorkton—Melville),Conservative,Nay,
Mr. Gordon Brown (Leeds—Grenville),Conservative,Nay,
Mr. Patrick Brown (Barrie),Conservative,Nay,
Mr. Rod Bruinooge (Winnipeg South),Conservative,Nay,
Ms. Paule Brunelle (Trois-Rivières),Bloc Québécois,Nay,
Mr. Blaine Calkins (Wetaskiwin),Conservative,Nay,
Mr. Ron Cannan (Kelowna—Lake Country),Conservative,Nay,
Mr. Lawrence Cannon (Pontiac),Conservative,Nay,
Mr. Serge Cardin (Sherbrooke),Bloc Québécois,Nay,
Mr. Colin Carrie (Oshawa),Conservative,Nay,
Mr. Robert Carrier (Alfred-Pellan),Bloc Québécois,Nay,
Mr. Rick Casson (Lethbridge),Conservative,Nay,
Ms. Chris Charlton (Hamilton Mountain),NDP,Nay,
Mr. Michael Chong (Wellington—Halton Hills),Conservative,Nay,
Ms. Olivia Chow (Trinity—Spadina),NDP,Nay,
Mr. David Christopherson (Hamilton Centre),NDP,Nay,
Mr. Tony Clement (Parry Sound—Muskoka),Conservative,Nay,
Mr. Joe Comartin (Windsor—Tecumseh),NDP,Nay,
Mr. Joe Comuzzi (Thunder Bay—Superior North),Conservative,Nay,
Mr. Paul Crête (Montmagny—L'Islet—Kamouraska—Rivière-du-Loup),Bloc Québécois,Nay,
Ms. Jean Crowder (Nanaimo—Cowichan),NDP,Nay,
Mr. Nathan Cullen (Skeena—Bulkley Valley),NDP,Nay,
Mr. John Cummins (Delta—Richmond East),Conservative,Nay,
Mrs. Patricia Davidson (Sarnia—Lambton),Conservative,Nay,
Ms. Libby Davies (Vancouver East),NDP,Nay,
Mr. Stockwell Day (Okanagan—Coquihalla),Conservative,Nay,
Mrs. Claude DeBellefeuille (Beauharnois—Salaberry),Bloc Québécois,Nay,
Mr. Dean Del Mastro (Peterborough),Conservative,Nay,
Ms. Nicole Demers (Laval),Bloc Québécois,Nay,
Ms. Johanne Deschamps (Laurentides—Labelle),Bloc Québécois,Nay,
Mr. Barry Devolin (Haliburton—Kawartha Lakes—Brock),Conservative,Nay,
Mr. Paul Dewar (Ottawa Centre),NDP,Nay,
Mr. Stéphane Dion (Saint-Laurent—Cartierville),Liberal,Yea,
Senator Norman E. Doyle (St. John's East),Conservative,Nay,
Mr. Gilles Duceppe (Laurier—Sainte-Marie),Bloc Québécois,Nay,
Mr. Rick Dykstra (St. Catharines),Conservative,Nay,
Mr. David Emerson (Vancouver Kingsway),Conservative,Nay,
Mr. Ken Epp (Edmonton—Sherwood Park),Conservative,Nay,
Ms. Meili Faille (Vaudreuil-Soulanges),Bloc Québécois,Nay,
Mr. Ed Fast (Abbotsford),Conservative,Nay,
Ms. Diane Finley (Haldimand—Norfolk),Conservative,Nay,
Mr. Brian Fitzpatrick (Prince Albert),Conservative,Nay,
Mr. Jim Flaherty (Whitby—Oshawa),Conservative,Nay,
Mr. Steven Fletcher (Charleswood—St. James—Assiniboia),Conservative,Nay,
Mrs. Carole Freeman (Châteauguay—Saint-Constant),Bloc Québécois,Nay,
Ms. Christiane Gagnon (Québec),Bloc Québécois,Nay,
Mr. Royal Galipeau (Ottawa—Orléans),Conservative,Nay,
Mrs. Cheryl Gallant (Renfrew—Nipissing—Pembroke),Conservative,Nay,
Mr. Roger Gaudet (Montcalm),Bloc Québécois,Nay,
Mr. Yvon Godin (Acadie—Bathurst),NDP,Nay,
Mr. Peter Goldring (Edmonton East),Conservative,Nay,
Mr. Ralph Goodale (Wascana),Liberal,Yea,
Mr. Gary Goodyear (Cambridge),Conservative,Nay,
Mr. Jacques Gourde (Lotbinière—Chutes-de-la-Chaudière),Conservative,Nay,
Mr. Raymond Gravel (Repentigny),Bloc Québécois,Nay,
Mrs. Nina Grewal (Fleetwood—Port Kells),Conservative,Nay,
Ms. Monique Guay (Rivière-du-Nord),Bloc Québécois,Nay,
Mrs. Helena Guergis (Simcoe—Grey),Conservative,Nay,
Mr. Michel Guimond (Montmorency—Charlevoix—Haute-Côte-Nord),Bloc Québécois,Nay,
Mr. Art Hanger (Calgary Northeast),Conservative,Nay,
Mr. Stephen Harper (Calgary Southwest),Conservative,Nay,
Mr. Richard Harris (Cariboo—Prince George),Conservative,Nay,
Mr. Luc Harvey (Louis-Hébert),Conservative,Nay,
Mr. Laurie Hawn (Edmonton Centre),Conservative,Nay,
Mr. Loyola Hearn (St. John's South—Mount Pearl),Conservative,Nay,
Mr. Russ Hiebert (South Surrey—White Rock—Cloverdale),Conservative,Nay,
Mr. Jay Hill (Prince George—Peace River),Conservative,Nay,
Mrs. Betty Hinton (Kamloops—Thompson—Cariboo),Conservative,Nay,
Mr. Michael Ignatieff (Etobicoke—Lakeshore),Liberal,Yea,
Mr. Rahim Jaffer (Edmonton—Strathcona),Conservative,Nay,
Mr. Brian Jean (Fort McMurray—Athabasca),Conservative,Nay,
Mrs. Marlene Jennings (Notre-Dame-de-Grâce—Lachine),Liberal,Yea,
Mr. Peter Julian (Burnaby—New Westminster),NDP,Nay,
Mr. Randy Kamp (Pitt Meadows—Maple Ridge—Mission),Conservative,Nay,
Mr. Gerald Keddy (South Shore—St. Margaret's),Conservative,Nay,
Mr. Jason Kenney (Calgary Southeast),Conservative,Nay,
Mr. Wajid Khan (Mississauga—Streetsville),Conservative,Nay,
Mr. Ed Komarnicki (Souris—Moose Mountain),Conservative,Nay,
Mr. Maka Kotto (Saint-Lambert),Bloc Québécois,Nay,
Mr. Daryl Kramp (Prince Edward—Hastings),Conservative,Nay,
Mr. Jean-Yves Laforest (Saint-Maurice—Champlain),Bloc Québécois,Nay,
Mr. Mario Laframboise (Argenteuil—Papineau—Mirabel),Bloc Québécois,Nay,
Mr. Mike Lake (Edmonton—Mill Woods—Beaumont),Conservative,Nay,
Mr. Guy Lauzon (Stormont—Dundas—South Glengarry),Conservative,Nay,
Mrs. Carole Lavallée (Saint-Bruno—Saint-Hubert),Bloc Québécois,Nay,
Mr. Jack Layton (Toronto—Danforth),NDP,Nay,
Mr. Denis Lebel (Roberval—Lac-Saint-Jean),Conservative,Nay,
Mr. Marc Lemay (Abitibi—Témiscamingue),Bloc Québécois,Nay,
Mr. Pierre Lemieux (Glengarry—Prescott—Russell),Conservative,Nay,
Mr. Yves Lessard (Chambly—Borduas),Bloc Québécois,Nay,
Mr. Yvon Lévesque (Abitibi—Baie-James—Nunavik—Eeyou),Bloc Québécois,Nay,
Mr. Tom Lukiwski (Regina—Lumsden—Lake Centre),Conservative,Nay,
Mr. Gary Lunn (Saanich—Gulf Islands),Conservative,Nay,
Mr. James Lunney (Nanaimo—Alberni),Conservative,Nay,
Mr. Marcel Lussier (Brossard—La Prairie),Bloc Québécois,Nay,
Mr. Peter MacKay (Central Nova),Conservative,Nay,
Mr. Dave MacKenzie (Oxford),Conservative,Nay,
Mr. Luc Malo (Verchères—Les Patriotes),Bloc Québécois,Nay,
Mr. Fabian Manning (Avalon),Conservative,Nay,
Mr. Inky Mark (Dauphin—Swan River—Marquette),Conservative,Nay,
Mr. Wayne Marston (Hamilton East—Stoney Creek),NDP,Nay,
Mr. Tony Martin (Sault Ste. Marie),NDP,Nay,
Mr. Pat Martin (Winnipeg Centre),NDP,Nay,
Mr. Brian Masse (Windsor West),NDP,Nay,
Ms. Irene Mathyssen (London—Fanshawe),NDP,Nay,
Mr. Colin Mayes (Okanagan—Shuswap),Conservative,Nay,
Mr. John McCallum (Markham—Unionville),Liberal,Yea,
Ms. Alexa McDonough (Halifax),NDP,Nay,
Mr. Serge Ménard (Marc-Aurèle-Fortin),Bloc Québécois,Nay,
Mr. Réal Ménard (Hochelaga),Bloc Québécois,Nay,
Mr. Ted Menzies (Macleod),Conservative,Nay,
Mr. Rob Merrifield (Yellowhead),Conservative,Nay,
Mr. Larry Miller (Bruce—Grey—Owen Sound),Conservative,Nay,
Mr. Bob Mills (Red Deer),Conservative,Nay,
Mr. James Moore (Port Moody—Westwood—Port Coquitlam),Conservative,Nay,
Mr. Rob Moore (Fundy Royal),Conservative,Nay,
Mrs. Maria Mourani (Ahuntsic),Bloc Québécois,Nay,
Mr. Thomas Mulcair (Outremont),NDP,Nay,
Mr. Richard Nadeau (Gatineau),Bloc Québécois,Nay,
Ms. Peggy Nash (Parkdale—High Park),NDP,Nay,
Mr. Rob Nicholson (Niagara Falls),Conservative,Nay,
Mr. Rick Norlock (Northumberland—Quinte West),Conservative,Nay,
Mr. Deepak Obhrai (Calgary East),Conservative,Nay,
Mr. Gordon O'Connor (Carleton—Mississippi Mills),Conservative,Nay,
Ms. Bev Oda (Durham),Conservative,Nay,
Mr. Christian Ouellet (Brome—Missisquoi),Bloc Québécois,Nay,
Mr. Brian Pallister (Portage—Lisgar),Conservative,,Paired
Mr. Pierre Paquette (Joliette),Bloc Québécois,Nay,
Mr. Christian Paradis (Mégantic—L'Érable),Conservative,Nay,
Mr. Gilles-A. Perron (Rivière-des-Mille-Îles),Bloc Québécois,Nay,
Mr. Daniel Petit (Charlesbourg—Haute-Saint-Charles),Conservative,Nay,
Ms. Pauline Picard (Drummond),Bloc Québécois,Nay,
Mr. Louis Plamondon (Bas-Richelieu—Nicolet—Bécancour),Bloc Québécois,Nay,
Mr. Pierre Poilievre (Nepean—Carleton),Conservative,Nay,
Mr. Jim Prentice (Calgary Centre-North),Conservative,Nay,
Mr. Joe Preston (Elgin—Middlesex—London),Conservative,Nay,
Ms. Penny Priddy (Surrey North),NDP,Nay,
Mr. Marcel Proulx (Hull—Aylmer),Liberal,Yea,
Mr. James Rajotte (Edmonton—Leduc),Conservative,Nay,
Mrs. Karen Redman (Kitchener Centre),Liberal,Yea,
Mr. Scott Reid (Lanark—Frontenac—Lennox and Addington),Conservative,Nay,
Mr. Lee Richardson (Calgary Centre),Conservative,Nay,
Mr. Gerry Ritz (Battlefords—Lloydminster),Conservative,Nay,
Mr. Jean-Yves Roy (Haute-Gaspésie—La Mitis—Matane—Matapédia),Bloc Québécois,Nay,
Ms. Denise Savoie (Victoria),NDP,Nay,
Mr. Andrew Scheer (Regina—Qu'Appelle),Conservative,Nay,
Mr. Gary Schellenberger (Perth—Wellington),Conservative,Nay,
Mr. Bev Shipley (Lambton—Kent—Middlesex),Conservative,Nay,
Mr. Bill Siksay (Burnaby—Douglas),NDP,Nay,
Mrs. Carol Skelton (Saskatoon—Rosetown—Biggar),Conservative,Nay,
Mrs. Joy Smith (Kildonan—St. Paul),Conservative,Nay,
Mr. Monte Solberg (Medicine Hat),Conservative,Nay,
Mr. Kevin Sorenson (Crowfoot),Conservative,Nay,
Mr. Bruce Stanton (Simcoe North),Conservative,Nay,
Mr. Thierry St-Cyr (Jeanne-Le Ber),Bloc Québécois,Nay,
Ms. Caroline St-Hilaire (Longueuil—Pierre-Boucher),Bloc Québécois,Nay,
Mr. Peter Stoffer (Sackville—Eastern Shore),NDP,Nay,
Mr. Brian Storseth (Westlock—St. Paul),Conservative,Nay,
Mr. Chuck Strahl (Chilliwack—Fraser Canyon),Conservative,Nay,
Mr. David Sweet (Ancaster—Dundas—Flamborough—Westdale),Conservative,Nay,
Mrs. Ève-Mary Thaï Thi Lac (Saint-Hyacinthe—Bagot),Bloc Québécois,Nay,
Ms. Louise Thibault (Rimouski-Neigette—Témiscouata—Les Basques),Independent,Nay,
Mr. Greg Thompson (New Brunswick Southwest),Conservative,Nay,
Mr. Myron Thompson (Wild Rose),Conservative,Nay,
Mr. David Tilson (Dufferin—Caledon),Conservative,Nay,
Mr. Vic Toews (Provencher),Conservative,Nay,
Mr. Brad Trost (Saskatoon—Humboldt),Conservative,Nay,
Mr. Merv Tweed (Brandon—Souris),Conservative,Nay,
Mr. Dave Van Kesteren (Chatham-Kent—Essex),Conservative,Nay,
Mr. Peter Van Loan (York—Simcoe),Conservative,Nay,
Mr. Maurice Vellacott (Saskatoon—Wanuskewin),Conservative,Nay,
Senator Josée Verner (Louis-Saint-Laurent),Conservative,Nay,
Mr. Robert Vincent (Shefford),Bloc Québécois,Nay,
Mr. Mike Wallace (Burlington),Conservative,Nay,
Mr. Mark Warawa (Langley),Conservative,Nay,
Mr. Chris Warkentin (Peace River),Conservative,Nay,
Ms. Judy Wasylycia-Leis (Winnipeg North),NDP,Nay,
Mr. Jeff Watson (Essex),Conservative,Nay,
Mr. John G. Williams (Edmonton—St. Albert),Conservative,Nay,
Mrs. Lynne Yelich (Blackstrap),Conservative,Nay,
