Member of Parliament,Political Affiliation,Member Voted,Paired
Mr. Jim Abbott (Kootenay—Columbia),Conservative,Yea,
Mrs. Diane Ablonczy (Calgary—Nose Hill),Conservative,Yea,
Mr. Harold Albrecht (Kitchener—Conestoga),Conservative,Yea,
Mr. Mike Allen (Tobique—Mactaquac),Conservative,Yea,
Mr. Dean Allison (Niagara West—Glanbrook),Conservative,Yea,
Ms. Rona Ambrose (Edmonton—Spruce Grove),Conservative,Yea,
Mr. Rob Anders (Calgary West),Conservative,Yea,
Mr. David Anderson (Cypress Hills—Grasslands),Conservative,Yea,
Mr. Guy André (Berthier—Maskinongé),Bloc Québécois,Nay,
Mr. Charlie Angus (Timmins—James Bay),NDP,Nay,
Mr. Alex Atamanenko (British Columbia Southern Interior),NDP,Nay,
Mr. Claude Bachand (Saint-Jean),Bloc Québécois,Nay,
Mr. Larry Bagnell (Yukon),Liberal,Yea,
Mr. Navdeep Bains (Mississauga—Brampton South),Liberal,Yea,
Mr. John Baird (Ottawa West—Nepean),Conservative,Yea,
Mrs. Vivian Barbot (Papineau),Bloc Québécois,,Paired
Mrs. Sue Barnes (London West),Liberal,Yea,
Mr. Dave Batters (Palliser),Conservative,Yea,
Mr. Mauril Bélanger (Ottawa—Vanier),Liberal,Yea,
Mr. Don Bell (North Vancouver),Liberal,Yea,
Ms. Catherine Bell (Vancouver Island North),NDP,Nay,
Mr. André Bellavance (Richmond—Arthabaska),Bloc Québécois,,Paired
Ms. Carolyn Bennett (St. Paul's),Liberal,Yea,
Mr. Leon Benoit (Vegreville—Wainwright),Conservative,Yea,
Mr. Maxime Bernier (Beauce),Conservative,Yea,
Mr. Dennis Bevington (Western Arctic),NDP,Nay,
Mr. James Bezan (Selkirk—Interlake),Conservative,Yea,
Mr. Bernard Bigras (Rosemont—La Petite-Patrie),Bloc Québécois,Nay,
Ms. Dawn Black (New Westminster—Coquitlam),NDP,Nay,
Mr. Jean-Pierre Blackburn (Jonquière—Alma),Conservative,Yea,
Mr. Raynald Blais (Gaspésie—Îles-de-la-Madeleine),Bloc Québécois,Nay,
Mr. Steven Blaney (Lévis—Bellechasse),Conservative,Yea,
Mr. Raymond Bonin (Nickel Belt),Liberal,Yea,
Ms. France Bonsant (Compton—Stanstead),Bloc Québécois,,Paired
Mr. Ken Boshcoff (Thunder Bay—Rainy River),Liberal,Yea,
Mrs. Sylvie Boucher (Beauport—Limoilou),Conservative,Yea,
Ms. Diane Bourgeois (Terrebonne—Blainville),Bloc Québécois,Nay,
Mr. Garry Breitkreuz (Yorkton—Melville),Conservative,Yea,
Mr. Scott Brison (Kings—Hants),Liberal,Yea,
Mr. Gordon Brown (Leeds—Grenville),Conservative,Yea,
Mr. Patrick Brown (Barrie),Conservative,Yea,
Mr. Rod Bruinooge (Winnipeg South),Conservative,Yea,
Ms. Paule Brunelle (Trois-Rivières),Bloc Québécois,Nay,
Mr. Gerry Byrne (Humber—St. Barbe—Baie Verte),Liberal,Yea,
Mr. Blaine Calkins (Wetaskiwin),Conservative,Yea,
Mr. Ron Cannan (Kelowna—Lake Country),Conservative,Yea,
Mr. John Cannis (Scarborough Centre),Liberal,Yea,
Mr. Lawrence Cannon (Pontiac),Conservative,Yea,
Mr. Serge Cardin (Sherbrooke),Bloc Québécois,Nay,
Mr. Colin Carrie (Oshawa),Conservative,Yea,
Mr. Robert Carrier (Alfred-Pellan),Bloc Québécois,Nay,
Mr. Rick Casson (Lethbridge),Conservative,Yea,
Mrs. Brenda Chamberlain (Guelph),Liberal,Yea,
Ms. Chris Charlton (Hamilton Mountain),NDP,Nay,
Mr. Michael Chong (Wellington—Halton Hills),Conservative,Yea,
Ms. Olivia Chow (Trinity—Spadina),NDP,Nay,
Mr. David Christopherson (Hamilton Centre),NDP,Nay,
Mr. Tony Clement (Parry Sound—Muskoka),Conservative,Yea,
Mr. Denis Coderre (Bourassa),Liberal,Yea,
Mr. Joe Comartin (Windsor—Tecumseh),NDP,Nay,
Mr. Joe Comuzzi (Thunder Bay—Superior North),Conservative,Yea,
Mr. Irwin Cotler (Mount Royal),Liberal,Yea,
Mr. Paul Crête (Montmagny—L'Islet—Kamouraska—Rivière-du-Loup),Bloc Québécois,Nay,
Ms. Jean Crowder (Nanaimo—Cowichan),NDP,Nay,
Mr. Nathan Cullen (Skeena—Bulkley Valley),NDP,Nay,
Mr. Roy Cullen (Etobicoke North),Liberal,Yea,
Mr. John Cummins (Delta—Richmond East),Conservative,,Paired
Mr. Rodger Cuzner (Cape Breton—Canso),Liberal,Yea,
Mrs. Patricia Davidson (Sarnia—Lambton),Conservative,,Paired
Ms. Libby Davies (Vancouver East),NDP,Nay,
Mr. Stockwell Day (Okanagan—Coquihalla),Conservative,Yea,
Mr. Dean Del Mastro (Peterborough),Conservative,Yea,
Ms. Johanne Deschamps (Laurentides—Labelle),Bloc Québécois,Nay,
Mr. Barry Devolin (Haliburton—Kawartha Lakes—Brock),Conservative,Yea,
Mr. Paul Dewar (Ottawa Centre),NDP,Nay,
Ms. Ruby Dhalla (Brampton—Springdale),Liberal,Yea,
Mr. Stéphane Dion (Saint-Laurent—Cartierville),Liberal,Yea,
Mr. Ujjal Dosanjh (Vancouver South),Liberal,Yea,
Senator Norman E. Doyle (St. John's East),Conservative,Yea,
Mr. Ken Dryden (York Centre),Liberal,Yea,
Mr. Gilles Duceppe (Laurier—Sainte-Marie),Bloc Québécois,Nay,
Mr. Rick Dykstra (St. Catharines),Conservative,Yea,
Mr. Wayne Easter (Malpeque),Liberal,Yea,
Mr. David Emerson (Vancouver Kingsway),Conservative,Yea,
Mr. Ken Epp (Edmonton—Sherwood Park),Conservative,Yea,
Mr. Mark Eyking (Sydney—Victoria),Liberal,Yea,
Mr. Ed Fast (Abbotsford),Conservative,Yea,
Ms. Diane Finley (Haldimand—Norfolk),Conservative,Yea,
Mr. Brian Fitzpatrick (Prince Albert),Conservative,Yea,
Mr. Jim Flaherty (Whitby—Oshawa),Conservative,Yea,
Mr. Steven Fletcher (Charleswood—St. James—Assiniboia),Conservative,Yea,
Mrs. Carole Freeman (Châteauguay—Saint-Constant),Bloc Québécois,Nay,
Ms. Hedy Fry (Vancouver Centre),Liberal,Yea,
Ms. Christiane Gagnon (Québec),Bloc Québécois,Nay,
Mr. Royal Galipeau (Ottawa—Orléans),Conservative,Yea,
Mrs. Cheryl Gallant (Renfrew—Nipissing—Pembroke),Conservative,Yea,
Mr. Roger Gaudet (Montcalm),Bloc Québécois,,Paired
Mr. John Godfrey (Don Valley West),Liberal,Yea,
Mr. Yvon Godin (Acadie—Bathurst),NDP,Nay,
Mr. Peter Goldring (Edmonton East),Conservative,,Paired
Mr. Ralph Goodale (Wascana),Liberal,Yea,
Mr. Gary Goodyear (Cambridge),Conservative,Yea,
Mr. Jacques Gourde (Lotbinière—Chutes-de-la-Chaudière),Conservative,Yea,
Mrs. Nina Grewal (Fleetwood—Port Kells),Conservative,Yea,
Ms. Albina Guarnieri (Mississauga East—Cooksville),Liberal,Yea,
Ms. Monique Guay (Rivière-du-Nord),Bloc Québécois,Nay,
Mrs. Helena Guergis (Simcoe—Grey),Conservative,Yea,
Mr. Michel Guimond (Montmorency—Charlevoix—Haute-Côte-Nord),Bloc Québécois,Nay,
Mr. Art Hanger (Calgary Northeast),Conservative,Yea,
Mr. Stephen Harper (Calgary Southwest),Conservative,Yea,
Mr. Richard Harris (Cariboo—Prince George),Conservative,Yea,
Mr. Luc Harvey (Louis-Hébert),Conservative,Yea,
Mr. Laurie Hawn (Edmonton Centre),Conservative,Yea,
Mr. Loyola Hearn (St. John's South—Mount Pearl),Conservative,Yea,
Mr. Russ Hiebert (South Surrey—White Rock—Cloverdale),Conservative,Yea,
Mr. Jay Hill (Prince George—Peace River),Conservative,Yea,
Mrs. Betty Hinton (Kamloops—Thompson—Cariboo),Conservative,Yea,
Mr. Mark Holland (Ajax—Pickering),Liberal,Yea,
Mr. Charles Hubbard (Miramichi),Liberal,Yea,
Mr. Michael Ignatieff (Etobicoke—Lakeshore),Liberal,Yea,
Mr. Rahim Jaffer (Edmonton—Strathcona),Conservative,Yea,
Mr. Brian Jean (Fort McMurray—Athabasca),Conservative,Yea,
Mrs. Marlene Jennings (Notre-Dame-de-Grâce—Lachine),Liberal,Yea,
Mr. Peter Julian (Burnaby—New Westminster),NDP,Nay,
Mrs. Susan Kadis (Thornhill),Liberal,Yea,
Mr. Randy Kamp (Pitt Meadows—Maple Ridge—Mission),Conservative,Yea,
Ms. Nancy Karetak-Lindell (Nunavut),Liberal,Yea,
Mr. Gerald Keddy (South Shore—St. Margaret's),Conservative,Yea,
Mr. Jason Kenney (Calgary Southeast),Conservative,Yea,
Mr. Wajid Khan (Mississauga—Streetsville),Conservative,Yea,
Mr. Ed Komarnicki (Souris—Moose Mountain),Conservative,Yea,
Mr. Maka Kotto (Saint-Lambert),Bloc Québécois,Nay,
Mr. Daryl Kramp (Prince Edward—Hastings),Conservative,Yea,
Mr. Jean-Yves Laforest (Saint-Maurice—Champlain),Bloc Québécois,Nay,
Mr. Mario Laframboise (Argenteuil—Papineau—Mirabel),Bloc Québécois,Nay,
Mr. Mike Lake (Edmonton—Mill Woods—Beaumont),Conservative,Yea,
Mr. Guy Lauzon (Stormont—Dundas—South Glengarry),Conservative,Yea,
Mrs. Carole Lavallée (Saint-Bruno—Saint-Hubert),Bloc Québécois,Nay,
Mr. Jack Layton (Toronto—Danforth),NDP,Nay,
Mr. Denis Lebel (Roberval—Lac-Saint-Jean),Conservative,Yea,
Mr. Dominic LeBlanc (Beauséjour),Liberal,Yea,
Mr. Pierre Lemieux (Glengarry—Prescott—Russell),Conservative,Yea,
Mr. Yves Lessard (Chambly—Borduas),Bloc Québécois,Nay,
Mr. Yvon Lévesque (Abitibi—Baie-James—Nunavik—Eeyou),Bloc Québécois,Nay,
Mr. Tom Lukiwski (Regina—Lumsden—Lake Centre),Conservative,Yea,
Mr. Gary Lunn (Saanich—Gulf Islands),Conservative,Yea,
Mr. James Lunney (Nanaimo—Alberni),Conservative,Yea,
Mr. Marcel Lussier (Brossard—La Prairie),Bloc Québécois,Nay,
Mr. Lawrence MacAulay (Cardigan),Liberal,Yea,
Mr. Peter MacKay (Central Nova),Conservative,Yea,
Mr. Dave MacKenzie (Oxford),Conservative,Yea,
Mr. John Maloney (Welland),Liberal,Yea,
Mr. Fabian Manning (Avalon),Conservative,,Paired
Mr. Inky Mark (Dauphin—Swan River—Marquette),Conservative,Yea,
Ms. Diane Marleau (Sudbury),Liberal,Yea,
Mr. Wayne Marston (Hamilton East—Stoney Creek),NDP,Nay,
Mr. Pat Martin (Winnipeg Centre),NDP,Nay,
Mr. Tony Martin (Sault Ste. Marie),NDP,Nay,
Mr. Keith Martin (Esquimalt—Juan de Fuca),Liberal,Yea,
Mr. Brian Masse (Windsor West),NDP,Nay,
Ms. Irene Mathyssen (London—Fanshawe),NDP,Nay,
Mr. Bill Matthews (Random—Burin—St. George's),Liberal,Yea,
Mr. Colin Mayes (Okanagan—Shuswap),Conservative,Yea,
Mr. John McCallum (Markham—Unionville),Liberal,Yea,
Ms. Alexa McDonough (Halifax),NDP,Nay,
Mr. David McGuinty (Ottawa South),Liberal,Yea,
Mr. John McKay (Scarborough—Guildwood),Liberal,Yea,
Mr. Serge Ménard (Marc-Aurèle-Fortin),Bloc Québécois,Nay,
Mr. Ted Menzies (Macleod),Conservative,Yea,
Mr. Rob Merrifield (Yellowhead),Conservative,Yea,
Mr. Larry Miller (Bruce—Grey—Owen Sound),Conservative,Yea,
Mr. Bob Mills (Red Deer),Conservative,Yea,
Mr. James Moore (Port Moody—Westwood—Port Coquitlam),Conservative,Yea,
Mr. Rob Moore (Fundy Royal),Conservative,Yea,
Mr. Brian Murphy (Moncton—Riverview—Dieppe),Liberal,Yea,
Mr. Shawn Murphy (Charlottetown),Liberal,Yea,
Ms. Anita Neville (Winnipeg South Centre),Liberal,Yea,
Mr. Rob Nicholson (Niagara Falls),Conservative,Yea,
Mr. Rick Norlock (Northumberland—Quinte West),Conservative,Yea,
Mr. Deepak Obhrai (Calgary East),Conservative,Yea,
Mr. Gordon O'Connor (Carleton—Mississippi Mills),Conservative,Yea,
Ms. Bev Oda (Durham),Conservative,Yea,
Mr. Christian Ouellet (Brome—Missisquoi),Bloc Québécois,Nay,
Mr. Massimo Pacetti (Saint-Léonard—Saint-Michel),Liberal,Yea,
Mr. Brian Pallister (Portage—Lisgar),Conservative,Yea,
Mr. Christian Paradis (Mégantic—L'Érable),Conservative,Yea,
Mr. Bernard Patry (Pierrefonds—Dollard),Liberal,Yea,
Mr. Daniel Petit (Charlesbourg—Haute-Saint-Charles),Conservative,Yea,
Mr. Louis Plamondon (Bas-Richelieu—Nicolet—Bécancour),Bloc Québécois,Nay,
Mr. Pierre Poilievre (Nepean—Carleton),Conservative,Yea,
Mr. Jim Prentice (Calgary Centre-North),Conservative,Yea,
Mr. Joe Preston (Elgin—Middlesex—London),Conservative,Yea,
Ms. Penny Priddy (Surrey North),NDP,Nay,
Mr. Marcel Proulx (Hull—Aylmer),Liberal,Yea,
Mr. James Rajotte (Edmonton—Leduc),Conservative,Yea,
Ms. Yasmin Ratansi (Don Valley East),Liberal,Yea,
Mrs. Karen Redman (Kitchener Centre),Liberal,Yea,
Mr. Geoff Regan (Halifax West),Liberal,Yea,
Mr. Scott Reid (Lanark—Frontenac—Lennox and Addington),Conservative,Yea,
Mr. Lee Richardson (Calgary Centre),Conservative,Yea,
Mr. Gerry Ritz (Battlefords—Lloydminster),Conservative,Yea,
Mr. Anthony Rota (Nipissing—Timiskaming),Liberal,Yea,
Mr. Michael Savage (Dartmouth—Cole Harbour),Liberal,Yea,
Mr. Francis Scarpaleggia (Lac-Saint-Louis),Liberal,Yea,
Mr. Andrew Scheer (Regina—Qu'Appelle),Conservative,Yea,
Mr. Gary Schellenberger (Perth—Wellington),Conservative,Yea,
Mr. Andy Scott (Fredericton),Liberal,Yea,
Ms. Judy A. Sgro (York West),Liberal,Yea,
Mr. Bev Shipley (Lambton—Kent—Middlesex),Conservative,Yea,
Mr. Bill Siksay (Burnaby—Douglas),NDP,Nay,
Mr. Raymond Simard (Saint Boniface),Liberal,Yea,
Mr. Scott Simms (Bonavista—Gander—Grand Falls—Windsor),Liberal,Yea,
Mrs. Carol Skelton (Saskatoon—Rosetown—Biggar),Conservative,Yea,
Mrs. Joy Smith (Kildonan—St. Paul),Conservative,Yea,
Mr. Monte Solberg (Medicine Hat),Conservative,Yea,
Mr. Kevin Sorenson (Crowfoot),Conservative,Yea,
Mr. Lloyd St. Amand (Brant),Liberal,Yea,
Mr. Brent St. Denis (Algoma—Manitoulin—Kapuskasing),Liberal,Yea,
Mr. Bruce Stanton (Simcoe North),Conservative,Yea,
Mr. Thierry St-Cyr (Jeanne-Le Ber),Bloc Québécois,Nay,
Mr. Paul Steckle (Huron—Bruce),Liberal,Yea,
Ms. Caroline St-Hilaire (Longueuil—Pierre-Boucher),Bloc Québécois,Nay,
Mr. Peter Stoffer (Sackville—Eastern Shore),NDP,Nay,
Mr. Brian Storseth (Westlock—St. Paul),Conservative,Yea,
Mr. Chuck Strahl (Chilliwack—Fraser Canyon),Conservative,Yea,
Ms. Belinda Stronach (Newmarket—Aurora),Liberal,Yea,
Mr. David Sweet (Ancaster—Dundas—Flamborough—Westdale),Conservative,Yea,
Mr. Paul Szabo (Mississauga South),Liberal,Yea,
Mr. Lui Temelkovski (Oak Ridges—Markham),Liberal,Yea,
Mrs. Ève-Mary Thaï Thi Lac (Saint-Hyacinthe—Bagot),Bloc Québécois,Nay,
Ms. Louise Thibault (Rimouski-Neigette—Témiscouata—Les Basques),Independent,Nay,
Mr. Robert Thibault (West Nova),Liberal,Yea,
Mr. Greg Thompson (New Brunswick Southwest),Conservative,Yea,
Mr. Myron Thompson (Wild Rose),Conservative,Yea,
Mr. David Tilson (Dufferin—Caledon),Conservative,Yea,
Mr. Vic Toews (Provencher),Conservative,Yea,
Mr. Alan Tonks (York South—Weston),Liberal,Yea,
Mr. Brad Trost (Saskatoon—Humboldt),Conservative,Yea,
Mr. Garth Turner (Halton),Liberal,Yea,
Mr. Merv Tweed (Brandon—Souris),Conservative,Yea,
Mr. Roger Valley (Kenora),Liberal,Yea,
Mr. Dave Van Kesteren (Chatham-Kent—Essex),Conservative,Yea,
Mr. Peter Van Loan (York—Simcoe),Conservative,Yea,
Mr. Maurice Vellacott (Saskatoon—Wanuskewin),Conservative,Yea,
Senator Josée Verner (Louis-Saint-Laurent),Conservative,Yea,
Mr. Robert Vincent (Shefford),Bloc Québécois,Nay,
Mr. Mike Wallace (Burlington),Conservative,Yea,
Mr. Tom Wappel (Scarborough Southwest),Liberal,Yea,
Mr. Mark Warawa (Langley),Conservative,Yea,
Mr. Chris Warkentin (Peace River),Conservative,Yea,
Ms. Judy Wasylycia-Leis (Winnipeg North),NDP,Nay,
Mr. Jeff Watson (Essex),Conservative,Yea,
Mr. Bryon Wilfert (Richmond Hill),Liberal,Yea,
Mr. John G. Williams (Edmonton—St. Albert),Conservative,Yea,
Mrs. Lynne Yelich (Blackstrap),Conservative,Yea,
