Member of Parliament,Political Affiliation,Member Voted,Paired
Mr. Jim Abbott (Kootenay—Columbia),Conservative,Yea,
Mrs. Diane Ablonczy (Calgary—Nose Hill),Conservative,,Paired
Mr. Harold Albrecht (Kitchener—Conestoga),Conservative,Yea,
Mr. Omar Alghabra (Mississauga—Erindale),Liberal,Nay,
Mr. Mike Allen (Tobique—Mactaquac),Conservative,Yea,
Mr. Dean Allison (Niagara West—Glanbrook),Conservative,Yea,
Ms. Rona Ambrose (Edmonton—Spruce Grove),Conservative,Yea,
Mr. Rob Anders (Calgary West),Conservative,Yea,
Mr. David Anderson (Cypress Hills—Grasslands),Conservative,Yea,
Mr. Guy André (Berthier—Maskinongé),Bloc Québécois,Nay,
Mr. Charlie Angus (Timmins—James Bay),NDP,Nay,
Mr. Gérard Asselin (Manicouagan),Bloc Québécois,Nay,
Mr. Alex Atamanenko (British Columbia Southern Interior),NDP,Nay,
Mr. Claude Bachand (Saint-Jean),Bloc Québécois,Nay,
Mr. Larry Bagnell (Yukon),Liberal,Nay,
Mr. Navdeep Bains (Mississauga—Brampton South),Liberal,Nay,
Mr. John Baird (Ottawa West—Nepean),Conservative,Yea,
Mrs. Vivian Barbot (Papineau),Bloc Québécois,Nay,
Mrs. Sue Barnes (London West),Liberal,Nay,
Mr. Dave Batters (Palliser),Conservative,,Paired
Mr. Mauril Bélanger (Ottawa—Vanier),Liberal,Nay,
Ms. Catherine Bell (Vancouver Island North),NDP,Nay,
Mr. André Bellavance (Richmond—Arthabaska),Bloc Québécois,Nay,
Ms. Carolyn Bennett (St. Paul's),Liberal,Nay,
Mr. Leon Benoit (Vegreville—Wainwright),Conservative,Yea,
Mr. Maxime Bernier (Beauce),Conservative,,Paired
Mr. Maurizio Bevilacqua (Vaughan),Liberal,Nay,
Mr. Dennis Bevington (Western Arctic),NDP,Nay,
Mr. James Bezan (Selkirk—Interlake),Conservative,Yea,
Mr. Bernard Bigras (Rosemont—La Petite-Patrie),Bloc Québécois,Nay,
Ms. Dawn Black (New Westminster—Coquitlam),NDP,Nay,
Mr. Jean-Pierre Blackburn (Jonquière—Alma),Conservative,Yea,
Mr. Raynald Blais (Gaspésie—Îles-de-la-Madeleine),Bloc Québécois,Nay,
Mr. Steven Blaney (Lévis—Bellechasse),Conservative,Yea,
Mr. Raymond Bonin (Nickel Belt),Liberal,Nay,
Ms. France Bonsant (Compton—Stanstead),Bloc Québécois,Nay,
Mr. Ken Boshcoff (Thunder Bay—Rainy River),Liberal,Nay,
Mr. Robert Bouchard (Chicoutimi—Le Fjord),Bloc Québécois,Nay,
Mrs. Sylvie Boucher (Beauport—Limoilou),Conservative,Yea,
Ms. Diane Bourgeois (Terrebonne—Blainville),Bloc Québécois,Nay,
Mr. Garry Breitkreuz (Yorkton—Melville),Conservative,Yea,
Mr. Scott Brison (Kings—Hants),Liberal,Nay,
Ms. Bonnie Brown (Oakville),Liberal,Nay,
Mr. Gordon Brown (Leeds—Grenville),Conservative,Yea,
Mr. Patrick Brown (Barrie),Conservative,Yea,
Mr. Rod Bruinooge (Winnipeg South),Conservative,Yea,
Ms. Paule Brunelle (Trois-Rivières),Bloc Québécois,Nay,
Mr. Gerry Byrne (Humber—St. Barbe—Baie Verte),Liberal,Nay,
Mr. Blaine Calkins (Wetaskiwin),Conservative,Yea,
Mr. Ron Cannan (Kelowna—Lake Country),Conservative,Yea,
Mr. Lawrence Cannon (Pontiac),Conservative,Yea,
Mr. Serge Cardin (Sherbrooke),Bloc Québécois,Nay,
Mr. Colin Carrie (Oshawa),Conservative,Yea,
Mr. Robert Carrier (Alfred-Pellan),Bloc Québécois,Nay,
Mr. Bill Casey (Cumberland—Colchester—Musquodoboit Valley),Independent,Nay,
Mr. Rick Casson (Lethbridge),Conservative,Yea,
Ms. Chris Charlton (Hamilton Mountain),NDP,Nay,
Mr. Michael Chong (Wellington—Halton Hills),Conservative,Yea,
Ms. Olivia Chow (Trinity—Spadina),NDP,Nay,
Mr. David Christopherson (Hamilton Centre),NDP,Nay,
Mr. Rob Clarke (Desnethé—Missinippi—Churchill River),Conservative,Yea,
Mr. Tony Clement (Parry Sound—Muskoka),Conservative,Yea,
Mr. Joe Comartin (Windsor—Tecumseh),NDP,Nay,
Mr. Joe Comuzzi (Thunder Bay—Superior North),Conservative,Yea,
Mr. Paul Crête (Montmagny—L'Islet—Kamouraska—Rivière-du-Loup),Bloc Québécois,Nay,
Ms. Jean Crowder (Nanaimo—Cowichan),NDP,Nay,
Mr. Nathan Cullen (Skeena—Bulkley Valley),NDP,Nay,
Mr. John Cummins (Delta—Richmond East),Conservative,Yea,
Mr. Rodger Cuzner (Cape Breton—Canso),Liberal,Nay,
Mr. Jean-Claude D'Amours (Madawaska—Restigouche),Liberal,Nay,
Mrs. Patricia Davidson (Sarnia—Lambton),Conservative,Yea,
Ms. Libby Davies (Vancouver East),NDP,Nay,
Mr. Stockwell Day (Okanagan—Coquihalla),Conservative,Yea,
Mr. Dean Del Mastro (Peterborough),Conservative,Yea,
Ms. Nicole Demers (Laval),Bloc Québécois,Nay,
Ms. Johanne Deschamps (Laurentides—Labelle),Bloc Québécois,Nay,
Mr. Barry Devolin (Haliburton—Kawartha Lakes—Brock),Conservative,Yea,
Mr. Paul Dewar (Ottawa Centre),NDP,Nay,
Mr. Sukh Dhaliwal (Newton—North Delta),Liberal,Nay,
Ms. Ruby Dhalla (Brampton—Springdale),Liberal,Nay,
Mr. Stéphane Dion (Saint-Laurent—Cartierville),Liberal,Nay,
Mr. Ujjal Dosanjh (Vancouver South),Liberal,Nay,
Mr. Ken Dryden (York Centre),Liberal,Nay,
Mr. Gilles Duceppe (Laurier—Sainte-Marie),Bloc Québécois,Nay,
Mr. Rick Dykstra (St. Catharines),Conservative,Yea,
Mr. Wayne Easter (Malpeque),Liberal,Nay,
Mr. David Emerson (Vancouver Kingsway),Conservative,Yea,
Mr. Ken Epp (Edmonton—Sherwood Park),Conservative,Yea,
Mr. Mark Eyking (Sydney—Victoria),Liberal,Nay,
Ms. Meili Faille (Vaudreuil-Soulanges),Bloc Québécois,,Paired
Mr. Ed Fast (Abbotsford),Conservative,Yea,
Ms. Diane Finley (Haldimand—Norfolk),Conservative,Yea,
Mr. Brian Fitzpatrick (Prince Albert),Conservative,Yea,
Mr. Steven Fletcher (Charleswood—St. James—Assiniboia),Conservative,Yea,
Ms. Raymonde Folco (Laval—Les Îles),Liberal,Nay,
Ms. Hedy Fry (Vancouver Centre),Liberal,Nay,
Ms. Christiane Gagnon (Québec),Bloc Québécois,Nay,
Mr. Royal Galipeau (Ottawa—Orléans),Conservative,Yea,
Mrs. Cheryl Gallant (Renfrew—Nipissing—Pembroke),Conservative,Yea,
Mr. Roger Gaudet (Montcalm),Bloc Québécois,Nay,
Mr. John Godfrey (Don Valley West),Liberal,Nay,
Mr. Yvon Godin (Acadie—Bathurst),NDP,Nay,
Mr. Peter Goldring (Edmonton East),Conservative,Yea,
Mr. Ralph Goodale (Wascana),Liberal,Nay,
Mr. Gary Goodyear (Cambridge),Conservative,Yea,
Mr. Jacques Gourde (Lotbinière—Chutes-de-la-Chaudière),Conservative,,Paired
Mrs. Nina Grewal (Fleetwood—Port Kells),Conservative,Yea,
Ms. Albina Guarnieri (Mississauga East—Cooksville),Liberal,Nay,
Ms. Monique Guay (Rivière-du-Nord),Bloc Québécois,,Paired
Mrs. Helena Guergis (Simcoe—Grey),Conservative,Yea,
Mr. Michel Guimond (Montmorency—Charlevoix—Haute-Côte-Nord),Bloc Québécois,Nay,
Mr. Art Hanger (Calgary Northeast),Conservative,Yea,
Mr. Richard Harris (Cariboo—Prince George),Conservative,Yea,
Mr. Luc Harvey (Louis-Hébert),Conservative,Yea,
Mr. Laurie Hawn (Edmonton Centre),Conservative,Yea,
Mr. Russ Hiebert (South Surrey—White Rock—Cloverdale),Conservative,Yea,
Mr. Jay Hill (Prince George—Peace River),Conservative,Yea,
Mrs. Betty Hinton (Kamloops—Thompson—Cariboo),Conservative,Yea,
Mr. Mark Holland (Ajax—Pickering),Liberal,Nay,
Mr. Charles Hubbard (Miramichi),Liberal,Nay,
Mr. Michael Ignatieff (Etobicoke—Lakeshore),Liberal,Nay,
Mr. Rahim Jaffer (Edmonton—Strathcona),Conservative,Yea,
Mr. Brian Jean (Fort McMurray—Athabasca),Conservative,Yea,
Mrs. Marlene Jennings (Notre-Dame-de-Grâce—Lachine),Liberal,Nay,
Mr. Peter Julian (Burnaby—New Westminster),NDP,Nay,
Mrs. Susan Kadis (Thornhill),Liberal,Nay,
Mr. Randy Kamp (Pitt Meadows—Maple Ridge—Mission),Conservative,Yea,
Ms. Nancy Karetak-Lindell (Nunavut),Liberal,Nay,
Mr. Jim Karygiannis (Scarborough—Agincourt),Liberal,Nay,
Mr. Gerald Keddy (South Shore—St. Margaret's),Conservative,Yea,
Ms. Tina Keeper (Churchill),Liberal,Nay,
Mr. Jason Kenney (Calgary Southeast),Conservative,Yea,
Mr. Wajid Khan (Mississauga—Streetsville),Conservative,Yea,
Mr. Ed Komarnicki (Souris—Moose Mountain),Conservative,Yea,
Mr. Daryl Kramp (Prince Edward—Hastings),Conservative,Yea,
Mr. Jean-Yves Laforest (Saint-Maurice—Champlain),Bloc Québécois,Nay,
Mr. Mario Laframboise (Argenteuil—Papineau—Mirabel),Bloc Québécois,Nay,
Mr. Mike Lake (Edmonton—Mill Woods—Beaumont),Conservative,Yea,
Ms. Francine Lalonde (La Pointe-de-l'Île),Bloc Québécois,,Paired
Mr. Guy Lauzon (Stormont—Dundas—South Glengarry),Conservative,Yea,
Mrs. Carole Lavallée (Saint-Bruno—Saint-Hubert),Bloc Québécois,Nay,
Mr. Jack Layton (Toronto—Danforth),NDP,Nay,
Mr. Denis Lebel (Roberval—Lac-Saint-Jean),Conservative,Yea,
Mr. Derek Lee (Scarborough—Rouge River),Liberal,Nay,
Mr. Marc Lemay (Abitibi—Témiscamingue),Bloc Québécois,Nay,
Mr. Pierre Lemieux (Glengarry—Prescott—Russell),Conservative,Yea,
Mr. Yves Lessard (Chambly—Borduas),Bloc Québécois,Nay,
Mr. Yvon Lévesque (Abitibi—Baie-James—Nunavik—Eeyou),Bloc Québécois,Nay,
Mr. Tom Lukiwski (Regina—Lumsden—Lake Centre),Conservative,Yea,
Mr. James Lunney (Nanaimo—Alberni),Conservative,Yea,
Mr. Marcel Lussier (Brossard—La Prairie),Bloc Québécois,Nay,
Mr. Lawrence MacAulay (Cardigan),Liberal,Nay,
Mr. Peter MacKay (Central Nova),Conservative,Yea,
Mr. Dave MacKenzie (Oxford),Conservative,Yea,
Mr. Gurbax Malhi (Bramalea—Gore—Malton),Liberal,Nay,
Mr. John Maloney (Welland),Liberal,Nay,
Mr. Fabian Manning (Avalon),Conservative,,Paired
Mr. Inky Mark (Dauphin—Swan River—Marquette),Conservative,Yea,
Ms. Diane Marleau (Sudbury),Liberal,Nay,
Mr. Wayne Marston (Hamilton East—Stoney Creek),NDP,Nay,
Mr. Pat Martin (Winnipeg Centre),NDP,Nay,
Mr. Brian Masse (Windsor West),NDP,Nay,
Ms. Irene Mathyssen (London—Fanshawe),NDP,Nay,
Mr. Colin Mayes (Okanagan—Shuswap),Conservative,Yea,
Mr. John McCallum (Markham—Unionville),Liberal,Nay,
Ms. Alexa McDonough (Halifax),NDP,Nay,
Mr. David McGuinty (Ottawa South),Liberal,Nay,
Mr. Joe McGuire (Egmont),Liberal,Nay,
Mr. Dan McTeague (Pickering—Scarborough East),Liberal,Nay,
Mr. Serge Ménard (Marc-Aurèle-Fortin),Bloc Québécois,Nay,
Mr. Réal Ménard (Hochelaga),Bloc Québécois,Nay,
Mr. Ted Menzies (Macleod),Conservative,Yea,
Mr. Rob Merrifield (Yellowhead),Conservative,Yea,
Mr. Larry Miller (Bruce—Grey—Owen Sound),Conservative,Yea,
Mr. Bob Mills (Red Deer),Conservative,Yea,
Ms. Maria Minna (Beaches—East York),Liberal,Nay,
Mr. James Moore (Port Moody—Westwood—Port Coquitlam),Conservative,Yea,
Mr. Rob Moore (Fundy Royal),Conservative,Yea,
Mr. Thomas Mulcair (Outremont),NDP,Nay,
Mr. Shawn Murphy (Charlottetown),Liberal,Nay,
Ms. Joyce Murray (Vancouver Quadra),Liberal,Nay,
Mr. Richard Nadeau (Gatineau),Bloc Québécois,Nay,
Ms. Peggy Nash (Parkdale—High Park),NDP,Nay,
Ms. Anita Neville (Winnipeg South Centre),Liberal,Nay,
Mr. Rob Nicholson (Niagara Falls),Conservative,Yea,
Mr. Rick Norlock (Northumberland—Quinte West),Conservative,Yea,
Mr. Deepak Obhrai (Calgary East),Conservative,Yea,
Mr. Gordon O'Connor (Carleton—Mississippi Mills),Conservative,Yea,
Ms. Bev Oda (Durham),Conservative,Yea,
Mr. Christian Ouellet (Brome—Missisquoi),Bloc Québécois,,Paired
Mr. Massimo Pacetti (Saint-Léonard—Saint-Michel),Liberal,Nay,
Mr. Pierre Paquette (Joliette),Bloc Québécois,Nay,
Mr. Christian Paradis (Mégantic—L'Érable),Conservative,Yea,
Mr. Daniel Petit (Charlesbourg—Haute-Saint-Charles),Conservative,Yea,
Ms. Pauline Picard (Drummond),Bloc Québécois,Nay,
Mr. Louis Plamondon (Bas-Richelieu—Nicolet—Bécancour),Bloc Québécois,Nay,
Mr. Pierre Poilievre (Nepean—Carleton),Conservative,Yea,
Mr. Jim Prentice (Calgary Centre-North),Conservative,Yea,
Mr. Joe Preston (Elgin—Middlesex—London),Conservative,Yea,
Ms. Penny Priddy (Surrey North),NDP,Nay,
Mr. Marcel Proulx (Hull—Aylmer),Liberal,Nay,
Mr. James Rajotte (Edmonton—Leduc),Conservative,Yea,
Ms. Yasmin Ratansi (Don Valley East),Liberal,Nay,
Mrs. Karen Redman (Kitchener Centre),Liberal,Nay,
Mr. Geoff Regan (Halifax West),Liberal,Nay,
Mr. Scott Reid (Lanark—Frontenac—Lennox and Addington),Conservative,Yea,
Mr. Lee Richardson (Calgary Centre),Conservative,Yea,
Mr. Gerry Ritz (Battlefords—Lloydminster),Conservative,Yea,
Mr. Pablo Rodriguez (Honoré-Mercier),Liberal,Nay,
Mr. Anthony Rota (Nipissing—Timiskaming),Liberal,Nay,
Mr. Jean-Yves Roy (Haute-Gaspésie—La Mitis—Matane—Matapédia),Bloc Québécois,Nay,
Mr. Todd Russell (Labrador),Liberal,Nay,
Mr. Michael Savage (Dartmouth—Cole Harbour),Liberal,Nay,
Mr. Francis Scarpaleggia (Lac-Saint-Louis),Liberal,Nay,
Mr. Andrew Scheer (Regina—Qu'Appelle),Conservative,Yea,
Mr. Gary Schellenberger (Perth—Wellington),Conservative,Yea,
Mr. Andy Scott (Fredericton),Liberal,Nay,
Ms. Judy A. Sgro (York West),Liberal,Nay,
Mr. Bev Shipley (Lambton—Kent—Middlesex),Conservative,Yea,
Mr. Bill Siksay (Burnaby—Douglas),NDP,Nay,
Mr. Mario Silva (Davenport),Liberal,Nay,
Mr. Raymond Simard (Saint Boniface),Liberal,Nay,
Mrs. Carol Skelton (Saskatoon—Rosetown—Biggar),Conservative,Yea,
Mr. Monte Solberg (Medicine Hat),Conservative,Yea,
Mr. Kevin Sorenson (Crowfoot),Conservative,Yea,
Mr. Lloyd St. Amand (Brant),Liberal,Nay,
Mr. Brent St. Denis (Algoma—Manitoulin—Kapuskasing),Liberal,Nay,
Mr. Bruce Stanton (Simcoe North),Conservative,Yea,
Mr. Thierry St-Cyr (Jeanne-Le Ber),Bloc Québécois,Nay,
Mr. Paul Steckle (Huron—Bruce),Liberal,Nay,
Ms. Caroline St-Hilaire (Longueuil—Pierre-Boucher),Bloc Québécois,,Paired
Mr. Peter Stoffer (Sackville—Eastern Shore),NDP,Nay,
Mr. Brian Storseth (Westlock—St. Paul),Conservative,Yea,
Mr. Chuck Strahl (Chilliwack—Fraser Canyon),Conservative,Yea,
Ms. Belinda Stronach (Newmarket—Aurora),Liberal,Nay,
Mr. David Sweet (Ancaster—Dundas—Flamborough—Westdale),Conservative,Yea,
Mr. Paul Szabo (Mississauga South),Liberal,Nay,
Mr. Lui Temelkovski (Oak Ridges—Markham),Liberal,Nay,
Mrs. Ève-Mary Thaï Thi Lac (Saint-Hyacinthe—Bagot),Bloc Québécois,Nay,
Ms. Louise Thibault (Rimouski-Neigette—Témiscouata—Les Basques),Independent,Nay,
Mr. Greg Thompson (New Brunswick Southwest),Conservative,Yea,
Mr. Myron Thompson (Wild Rose),Conservative,Yea,
Mr. David Tilson (Dufferin—Caledon),Conservative,Yea,
Mr. Vic Toews (Provencher),Conservative,Yea,
Mr. Alan Tonks (York South—Weston),Liberal,Nay,
Mr. Brad Trost (Saskatoon—Humboldt),Conservative,Yea,
Mr. Garth Turner (Halton),Liberal,Nay,
Mr. Merv Tweed (Brandon—Souris),Conservative,Yea,
Mr. Roger Valley (Kenora),Liberal,Nay,
Mr. Dave Van Kesteren (Chatham-Kent—Essex),Conservative,Yea,
Mr. Peter Van Loan (York—Simcoe),Conservative,Yea,
Mr. Maurice Vellacott (Saskatoon—Wanuskewin),Conservative,Yea,
Senator Josée Verner (Louis-Saint-Laurent),Conservative,Yea,
Mr. Robert Vincent (Shefford),Bloc Québécois,Nay,
Mr. Mike Wallace (Burlington),Conservative,Yea,
Mr. Tom Wappel (Scarborough Southwest),Liberal,Nay,
Mr. Mark Warawa (Langley),Conservative,Yea,
Mr. Chris Warkentin (Peace River),Conservative,Yea,
Ms. Judy Wasylycia-Leis (Winnipeg North),NDP,Nay,
Mr. Jeff Watson (Essex),Conservative,Yea,
Mr. Bryon Wilfert (Richmond Hill),Liberal,Nay,
Mr. Borys Wrzesnewskyj (Etobicoke Centre),Liberal,Nay,
Mrs. Lynne Yelich (Blackstrap),Conservative,Yea,
