Member of Parliament,Political Affiliation,Member Voted,Paired
Mr. Jim Abbott (Kootenay—Columbia),Conservative,Yea,
Mrs. Diane Ablonczy (Calgary—Nose Hill),Conservative,Yea,
Mr. Harold Albrecht (Kitchener—Conestoga),Conservative,Yea,
Mr. Omar Alghabra (Mississauga—Erindale),Liberal,Nay,
Mr. Mike Allen (Tobique—Mactaquac),Conservative,Yea,
Mr. Dean Allison (Niagara West—Glanbrook),Conservative,Yea,
Ms. Rona Ambrose (Edmonton—Spruce Grove),Conservative,Yea,
Mr. Rob Anders (Calgary West),Conservative,Yea,
Mr. David Anderson (Cypress Hills—Grasslands),Conservative,Yea,
Mr. Guy André (Berthier—Maskinongé),Bloc Québécois,Nay,
Mr. Charlie Angus (Timmins—James Bay),NDP,Yea,
Mr. André Arthur (Portneuf—Jacques-Cartier),Independent,Yea,
Mr. Gérard Asselin (Manicouagan),Bloc Québécois,Nay,
Mr. Alex Atamanenko (British Columbia Southern Interior),NDP,Yea,
Mr. Claude Bachand (Saint-Jean),Bloc Québécois,Nay,
Mr. Larry Bagnell (Yukon),Liberal,Nay,
Mr. Navdeep Bains (Mississauga—Brampton South),Liberal,Nay,
Mr. John Baird (Ottawa West—Nepean),Conservative,Yea,
Mrs. Vivian Barbot (Papineau),Bloc Québécois,Nay,
Mrs. Sue Barnes (London West),Liberal,Nay,
Mr. Dave Batters (Palliser),Conservative,Yea,
Ms. Colleen Beaumier (Brampton West),Liberal,Nay,
Mr. Mauril Bélanger (Ottawa—Vanier),Liberal,Nay,
Mr. Don Bell (North Vancouver),Liberal,Nay,
Ms. Catherine Bell (Vancouver Island North),NDP,Yea,
Mr. André Bellavance (Richmond—Arthabaska),Bloc Québécois,Nay,
Mr. Leon Benoit (Vegreville—Wainwright),Conservative,Yea,
Mr. Maxime Bernier (Beauce),Conservative,Yea,
Mr. Dennis Bevington (Western Arctic),NDP,Yea,
Mr. James Bezan (Selkirk—Interlake),Conservative,Yea,
Mr. Bernard Bigras (Rosemont—La Petite-Patrie),Bloc Québécois,Nay,
Ms. Dawn Black (New Westminster—Coquitlam),NDP,Yea,
Mr. Jean-Pierre Blackburn (Jonquière—Alma),Conservative,Yea,
Mr. Bill Blaikie (Elmwood—Transcona),NDP,Yea,
Mr. Raynald Blais (Gaspésie—Îles-de-la-Madeleine),Bloc Québécois,Nay,
Mr. Steven Blaney (Lévis—Bellechasse),Conservative,Yea,
Mr. Raymond Bonin (Nickel Belt),Liberal,Nay,
Ms. France Bonsant (Compton—Stanstead),Bloc Québécois,Nay,
Mr. Ken Boshcoff (Thunder Bay—Rainy River),Liberal,Nay,
Mr. Robert Bouchard (Chicoutimi—Le Fjord),Bloc Québécois,Nay,
Mrs. Sylvie Boucher (Beauport—Limoilou),Conservative,Yea,
Ms. Diane Bourgeois (Terrebonne—Blainville),Bloc Québécois,Nay,
Mr. Garry Breitkreuz (Yorkton—Melville),Conservative,Yea,
Mr. Patrick Brown (Barrie),Conservative,Yea,
Mr. Gordon Brown (Leeds—Grenville),Conservative,Yea,
Ms. Bonnie Brown (Oakville),Liberal,Nay,
Mr. Rod Bruinooge (Winnipeg South),Conservative,Yea,
Ms. Paule Brunelle (Trois-Rivières),Bloc Québécois,Nay,
Mr. Gerry Byrne (Humber—St. Barbe—Baie Verte),Liberal,Yea,
Mr. Blaine Calkins (Wetaskiwin),Conservative,Yea,
Mr. Ron Cannan (Kelowna—Lake Country),Conservative,Yea,
Mr. Lawrence Cannon (Pontiac),Conservative,Yea,
Mr. Serge Cardin (Sherbrooke),Bloc Québécois,Nay,
Mr. Colin Carrie (Oshawa),Conservative,Yea,
Mr. Robert Carrier (Alfred-Pellan),Bloc Québécois,Nay,
Mr. Bill Casey (Cumberland—Colchester—Musquodoboit Valley),Conservative,Yea,
Mr. Rick Casson (Lethbridge),Conservative,Yea,
Mrs. Brenda Chamberlain (Guelph),Liberal,Yea,
Ms. Chris Charlton (Hamilton Mountain),NDP,Yea,
Mr. Michael Chong (Wellington—Halton Hills),Conservative,Yea,
Ms. Olivia Chow (Trinity—Spadina),NDP,Yea,
Mr. David Christopherson (Hamilton Centre),NDP,Yea,
Mr. Tony Clement (Parry Sound—Muskoka),Conservative,Yea,
Mr. Denis Coderre (Bourassa),Liberal,Nay,
Mr. Joe Comuzzi (Thunder Bay—Superior North),Liberal,Yea,
Mr. Paul Crête (Montmagny—L'Islet—Kamouraska—Rivière-du-Loup),Bloc Québécois,Nay,
Mr. Nathan Cullen (Skeena—Bulkley Valley),NDP,Yea,
Mr. John Cummins (Delta—Richmond East),Conservative,Yea,
Mr. Rodger Cuzner (Cape Breton—Canso),Liberal,Nay,
Mr. Jean-Claude D'Amours (Madawaska—Restigouche),Liberal,Nay,
Mrs. Patricia Davidson (Sarnia—Lambton),Conservative,Yea,
Mrs. Claude DeBellefeuille (Beauharnois—Salaberry),Bloc Québécois,Nay,
Mr. Dean Del Mastro (Peterborough),Conservative,Yea,
Ms. Nicole Demers (Laval),Bloc Québécois,Nay,
Ms. Johanne Deschamps (Laurentides—Labelle),Bloc Québécois,Nay,
Mr. Barry Devolin (Haliburton—Kawartha Lakes—Brock),Conservative,Yea,
Mr. Paul Dewar (Ottawa Centre),NDP,Yea,
Mr. Sukh Dhaliwal (Newton—North Delta),Liberal,Yea,
Ms. Ruby Dhalla (Brampton—Springdale),Liberal,Nay,
Senator Norman E. Doyle (St. John's East),Conservative,Yea,
Mr. Ken Dryden (York Centre),Liberal,Nay,
Mr. Gilles Duceppe (Laurier—Sainte-Marie),Bloc Québécois,Nay,
Mr. Rick Dykstra (St. Catharines),Conservative,Yea,
Mr. David Emerson (Vancouver Kingsway),Conservative,Yea,
Mr. Ken Epp (Edmonton—Sherwood Park),Conservative,Yea,
Mr. Mark Eyking (Sydney—Victoria),Liberal,Nay,
Ms. Meili Faille (Vaudreuil-Soulanges),Bloc Québécois,Nay,
Mr. Ed Fast (Abbotsford),Conservative,Yea,
Ms. Diane Finley (Haldimand—Norfolk),Conservative,Yea,
Mr. Brian Fitzpatrick (Prince Albert),Conservative,Yea,
Mr. Jim Flaherty (Whitby—Oshawa),Conservative,Yea,
Mr. Steven Fletcher (Charleswood—St. James—Assiniboia),Conservative,Yea,
Ms. Raymonde Folco (Laval—Les Îles),Liberal,Nay,
Mr. Joe Fontana (London North Centre),Liberal,Yea,
Mrs. Carole Freeman (Châteauguay—Saint-Constant),Bloc Québécois,Nay,
Ms. Christiane Gagnon (Québec),Bloc Québécois,,Paired
Mr. Royal Galipeau (Ottawa—Orléans),Conservative,Yea,
Mrs. Cheryl Gallant (Renfrew—Nipissing—Pembroke),Conservative,Yea,
Mr. Roger Gaudet (Montcalm),Bloc Québécois,Nay,
Mr. Michel Gauthier (Roberval—Lac-Saint-Jean),Bloc Québécois,Nay,
Mr. John Godfrey (Don Valley West),Liberal,Nay,
Mr. Yvon Godin (Acadie—Bathurst),NDP,Yea,
Mr. Peter Goldring (Edmonton East),Conservative,Yea,
Mr. Ralph Goodale (Wascana),Liberal,Nay,
Mr. Gary Goodyear (Cambridge),Conservative,Yea,
Mr. Jacques Gourde (Lotbinière—Chutes-de-la-Chaudière),Conservative,Yea,
Mr. Bill Graham (Toronto Centre),Liberal,Nay,
Mrs. Nina Grewal (Fleetwood—Port Kells),Conservative,Yea,
Ms. Albina Guarnieri (Mississauga East—Cooksville),Liberal,Yea,
Ms. Monique Guay (Rivière-du-Nord),Bloc Québécois,Nay,
Mrs. Helena Guergis (Simcoe—Grey),Conservative,Yea,
Mr. Michel Guimond (Montmorency—Charlevoix—Haute-Côte-Nord),Bloc Québécois,Nay,
Mr. Art Hanger (Calgary Northeast),Conservative,Yea,
Mr. Stephen Harper (Calgary Southwest),Conservative,Yea,
Mr. Richard Harris (Cariboo—Prince George),Conservative,Yea,
Mr. Luc Harvey (Louis-Hébert),Conservative,Yea,
Mr. Laurie Hawn (Edmonton Centre),Conservative,Yea,
Mr. Loyola Hearn (St. John's South—Mount Pearl),Conservative,Yea,
Mr. Russ Hiebert (South Surrey—White Rock—Cloverdale),Conservative,Yea,
Mr. Jay Hill (Prince George—Peace River),Conservative,Yea,
Mrs. Betty Hinton (Kamloops—Thompson—Cariboo),Conservative,Yea,
Mr. Mark Holland (Ajax—Pickering),Liberal,Nay,
Mr. Charles Hubbard (Miramichi),Liberal,Nay,
Mr. Michael Ignatieff (Etobicoke—Lakeshore),Liberal,Nay,
Mr. Rahim Jaffer (Edmonton—Strathcona),Conservative,Yea,
Mr. Brian Jean (Fort McMurray—Athabasca),Conservative,Yea,
Mrs. Marlene Jennings (Notre-Dame-de-Grâce—Lachine),Liberal,Nay,
Mr. Peter Julian (Burnaby—New Westminster),NDP,Yea,
Mrs. Susan Kadis (Thornhill),Liberal,Yea,
Mr. Randy Kamp (Pitt Meadows—Maple Ridge—Mission),Conservative,Yea,
Ms. Nancy Karetak-Lindell (Nunavut),Liberal,Nay,
Ms. Tina Keeper (Churchill),Liberal,Nay,
Mr. Jason Kenney (Calgary Southeast),Conservative,Yea,
Mr. Ed Komarnicki (Souris—Moose Mountain),Conservative,Yea,
Mr. Maka Kotto (Saint-Lambert),Bloc Québécois,Nay,
Mr. Daryl Kramp (Prince Edward—Hastings),Conservative,Yea,
Mr. Jean-Yves Laforest (Saint-Maurice—Champlain),Bloc Québécois,Nay,
Mr. Mario Laframboise (Argenteuil—Papineau—Mirabel),Bloc Québécois,Nay,
Mr. Mike Lake (Edmonton—Mill Woods—Beaumont),Conservative,Yea,
Ms. Francine Lalonde (La Pointe-de-l'Île),Bloc Québécois,Nay,
Mr. Jean Lapierre (Outremont),Liberal,Nay,
Mr. Guy Lauzon (Stormont—Dundas—South Glengarry),Conservative,Yea,
Mrs. Carole Lavallée (Saint-Bruno—Saint-Hubert),Bloc Québécois,Nay,
Mr. Jack Layton (Toronto—Danforth),NDP,Yea,
Mr. Dominic LeBlanc (Beauséjour),Liberal,Nay,
Mr. Derek Lee (Scarborough—Rouge River),Liberal,Nay,
Mr. Marc Lemay (Abitibi—Témiscamingue),Bloc Québécois,Nay,
Mr. Pierre Lemieux (Glengarry—Prescott—Russell),Conservative,Yea,
Mr. Yves Lessard (Chambly—Borduas),Bloc Québécois,Nay,
Mr. Yvon Lévesque (Abitibi—Baie-James—Nunavik—Eeyou),Bloc Québécois,Nay,
Mr. Yvan Loubier (Saint-Hyacinthe—Bagot),Bloc Québécois,Nay,
Mr. Tom Lukiwski (Regina—Lumsden—Lake Centre),Conservative,Yea,
Mr. Gary Lunn (Saanich—Gulf Islands),Conservative,Yea,
Mr. James Lunney (Nanaimo—Alberni),Conservative,Yea,
Mr. Marcel Lussier (Brossard—La Prairie),Bloc Québécois,Nay,
Mr. Lawrence MacAulay (Cardigan),Liberal,Nay,
Mr. Peter MacKay (Central Nova),Conservative,Yea,
Mr. Dave MacKenzie (Oxford),Conservative,Yea,
Mr. Gurbax Malhi (Bramalea—Gore—Malton),Liberal,Nay,
Mr. Luc Malo (Verchères—Les Patriotes),Bloc Québécois,Nay,
Mr. John Maloney (Welland),Liberal,Yea,
Mr. Fabian Manning (Avalon),Conservative,Yea,
Mr. Inky Mark (Dauphin—Swan River—Marquette),Conservative,,Paired
Ms. Diane Marleau (Sudbury),Liberal,Nay,
Mr. Wayne Marston (Hamilton East—Stoney Creek),NDP,Yea,
Mr. Pat Martin (Winnipeg Centre),NDP,Yea,
Mr. Tony Martin (Sault Ste. Marie),NDP,Yea,
Mr. Brian Masse (Windsor West),NDP,Yea,
Ms. Irene Mathyssen (London—Fanshawe),NDP,Yea,
Mr. Bill Matthews (Random—Burin—St. George's),Liberal,Nay,
Mr. Colin Mayes (Okanagan—Shuswap),Conservative,Yea,
Mr. John McCallum (Markham—Unionville),Liberal,Nay,
Mr. David McGuinty (Ottawa South),Liberal,Nay,
Mr. Joe McGuire (Egmont),Liberal,Nay,
Mr. John McKay (Scarborough—Guildwood),Liberal,Nay,
Mr. Dan McTeague (Pickering—Scarborough East),Liberal,Yea,
Mr. Réal Ménard (Hochelaga),Bloc Québécois,Nay,
Mr. Serge Ménard (Marc-Aurèle-Fortin),Bloc Québécois,Nay,
Mr. Ted Menzies (Macleod),Conservative,Yea,
Mr. Gary Merasty (Desnethé—Missinippi—Churchill River),Liberal,Nay,
Mr. Rob Merrifield (Yellowhead),Conservative,Yea,
Mr. Larry Miller (Bruce—Grey—Owen Sound),Conservative,Yea,
Mr. Bob Mills (Red Deer),Conservative,Yea,
Ms. Maria Minna (Beaches—East York),Liberal,Nay,
Mr. Rob Moore (Fundy Royal),Conservative,Yea,
Mr. James Moore (Port Moody—Westwood—Port Coquitlam),Conservative,Yea,
Mrs. Maria Mourani (Ahuntsic),Bloc Québécois,Nay,
Mr. Shawn Murphy (Charlottetown),Liberal,Nay,
Mr. Brian Murphy (Moncton—Riverview—Dieppe),Liberal,Nay,
Mr. Richard Nadeau (Gatineau),Bloc Québécois,Nay,
Ms. Anita Neville (Winnipeg South Centre),Liberal,Nay,
Mr. Rob Nicholson (Niagara Falls),Conservative,Yea,
Mr. Rick Norlock (Northumberland—Quinte West),Conservative,Yea,
Mr. Deepak Obhrai (Calgary East),Conservative,Yea,
Mr. Gordon O'Connor (Carleton—Mississippi Mills),Conservative,Yea,
Ms. Bev Oda (Durham),Conservative,Yea,
Mr. Christian Ouellet (Brome—Missisquoi),Bloc Québécois,Nay,
Mr. Stephen Owen (Vancouver Quadra),Liberal,Nay,
Mr. Massimo Pacetti (Saint-Léonard—Saint-Michel),Liberal,Nay,
Mr. Brian Pallister (Portage—Lisgar),Conservative,Yea,
Mr. Pierre Paquette (Joliette),Bloc Québécois,Nay,
Mr. Christian Paradis (Mégantic—L'Érable),Conservative,Yea,
Mr. Bernard Patry (Pierrefonds—Dollard),Liberal,Nay,
Mr. Gilles-A. Perron (Rivière-des-Mille-Îles),Bloc Québécois,Nay,
Mr. Jim Peterson (Willowdale),Liberal,Nay,
Mr. Daniel Petit (Charlesbourg—Haute-Saint-Charles),Conservative,Yea,
Ms. Pauline Picard (Drummond),Bloc Québécois,Nay,
Mr. Louis Plamondon (Bas-Richelieu—Nicolet—Bécancour),Bloc Québécois,Nay,
Mr. Pierre Poilievre (Nepean—Carleton),Conservative,Yea,
Mr. Jim Prentice (Calgary Centre-North),Conservative,Yea,
Mr. Joe Preston (Elgin—Middlesex—London),Conservative,Yea,
Ms. Penny Priddy (Surrey North),NDP,Yea,
Mr. Marcel Proulx (Hull—Aylmer),Liberal,Nay,
Mr. James Rajotte (Edmonton—Leduc),Conservative,Yea,
Ms. Yasmin Ratansi (Don Valley East),Liberal,Nay,
Mrs. Karen Redman (Kitchener Centre),Liberal,Nay,
Mr. Geoff Regan (Halifax West),Liberal,Nay,
Mr. Scott Reid (Lanark—Frontenac—Lennox and Addington),Conservative,Yea,
Mr. Lee Richardson (Calgary Centre),Conservative,Yea,
Mr. Gerry Ritz (Battlefords—Lloydminster),Conservative,Yea,
Mr. Pablo Rodriguez (Honoré-Mercier),Liberal,Nay,
Mr. Anthony Rota (Nipissing—Timiskaming),Liberal,Nay,
Mr. Jean-Yves Roy (Haute-Gaspésie—La Mitis—Matane—Matapédia),Bloc Québécois,Nay,
Mr. Benoît Sauvageau (Repentigny),Bloc Québécois,Nay,
Mr. Francis Scarpaleggia (Lac-Saint-Louis),Liberal,Nay,
Mr. Andrew Scheer (Regina—Qu'Appelle),Conservative,Yea,
Mr. Gary Schellenberger (Perth—Wellington),Conservative,Yea,
Mr. Andy Scott (Fredericton),Liberal,Nay,
Mr. Bev Shipley (Lambton—Kent—Middlesex),Conservative,Yea,
Mr. Mario Silva (Davenport),Liberal,Nay,
Mr. Raymond Simard (Saint Boniface),Liberal,Nay,
Mr. Scott Simms (Bonavista—Gander—Grand Falls—Windsor),Liberal,Nay,
Mrs. Carol Skelton (Saskatoon—Rosetown—Biggar),Conservative,Yea,
Mrs. Joy Smith (Kildonan—St. Paul),Conservative,Yea,
Mr. Monte Solberg (Medicine Hat),Conservative,Yea,
Mr. Kevin Sorenson (Crowfoot),Conservative,Yea,
Mr. Lloyd St. Amand (Brant),Liberal,Nay,
Mr. Brent St. Denis (Algoma—Manitoulin—Kapuskasing),Liberal,Nay,
Mr. Bruce Stanton (Simcoe North),Conservative,Yea,
Mr. Thierry St-Cyr (Jeanne-Le Ber),Bloc Québécois,Nay,
Mr. Paul Steckle (Huron—Bruce),Liberal,Yea,
Ms. Caroline St-Hilaire (Longueuil—Pierre-Boucher),Bloc Québécois,Nay,
Mr. Brian Storseth (Westlock—St. Paul),Conservative,Yea,
Mr. Chuck Strahl (Chilliwack—Fraser Canyon),Conservative,Yea,
Ms. Belinda Stronach (Newmarket—Aurora),Liberal,Nay,
Mr. David Sweet (Ancaster—Dundas—Flamborough—Westdale),Conservative,Yea,
Mr. Paul Szabo (Mississauga South),Liberal,Nay,
Mr. Andrew Telegdi (Kitchener—Waterloo),Liberal,Yea,
Mr. Lui Temelkovski (Oak Ridges—Markham),Liberal,Nay,
Mr. Robert Thibault (West Nova),Liberal,Nay,
Ms. Louise Thibault (Rimouski-Neigette—Témiscouata—Les Basques),Bloc Québécois,Nay,
Mr. Greg Thompson (New Brunswick Southwest),Conservative,Yea,
Mr. Myron Thompson (Wild Rose),Conservative,Yea,
Mr. David Tilson (Dufferin—Caledon),Conservative,Yea,
Mr. Vic Toews (Provencher),Conservative,Yea,
Mr. Alan Tonks (York South—Weston),Liberal,Yea,
Mr. Brad Trost (Saskatoon—Humboldt),Conservative,Yea,
Mr. Garth Turner (Halton),Conservative,Yea,
Mr. Merv Tweed (Brandon—Souris),Conservative,Yea,
Mr. Roger Valley (Kenora),Liberal,Nay,
Mr. Dave Van Kesteren (Chatham-Kent—Essex),Conservative,Yea,
Mr. Peter Van Loan (York—Simcoe),Conservative,Yea,
Mr. Maurice Vellacott (Saskatoon—Wanuskewin),Conservative,Yea,
Senator Josée Verner (Louis-Saint-Laurent),Conservative,Yea,
Mr. Robert Vincent (Shefford),Bloc Québécois,Nay,
Mr. Mike Wallace (Burlington),Conservative,Yea,
Mr. Mark Warawa (Langley),Conservative,Yea,
Mr. Chris Warkentin (Peace River),Conservative,Yea,
Ms. Judy Wasylycia-Leis (Winnipeg North),NDP,Yea,
Mr. Jeff Watson (Essex),Conservative,Yea,
Mr. Bryon Wilfert (Richmond Hill),Liberal,Nay,
Mr. John G. Williams (Edmonton—St. Albert),Conservative,Yea,
Mr. Blair Wilson (West Vancouver—Sunshine Coast—Sea to Sky Country),Liberal,Nay,
Mr. Borys Wrzesnewskyj (Etobicoke Centre),Liberal,Yea,
Mrs. Lynne Yelich (Blackstrap),Conservative,Yea,
