Member of Parliament,Political Affiliation,Member Voted,Paired
Mr. Jim Abbott (Kootenay—Columbia),Conservative,Nay,
Mrs. Diane Ablonczy (Calgary—Nose Hill),Conservative,Nay,
Mr. Harold Albrecht (Kitchener—Conestoga),Conservative,Nay,
Mr. Omar Alghabra (Mississauga—Erindale),Liberal,Yea,
Mr. Mike Allen (Tobique—Mactaquac),Conservative,Nay,
Mr. Dean Allison (Niagara West—Glanbrook),Conservative,Nay,
Ms. Rona Ambrose (Edmonton—Spruce Grove),Conservative,Nay,
Mr. Rob Anders (Calgary West),Conservative,Nay,
Mr. David Anderson (Cypress Hills—Grasslands),Conservative,Nay,
Mr. Guy André (Berthier—Maskinongé),Bloc Québécois,Nay,
Mr. Charlie Angus (Timmins—James Bay),NDP,Yea,
Mr. André Arthur (Portneuf—Jacques-Cartier),Independent,Nay,
Mr. Gérard Asselin (Manicouagan),Bloc Québécois,,Paired
Mr. Claude Bachand (Saint-Jean),Bloc Québécois,,Paired
Mr. Larry Bagnell (Yukon),Liberal,Yea,
Mr. Navdeep Bains (Mississauga—Brampton South),Liberal,Yea,
Mr. John Baird (Ottawa West—Nepean),Conservative,Nay,
Mrs. Vivian Barbot (Papineau),Bloc Québécois,Nay,
Mrs. Sue Barnes (London West),Liberal,Yea,
Mr. Dave Batters (Palliser),Conservative,Nay,
Ms. Colleen Beaumier (Brampton West),Liberal,Yea,
Mr. Mauril Bélanger (Ottawa—Vanier),Liberal,Yea,
Ms. Catherine Bell (Vancouver Island North),NDP,Yea,
Mr. André Bellavance (Richmond—Arthabaska),Bloc Québécois,Nay,
Mr. Leon Benoit (Vegreville—Wainwright),Conservative,,Paired
Mr. Maxime Bernier (Beauce),Conservative,Nay,
Mr. Maurizio Bevilacqua (Vaughan),Liberal,Yea,
Mr. Dennis Bevington (Western Arctic),NDP,Yea,
Mr. James Bezan (Selkirk—Interlake),Conservative,Nay,
Mr. Bernard Bigras (Rosemont—La Petite-Patrie),Bloc Québécois,Nay,
Ms. Dawn Black (New Westminster—Coquitlam),NDP,Yea,
Mr. Jean-Pierre Blackburn (Jonquière—Alma),Conservative,Nay,
Mr. Bill Blaikie (Elmwood—Transcona),NDP,Yea,
Mr. Raynald Blais (Gaspésie—Îles-de-la-Madeleine),Bloc Québécois,Nay,
Mr. Steven Blaney (Lévis—Bellechasse),Conservative,Nay,
Mr. Raymond Bonin (Nickel Belt),Liberal,Yea,
Ms. France Bonsant (Compton—Stanstead),Bloc Québécois,Nay,
Mr. Ken Boshcoff (Thunder Bay—Rainy River),Liberal,Yea,
Mr. Robert Bouchard (Chicoutimi—Le Fjord),Bloc Québécois,Nay,
Mrs. Sylvie Boucher (Beauport—Limoilou),Conservative,Nay,
Ms. Diane Bourgeois (Terrebonne—Blainville),Bloc Québécois,Nay,
Mr. Garry Breitkreuz (Yorkton—Melville),Conservative,Nay,
Mr. Gordon Brown (Leeds—Grenville),Conservative,Nay,
Mr. Patrick Brown (Barrie),Conservative,Nay,
Ms. Bonnie Brown (Oakville),Liberal,Yea,
Mr. Rod Bruinooge (Winnipeg South),Conservative,Nay,
Ms. Paule Brunelle (Trois-Rivières),Bloc Québécois,Nay,
Mr. Blaine Calkins (Wetaskiwin),Conservative,Nay,
Mr. Ron Cannan (Kelowna—Lake Country),Conservative,Nay,
Mr. John Cannis (Scarborough Centre),Liberal,Yea,
Mr. Lawrence Cannon (Pontiac),Conservative,Nay,
Mr. Colin Carrie (Oshawa),Conservative,Nay,
Mr. Robert Carrier (Alfred-Pellan),Bloc Québécois,Nay,
Mr. Bill Casey (Cumberland—Colchester—Musquodoboit Valley),Conservative,Nay,
Mr. Rick Casson (Lethbridge),Conservative,Nay,
Mrs. Brenda Chamberlain (Guelph),Liberal,Yea,
Mr. Raymond Chan (Richmond),Liberal,Yea,
Ms. Chris Charlton (Hamilton Mountain),NDP,Yea,
Mr. Michael Chong (Wellington—Halton Hills),Conservative,Nay,
Ms. Olivia Chow (Trinity—Spadina),NDP,Yea,
Mr. David Christopherson (Hamilton Centre),NDP,Yea,
Mr. Denis Coderre (Bourassa),Liberal,Yea,
Mr. Joe Comartin (Windsor—Tecumseh),NDP,Yea,
Mr. Irwin Cotler (Mount Royal),Liberal,Yea,
Mr. Paul Crête (Montmagny—L'Islet—Kamouraska—Rivière-du-Loup),Bloc Québécois,Nay,
Ms. Jean Crowder (Nanaimo—Cowichan),NDP,Yea,
Mr. Nathan Cullen (Skeena—Bulkley Valley),NDP,Yea,
Mr. John Cummins (Delta—Richmond East),Conservative,Nay,
Mr. Rodger Cuzner (Cape Breton—Canso),Liberal,Yea,
Mr. Jean-Claude D'Amours (Madawaska—Restigouche),Liberal,Yea,
Mrs. Patricia Davidson (Sarnia—Lambton),Conservative,Nay,
Mr. Stockwell Day (Okanagan—Coquihalla),Conservative,Nay,
Mr. Dean Del Mastro (Peterborough),Conservative,Nay,
Ms. Nicole Demers (Laval),Bloc Québécois,Nay,
Ms. Johanne Deschamps (Laurentides—Labelle),Bloc Québécois,Nay,
Mr. Barry Devolin (Haliburton—Kawartha Lakes—Brock),Conservative,Nay,
Mr. Paul Dewar (Ottawa Centre),NDP,Yea,
Mr. Sukh Dhaliwal (Newton—North Delta),Liberal,Yea,
Ms. Ruby Dhalla (Brampton—Springdale),Liberal,Yea,
Mr. Stéphane Dion (Saint-Laurent—Cartierville),Liberal,Yea,
Senator Norman E. Doyle (St. John's East),Conservative,Nay,
Mr. Ken Dryden (York Centre),Liberal,Yea,
Mr. Gilles Duceppe (Laurier—Sainte-Marie),Bloc Québécois,Nay,
Mr. Rick Dykstra (St. Catharines),Conservative,Nay,
Mr. Wayne Easter (Malpeque),Liberal,Yea,
Mr. David Emerson (Vancouver Kingsway),Conservative,Nay,
Mr. Ken Epp (Edmonton—Sherwood Park),Conservative,Nay,
Mr. Mark Eyking (Sydney—Victoria),Liberal,Yea,
Ms. Meili Faille (Vaudreuil-Soulanges),Bloc Québécois,Nay,
Mr. Ed Fast (Abbotsford),Conservative,Nay,
Ms. Diane Finley (Haldimand—Norfolk),Conservative,Nay,
Mr. Brian Fitzpatrick (Prince Albert),Conservative,Nay,
Mr. Jim Flaherty (Whitby—Oshawa),Conservative,Nay,
Mr. Steven Fletcher (Charleswood—St. James—Assiniboia),Conservative,Nay,
Ms. Raymonde Folco (Laval—Les Îles),Liberal,Yea,
Mrs. Carole Freeman (Châteauguay—Saint-Constant),Bloc Québécois,Nay,
Ms. Hedy Fry (Vancouver Centre),Liberal,Yea,
Ms. Christiane Gagnon (Québec),Bloc Québécois,Nay,
Mr. Royal Galipeau (Ottawa—Orléans),Conservative,Nay,
Mrs. Cheryl Gallant (Renfrew—Nipissing—Pembroke),Conservative,Nay,
Mr. Michel Gauthier (Roberval—Lac-Saint-Jean),Bloc Québécois,Nay,
Mr. John Godfrey (Don Valley West),Liberal,Yea,
Mr. Yvon Godin (Acadie—Bathurst),NDP,Yea,
Mr. Peter Goldring (Edmonton East),Conservative,Nay,
Mr. Ralph Goodale (Wascana),Liberal,Yea,
Mr. Gary Goodyear (Cambridge),Conservative,Nay,
Mr. Jacques Gourde (Lotbinière—Chutes-de-la-Chaudière),Conservative,Nay,
Mr. Bill Graham (Toronto Centre),Liberal,Yea,
Mr. Raymond Gravel (Repentigny),Bloc Québécois,Nay,
Mrs. Nina Grewal (Fleetwood—Port Kells),Conservative,Nay,
Ms. Monique Guay (Rivière-du-Nord),Bloc Québécois,Nay,
Mrs. Helena Guergis (Simcoe—Grey),Conservative,Nay,
Mr. Michel Guimond (Montmorency—Charlevoix—Haute-Côte-Nord),Bloc Québécois,Nay,
Mr. Art Hanger (Calgary Northeast),Conservative,Nay,
Mr. Stephen Harper (Calgary Southwest),Conservative,Nay,
Mr. Richard Harris (Cariboo—Prince George),Conservative,Nay,
Mr. Luc Harvey (Louis-Hébert),Conservative,Nay,
Mr. Laurie Hawn (Edmonton Centre),Conservative,Nay,
Mr. Loyola Hearn (St. John's South—Mount Pearl),Conservative,Nay,
Mr. Russ Hiebert (South Surrey—White Rock—Cloverdale),Conservative,Nay,
Mr. Jay Hill (Prince George—Peace River),Conservative,Nay,
Mrs. Betty Hinton (Kamloops—Thompson—Cariboo),Conservative,Nay,
Mr. Mark Holland (Ajax—Pickering),Liberal,Yea,
Mr. Michael Ignatieff (Etobicoke—Lakeshore),Liberal,Yea,
Mr. Rahim Jaffer (Edmonton—Strathcona),Conservative,Nay,
Mr. Brian Jean (Fort McMurray—Athabasca),Conservative,Nay,
Mrs. Marlene Jennings (Notre-Dame-de-Grâce—Lachine),Liberal,Yea,
Mr. Peter Julian (Burnaby—New Westminster),NDP,Yea,
Mrs. Susan Kadis (Thornhill),Liberal,Yea,
Mr. Randy Kamp (Pitt Meadows—Maple Ridge—Mission),Conservative,Nay,
Ms. Nancy Karetak-Lindell (Nunavut),Liberal,Yea,
Mr. Jim Karygiannis (Scarborough—Agincourt),Liberal,Yea,
Mr. Gerald Keddy (South Shore—St. Margaret's),Conservative,Nay,
Ms. Tina Keeper (Churchill),Liberal,Yea,
Mr. Jason Kenney (Calgary Southeast),Conservative,Nay,
Mr. Wajid Khan (Mississauga—Streetsville),Conservative,Nay,
Mr. Ed Komarnicki (Souris—Moose Mountain),Conservative,Nay,
Mr. Maka Kotto (Saint-Lambert),Bloc Québécois,Nay,
Mr. Daryl Kramp (Prince Edward—Hastings),Conservative,Nay,
Mr. Jean-Yves Laforest (Saint-Maurice—Champlain),Bloc Québécois,Nay,
Mr. Mario Laframboise (Argenteuil—Papineau—Mirabel),Bloc Québécois,Nay,
Mr. Mike Lake (Edmonton—Mill Woods—Beaumont),Conservative,Nay,
Ms. Francine Lalonde (La Pointe-de-l'Île),Bloc Québécois,,Paired
Mr. Guy Lauzon (Stormont—Dundas—South Glengarry),Conservative,Nay,
Mrs. Carole Lavallée (Saint-Bruno—Saint-Hubert),Bloc Québécois,Nay,
Mr. Jack Layton (Toronto—Danforth),NDP,Yea,
Mr. Dominic LeBlanc (Beauséjour),Liberal,Yea,
Mr. Derek Lee (Scarborough—Rouge River),Liberal,Yea,
Mr. Marc Lemay (Abitibi—Témiscamingue),Bloc Québécois,Nay,
Mr. Pierre Lemieux (Glengarry—Prescott—Russell),Conservative,Nay,
Mr. Yves Lessard (Chambly—Borduas),Bloc Québécois,Nay,
Mr. Yvon Lévesque (Abitibi—Baie-James—Nunavik—Eeyou),Bloc Québécois,Nay,
Mr. Tom Lukiwski (Regina—Lumsden—Lake Centre),Conservative,Nay,
Mr. Gary Lunn (Saanich—Gulf Islands),Conservative,Nay,
Mr. James Lunney (Nanaimo—Alberni),Conservative,Nay,
Mr. Marcel Lussier (Brossard—La Prairie),Bloc Québécois,Nay,
Mr. Lawrence MacAulay (Cardigan),Liberal,Yea,
Mr. Peter MacKay (Central Nova),Conservative,Nay,
Mr. Dave MacKenzie (Oxford),Conservative,Nay,
Mr. Gurbax Malhi (Bramalea—Gore—Malton),Liberal,Yea,
Mr. Luc Malo (Verchères—Les Patriotes),Bloc Québécois,,Paired
Mr. John Maloney (Welland),Liberal,Yea,
Mr. Fabian Manning (Avalon),Conservative,Nay,
Mr. Inky Mark (Dauphin—Swan River—Marquette),Conservative,,Paired
Ms. Diane Marleau (Sudbury),Liberal,Yea,
Mr. Wayne Marston (Hamilton East—Stoney Creek),NDP,Yea,
Mr. Pat Martin (Winnipeg Centre),NDP,Yea,
Mr. Tony Martin (Sault Ste. Marie),NDP,Yea,
Mr. Keith Martin (Esquimalt—Juan de Fuca),Liberal,Yea,
Mr. Brian Masse (Windsor West),NDP,Yea,
Ms. Irene Mathyssen (London—Fanshawe),NDP,Yea,
Mr. Colin Mayes (Okanagan—Shuswap),Conservative,Nay,
Mr. John McCallum (Markham—Unionville),Liberal,Yea,
Ms. Alexa McDonough (Halifax),NDP,Yea,
Mr. David McGuinty (Ottawa South),Liberal,Yea,
Mr. Joe McGuire (Egmont),Liberal,Yea,
Mr. John McKay (Scarborough—Guildwood),Liberal,Yea,
Mr. Dan McTeague (Pickering—Scarborough East),Liberal,Yea,
Mr. Serge Ménard (Marc-Aurèle-Fortin),Bloc Québécois,Nay,
Mr. Réal Ménard (Hochelaga),Bloc Québécois,Nay,
Mr. Ted Menzies (Macleod),Conservative,Nay,
Mr. Gary Merasty (Desnethé—Missinippi—Churchill River),Liberal,Yea,
Mr. Rob Merrifield (Yellowhead),Conservative,Nay,
Mr. Larry Miller (Bruce—Grey—Owen Sound),Conservative,Nay,
Mr. Bob Mills (Red Deer),Conservative,Nay,
Ms. Maria Minna (Beaches—East York),Liberal,Yea,
Mr. James Moore (Port Moody—Westwood—Port Coquitlam),Conservative,Nay,
Mr. Rob Moore (Fundy Royal),Conservative,Nay,
Mr. Brian Murphy (Moncton—Riverview—Dieppe),Liberal,Yea,
Mr. Shawn Murphy (Charlottetown),Liberal,Yea,
Mr. Richard Nadeau (Gatineau),Bloc Québécois,Nay,
Ms. Peggy Nash (Parkdale—High Park),NDP,Yea,
Ms. Anita Neville (Winnipeg South Centre),Liberal,Yea,
Mr. Rob Nicholson (Niagara Falls),Conservative,Nay,
Mr. Rick Norlock (Northumberland—Quinte West),Conservative,Nay,
Mr. Deepak Obhrai (Calgary East),Conservative,Nay,
Mr. Gordon O'Connor (Carleton—Mississippi Mills),Conservative,Nay,
Ms. Bev Oda (Durham),Conservative,Nay,
Mr. Christian Ouellet (Brome—Missisquoi),Bloc Québécois,Nay,
Mr. Stephen Owen (Vancouver Quadra),Liberal,Yea,
Mr. Massimo Pacetti (Saint-Léonard—Saint-Michel),Liberal,Yea,
Mr. Brian Pallister (Portage—Lisgar),Conservative,Nay,
Mr. Pierre Paquette (Joliette),Bloc Québécois,Nay,
Mr. Christian Paradis (Mégantic—L'Érable),Conservative,Nay,
Mr. Bernard Patry (Pierrefonds—Dollard),Liberal,Yea,
Mr. Glen Pearson (London North Centre),Liberal,Yea,
Mr. Gilles-A. Perron (Rivière-des-Mille-Îles),Bloc Québécois,Nay,
Mr. Jim Peterson (Willowdale),Liberal,Yea,
Mr. Daniel Petit (Charlesbourg—Haute-Saint-Charles),Conservative,Nay,
Ms. Pauline Picard (Drummond),Bloc Québécois,Nay,
Mr. Louis Plamondon (Bas-Richelieu—Nicolet—Bécancour),Bloc Québécois,Nay,
Mr. Pierre Poilievre (Nepean—Carleton),Conservative,Nay,
Mr. Jim Prentice (Calgary Centre-North),Conservative,Nay,
Mr. Joe Preston (Elgin—Middlesex—London),Conservative,Nay,
Ms. Penny Priddy (Surrey North),NDP,Yea,
Mr. Marcel Proulx (Hull—Aylmer),Liberal,Yea,
Mr. James Rajotte (Edmonton—Leduc),Conservative,Nay,
Ms. Yasmin Ratansi (Don Valley East),Liberal,Yea,
Mrs. Karen Redman (Kitchener Centre),Liberal,Yea,
Mr. Geoff Regan (Halifax West),Liberal,Yea,
Mr. Scott Reid (Lanark—Frontenac—Lennox and Addington),Conservative,Nay,
Mr. Lee Richardson (Calgary Centre),Conservative,Nay,
Mr. Gerry Ritz (Battlefords—Lloydminster),Conservative,Nay,
Ms. Lucienne Robillard (Westmount—Ville-Marie),Liberal,Yea,
Mr. Pablo Rodriguez (Honoré-Mercier),Liberal,Yea,
Mr. Anthony Rota (Nipissing—Timiskaming),Liberal,Yea,
Mr. Todd Russell (Labrador),Liberal,Yea,
Mr. Michael Savage (Dartmouth—Cole Harbour),Liberal,Yea,
Ms. Denise Savoie (Victoria),NDP,Yea,
Mr. Francis Scarpaleggia (Lac-Saint-Louis),Liberal,Yea,
Mr. Andrew Scheer (Regina—Qu'Appelle),Conservative,,Paired
Mr. Gary Schellenberger (Perth—Wellington),Conservative,Nay,
Mr. Andy Scott (Fredericton),Liberal,Yea,
Ms. Judy A. Sgro (York West),Liberal,Yea,
Mr. Bev Shipley (Lambton—Kent—Middlesex),Conservative,Nay,
Mr. Bill Siksay (Burnaby—Douglas),NDP,Yea,
Mr. Mario Silva (Davenport),Liberal,Yea,
Mr. Raymond Simard (Saint Boniface),Liberal,Yea,
Mr. Scott Simms (Bonavista—Gander—Grand Falls—Windsor),Liberal,Yea,
Mrs. Carol Skelton (Saskatoon—Rosetown—Biggar),Conservative,Nay,
Mrs. Joy Smith (Kildonan—St. Paul),Conservative,Nay,
Mr. Monte Solberg (Medicine Hat),Conservative,Nay,
Mr. Kevin Sorenson (Crowfoot),Conservative,Nay,
Mr. Lloyd St. Amand (Brant),Liberal,Yea,
Mr. Brent St. Denis (Algoma—Manitoulin—Kapuskasing),Liberal,Yea,
Mr. Bruce Stanton (Simcoe North),Conservative,Nay,
Mr. Thierry St-Cyr (Jeanne-Le Ber),Bloc Québécois,Nay,
Mr. Paul Steckle (Huron—Bruce),Liberal,Yea,
Ms. Caroline St-Hilaire (Longueuil—Pierre-Boucher),Bloc Québécois,Nay,
Mr. Peter Stoffer (Sackville—Eastern Shore),NDP,Yea,
Mr. Brian Storseth (Westlock—St. Paul),Conservative,Nay,
Mr. Chuck Strahl (Chilliwack—Fraser Canyon),Conservative,Nay,
Mr. David Sweet (Ancaster—Dundas—Flamborough—Westdale),Conservative,Nay,
Mr. Paul Szabo (Mississauga South),Liberal,Yea,
Mr. Andrew Telegdi (Kitchener—Waterloo),Liberal,Yea,
Mr. Lui Temelkovski (Oak Ridges—Markham),Liberal,Yea,
Mr. Robert Thibault (West Nova),Liberal,Yea,
Ms. Louise Thibault (Rimouski-Neigette—Témiscouata—Les Basques),Bloc Québécois,Nay,
Mr. Myron Thompson (Wild Rose),Conservative,Nay,
Mr. Greg Thompson (New Brunswick Southwest),Conservative,Nay,
Mr. David Tilson (Dufferin—Caledon),Conservative,,Paired
Mr. Vic Toews (Provencher),Conservative,Nay,
Mr. Alan Tonks (York South—Weston),Liberal,Yea,
Mr. Brad Trost (Saskatoon—Humboldt),Conservative,Nay,
Mr. Garth Turner (Halton),Liberal,Yea,
Mr. Merv Tweed (Brandon—Souris),Conservative,Nay,
Mr. Roger Valley (Kenora),Liberal,Yea,
Mr. Dave Van Kesteren (Chatham-Kent—Essex),Conservative,Nay,
Mr. Peter Van Loan (York—Simcoe),Conservative,Nay,
Mr. Maurice Vellacott (Saskatoon—Wanuskewin),Conservative,Nay,
Senator Josée Verner (Louis-Saint-Laurent),Conservative,Nay,
Mr. Robert Vincent (Shefford),Bloc Québécois,Nay,
Mr. Joseph Volpe (Eglinton—Lawrence),Liberal,Yea,
Mr. Mike Wallace (Burlington),Conservative,Nay,
Mr. Mark Warawa (Langley),Conservative,Nay,
Mr. Chris Warkentin (Peace River),Conservative,Nay,
Ms. Judy Wasylycia-Leis (Winnipeg North),NDP,Yea,
Mr. Jeff Watson (Essex),Conservative,Nay,
Mr. Bryon Wilfert (Richmond Hill),Liberal,Yea,
Mr. John G. Williams (Edmonton—St. Albert),Conservative,Nay,
Mr. Blair Wilson (West Vancouver—Sunshine Coast—Sea to Sky Country),Liberal,Yea,
Mr. Borys Wrzesnewskyj (Etobicoke Centre),Liberal,Yea,
Mrs. Lynne Yelich (Blackstrap),Conservative,Nay,
Mr. Paul Zed (Saint John),Liberal,Yea,
