Member of Parliament,Political Affiliation,Member Voted,Paired
Mr. Jim Abbott (Kootenay—Columbia),Conservative,Yea,
Mrs. Diane Ablonczy (Calgary—Nose Hill),Conservative,Yea,
Mrs. Leona Aglukkaq (Nunavut),Conservative,Yea,
Mr. Harold Albrecht (Kitchener—Conestoga),Conservative,Yea,
Mr. Mike Allen (Tobique—Mactaquac),Conservative,Yea,
Mr. Malcolm Allen (Welland),NDP,Yea,
Mr. Dean Allison (Niagara West—Glanbrook),Conservative,Yea,
Ms. Rona Ambrose (Edmonton—Spruce Grove),Conservative,Yea,
Mr. Rob Anders (Calgary West),Conservative,Yea,
Mr. David Anderson (Cypress Hills—Grasslands),Conservative,Yea,
Mr. Guy André (Berthier—Maskinongé),Bloc Québécois,Yea,
Mr. Scott Andrews (Avalon),Liberal,Nay,
Mr. Charlie Angus (Timmins—James Bay),NDP,Yea,
Mr. Keith Ashfield (Fredericton),Conservative,Yea,
Ms. Niki Ashton (Churchill),NDP,Yea,
Mr. Gérard Asselin (Manicouagan),Bloc Québécois,Yea,
Mr. Alex Atamanenko (British Columbia Southern Interior),NDP,Yea,
Mr. Claude Bachand (Saint-Jean),Bloc Québécois,,Paired
Mr. Larry Bagnell (Yukon),Liberal,Nay,
Mr. Navdeep Bains (Mississauga—Brampton South),Liberal,Nay,
Mr. John Baird (Ottawa West—Nepean),Conservative,Yea,
Mrs. Josée Beaudin (Saint-Lambert),Bloc Québécois,Yea,
Mr. Mauril Bélanger (Ottawa—Vanier),Liberal,Nay,
Mr. André Bellavance (Richmond—Arthabaska),Bloc Québécois,Yea,
Ms. Carolyn Bennett (St. Paul's),Liberal,Nay,
Mr. Leon Benoit (Vegreville—Wainwright),Conservative,Yea,
Mr. Maxime Bernier (Beauce),Conservative,Yea,
Mr. Maurizio Bevilacqua (Vaughan),Liberal,Nay,
Mr. Dennis Bevington (Western Arctic),NDP,Yea,
Mr. James Bezan (Selkirk—Interlake),Conservative,Yea,
Mr. Bernard Bigras (Rosemont—La Petite-Patrie),Bloc Québécois,,Paired
Mr. Jean-Pierre Blackburn (Jonquière—Alma),Conservative,Yea,
Mr. Raynald Blais (Gaspésie—Îles-de-la-Madeleine),Bloc Québécois,Yea,
Mr. Steven Blaney (Lévis—Bellechasse),Conservative,Yea,
Mrs. Kelly Block (Saskatoon—Rosetown—Biggar),Conservative,,Paired
Ms. France Bonsant (Compton—Stanstead),Bloc Québécois,Yea,
Mr. Robert Bouchard (Chicoutimi—Le Fjord),Bloc Québécois,Yea,
Mrs. Sylvie Boucher (Beauport—Limoilou),Conservative,Yea,
Mr. Ray Boughen (Palliser),Conservative,Yea,
Ms. Diane Bourgeois (Terrebonne—Blainville),Bloc Québécois,Yea,
Mr. Peter Braid (Kitchener—Waterloo),Conservative,Yea,
Mr. Garry Breitkreuz (Yorkton—Melville),Conservative,Yea,
Ms. Lois Brown (Newmarket—Aurora),Conservative,Yea,
Mr. Gordon Brown (Leeds—Grenville),Conservative,Yea,
Mr. Patrick Brown (Barrie),Conservative,Yea,
Mr. Rod Bruinooge (Winnipeg South),Conservative,Yea,
Ms. Paule Brunelle (Trois-Rivières),Bloc Québécois,Yea,
Mr. Gerry Byrne (Humber—St. Barbe—Baie Verte),Liberal,Nay,
Ms. Dona Cadman (Surrey North),Conservative,Yea,
Mr. Paul Calandra (Oak Ridges—Markham),Conservative,Yea,
Mr. Blaine Calkins (Wetaskiwin),Conservative,Yea,
Mr. Ron Cannan (Kelowna—Lake Country),Conservative,Yea,
Mr. John Cannis (Scarborough Centre),Liberal,Nay,
Mr. Lawrence Cannon (Pontiac),Conservative,Yea,
Mr. Serge Cardin (Sherbrooke),Bloc Québécois,Yea,
Mr. Colin Carrie (Oshawa),Conservative,Yea,
Mr. Rick Casson (Lethbridge),Conservative,Yea,
Ms. Chris Charlton (Hamilton Mountain),NDP,Yea,
Mr. Michael Chong (Wellington—Halton Hills),Conservative,Yea,
Ms. Olivia Chow (Trinity—Spadina),NDP,Yea,
Mr. David Christopherson (Hamilton Centre),NDP,Yea,
Mr. Rob Clarke (Desnethé—Missinippi—Churchill River),Conservative,Yea,
Ms. Siobhan Coady (St. John's South—Mount Pearl),Liberal,Nay,
Mr. Joe Comartin (Windsor—Tecumseh),NDP,Yea,
Mr. Irwin Cotler (Mount Royal),Liberal,Nay,
Mrs. Bonnie Crombie (Mississauga—Streetsville),Liberal,Nay,
Ms. Jean Crowder (Nanaimo—Cowichan),NDP,Yea,
Mr. Nathan Cullen (Skeena—Bulkley Valley),NDP,Yea,
Mr. John Cummins (Delta—Richmond East),Conservative,Yea,
Mr. Rodger Cuzner (Cape Breton—Canso),Liberal,Nay,
Mr. Jean-Claude D'Amours (Madawaska—Restigouche),Liberal,Nay,
Mrs. Patricia Davidson (Sarnia—Lambton),Conservative,Yea,
Mr. Don Davies (Vancouver Kingsway),NDP,Yea,
Ms. Libby Davies (Vancouver East),NDP,Yea,
Mr. Stockwell Day (Okanagan—Coquihalla),Conservative,Yea,
Mrs. Claude DeBellefeuille (Beauharnois—Salaberry),Bloc Québécois,Yea,
Mr. Bob Dechert (Mississauga—Erindale),Conservative,,Paired
Mr. Dean Del Mastro (Peterborough),Conservative,Yea,
Ms. Nicole Demers (Laval),Bloc Québécois,Yea,
Ms. Johanne Deschamps (Laurentides—Labelle),Bloc Québécois,Yea,
Mr. Luc Desnoyers (Rivière-des-Mille-Îles),Bloc Québécois,Yea,
Mr. Barry Devolin (Haliburton—Kawartha Lakes—Brock),Conservative,Yea,
Mr. Paul Dewar (Ottawa Centre),NDP,Yea,
Mr. Sukh Dhaliwal (Newton—North Delta),Liberal,Nay,
Ms. Ruby Dhalla (Brampton—Springdale),Liberal,Nay,
Mr. Stéphane Dion (Saint-Laurent—Cartierville),Liberal,Nay,
Mr. Jean Dorion (Longueuil—Pierre-Boucher),Bloc Québécois,Yea,
Mr. Earl Dreeshen (Red Deer),Conservative,Yea,
Mr. Ken Dryden (York Centre),Liberal,Nay,
Mr. Gilles Duceppe (Laurier—Sainte-Marie),Bloc Québécois,Yea,
Mr. Nicolas Dufour (Repentigny),Bloc Québécois,Yea,
Ms. Linda Duncan (Edmonton—Strathcona),NDP,Yea,
Ms. Kirsty Duncan (Etobicoke North),Liberal,Nay,
Mr. John Duncan (Vancouver Island North),Conservative,Yea,
Mr. Rick Dykstra (St. Catharines),Conservative,Yea,
Mr. Wayne Easter (Malpeque),Liberal,Nay,
Mr. Mark Eyking (Sydney—Victoria),Liberal,Nay,
Ms. Meili Faille (Vaudreuil-Soulanges),Bloc Québécois,Yea,
Mr. Ed Fast (Abbotsford),Conservative,Yea,
Ms. Diane Finley (Haldimand—Norfolk),Conservative,Yea,
Mr. Jim Flaherty (Whitby—Oshawa),Conservative,Yea,
Mr. Steven Fletcher (Charleswood—St. James—Assiniboia),Conservative,Yea,
Ms. Raymonde Folco (Laval—Les Îles),Liberal,Nay,
Ms. Judy Foote (Random—Burin—St. George's),Liberal,Nay,
Mrs. Carole Freeman (Châteauguay—Saint-Constant),Bloc Québécois,Yea,
Ms. Hedy Fry (Vancouver Centre),Liberal,Nay,
Ms. Christiane Gagnon (Québec),Bloc Québécois,,Paired
Mr. Royal Galipeau (Ottawa—Orléans),Conservative,Yea,
Mrs. Cheryl Gallant (Renfrew—Nipissing—Pembroke),Conservative,Yea,
Mr. Marc Garneau (Westmount—Ville-Marie),Liberal,Nay,
Mr. Roger Gaudet (Montcalm),Bloc Québécois,Yea,
Mrs. Shelly Glover (Saint Boniface),Conservative,Yea,
Mr. Yvon Godin (Acadie—Bathurst),NDP,Yea,
Mr. Peter Goldring (Edmonton East),Conservative,,Paired
Mr. Ralph Goodale (Wascana),Liberal,Nay,
Mr. Gary Goodyear (Cambridge),Conservative,Yea,
Mr. Jacques Gourde (Lotbinière—Chutes-de-la-Chaudière),Conservative,Yea,
Mr. Claude Gravelle (Nickel Belt),NDP,Yea,
Mrs. Nina Grewal (Fleetwood—Port Kells),Conservative,Yea,
Mr. Michel Guimond (Montmorency—Charlevoix—Haute-Côte-Nord),Bloc Québécois,Yea,
Mr. Claude Guimond (Rimouski-Neigette—Témiscouata—Les Basques),Bloc Québécois,Yea,
Mr. Stephen Harper (Calgary Southwest),Conservative,Yea,
Mr. Richard Harris (Cariboo—Prince George),Conservative,Yea,
Mr. Jack Harris (St. John's East),NDP,Yea,
Mr. Laurie Hawn (Edmonton Centre),Conservative,Yea,
Mr. Russ Hiebert (South Surrey—White Rock—Cloverdale),Conservative,Yea,
Mr. Jay Hill (Prince George—Peace River),Conservative,Yea,
Mr. Randy Hoback (Prince Albert),Conservative,Yea,
Ms. Candice Hoeppner (Portage—Lisgar),Conservative,Yea,
Mr. Ed Holder (London West),Conservative,,Paired
Mrs. Carol Hughes (Algoma—Manitoulin—Kapuskasing),NDP,Yea,
Mr. Bruce Hyer (Thunder Bay—Superior North),NDP,Yea,
Mr. Brian Jean (Fort McMurray—Athabasca),Conservative,Yea,
Mrs. Marlene Jennings (Notre-Dame-de-Grâce—Lachine),Liberal,Nay,
Mr. Peter Julian (Burnaby—New Westminster),NDP,Yea,
Mr. Randy Kamp (Pitt Meadows—Maple Ridge—Mission),Conservative,Yea,
Mr. Andrew Kania (Brampton West),Liberal,Nay,
Mr. Jim Karygiannis (Scarborough—Agincourt),Liberal,Nay,
Mr. Gerald Keddy (South Shore—St. Margaret's),Conservative,Yea,
Mr. Gerard Kennedy (Parkdale—High Park),Liberal,Nay,
Mr. Jason Kenney (Calgary Southeast),Conservative,Yea,
Mr. Greg Kerr (West Nova),Conservative,Yea,
Mr. Ed Komarnicki (Souris—Moose Mountain),Conservative,Yea,
Mr. Daryl Kramp (Prince Edward—Hastings),Conservative,Yea,
Mr. Jean-Yves Laforest (Saint-Maurice—Champlain),Bloc Québécois,,Paired
Mr. Mario Laframboise (Argenteuil—Papineau—Mirabel),Bloc Québécois,Yea,
Mr. Mike Lake (Edmonton—Mill Woods—Beaumont),Conservative,Yea,
Ms. Francine Lalonde (La Pointe-de-l'Île),Bloc Québécois,,Paired
Mr. Guy Lauzon (Stormont—Dundas—South Glengarry),Conservative,Yea,
Mrs. Carole Lavallée (Saint-Bruno—Saint-Hubert),Bloc Québécois,Yea,
Mr. Jack Layton (Toronto—Danforth),NDP,Yea,
Mr. Denis Lebel (Roberval—Lac-Saint-Jean),Conservative,Yea,
Mr. Dominic LeBlanc (Beauséjour),Liberal,Nay,
Mr. Derek Lee (Scarborough—Rouge River),Liberal,Nay,
Mr. Marc Lemay (Abitibi—Témiscamingue),Bloc Québécois,Yea,
Mr. Pierre Lemieux (Glengarry—Prescott—Russell),Conservative,Yea,
Ms. Megan Leslie (Halifax),NDP,Yea,
Mr. Yves Lessard (Chambly—Borduas),Bloc Québécois,Yea,
Mr. Yvon Lévesque (Abitibi—Baie-James—Nunavik—Eeyou),Bloc Québécois,Yea,
Mr. Ben Lobb (Huron—Bruce),Conservative,Yea,
Mr. Tom Lukiwski (Regina—Lumsden—Lake Centre),Conservative,Yea,
Mr. Gary Lunn (Saanich—Gulf Islands),Conservative,Yea,
Mr. James Lunney (Nanaimo—Alberni),Conservative,Yea,
Mr. Peter MacKay (Central Nova),Conservative,Yea,
Mr. Dave MacKenzie (Oxford),Conservative,Yea,
Mr. Gurbax Malhi (Bramalea—Gore—Malton),Liberal,Nay,
Mr. Luc Malo (Verchères—Les Patriotes),Bloc Québécois,Yea,
Mr. Jim Maloway (Elmwood—Transcona),NDP,Yea,
Mr. Inky Mark (Dauphin—Swan River—Marquette),Conservative,Yea,
Mr. Wayne Marston (Hamilton East—Stoney Creek),NDP,Yea,
Mr. Pat Martin (Winnipeg Centre),NDP,Yea,
Mr. Keith Martin (Esquimalt—Juan de Fuca),Liberal,Nay,
Mr. Tony Martin (Sault Ste. Marie),NDP,Yea,
Mr. Brian Masse (Windsor West),NDP,Yea,
Ms. Irene Mathyssen (London—Fanshawe),NDP,Yea,
Mr. Colin Mayes (Okanagan—Shuswap),Conservative,Yea,
Mr. John McCallum (Markham—Unionville),Liberal,Nay,
Mr. Phil McColeman (Brant),Conservative,Yea,
Mr. David McGuinty (Ottawa South),Liberal,Nay,
Mr. John McKay (Scarborough—Guildwood),Liberal,Nay,
Mrs. Cathy McLeod (Kamloops—Thompson—Cariboo),Conservative,Yea,
Mr. Dan McTeague (Pickering—Scarborough East),Liberal,Nay,
Mr. Serge Ménard (Marc-Aurèle-Fortin),Bloc Québécois,Yea,
Mrs. Alexandra Mendès (Brossard—La Prairie),Liberal,Nay,
Mr. Ted Menzies (Macleod),Conservative,Yea,
Mr. Rob Merrifield (Yellowhead),Conservative,Yea,
Mr. Larry Miller (Bruce—Grey—Owen Sound),Conservative,Yea,
Ms. Maria Minna (Beaches—East York),Liberal,Nay,
Mr. James Moore (Port Moody—Westwood—Port Coquitlam),Conservative,Yea,
Mr. Rob Moore (Fundy Royal),Conservative,Yea,
Mrs. Maria Mourani (Ahuntsic),Bloc Québécois,Yea,
Mr. Brian Murphy (Moncton—Riverview—Dieppe),Liberal,Nay,
Mr. Shawn Murphy (Charlottetown),Liberal,Nay,
Ms. Joyce Murray (Vancouver Quadra),Liberal,Nay,
Mr. Richard Nadeau (Gatineau),Bloc Québécois,Yea,
Ms. Anita Neville (Winnipeg South Centre),Liberal,Nay,
Mr. Rob Nicholson (Niagara Falls),Conservative,Yea,
Mr. Rick Norlock (Northumberland—Quinte West),Conservative,Yea,
Mr. Deepak Obhrai (Calgary East),Conservative,Yea,
Mr. Gordon O'Connor (Carleton—Mississippi Mills),Conservative,Yea,
Ms. Bev Oda (Durham),Conservative,Yea,
Mrs. Tilly O'Neill Gordon (Miramichi),Conservative,Yea,
Mr. Christian Ouellet (Brome—Missisquoi),Bloc Québécois,Yea,
Mr. Pascal-Pierre Paillé (Louis-Hébert),Bloc Québécois,,Paired
Mr. Pierre Paquette (Joliette),Bloc Québécois,Yea,
Mr. Christian Paradis (Mégantic—L'Érable),Conservative,Yea,
Mr. Bernard Patry (Pierrefonds—Dollard),Liberal,Nay,
Mr. LaVar Payne (Medicine Hat),Conservative,Yea,
Mr. Daniel Petit (Charlesbourg—Haute-Saint-Charles),Conservative,Yea,
Mr. Louis Plamondon (Bas-Richelieu—Nicolet—Bécancour),Bloc Québécois,Yea,
Mr. Pierre Poilievre (Nepean—Carleton),Conservative,Yea,
Mr. Roger Pomerleau (Drummond),Bloc Québécois,Yea,
Mr. Jim Prentice (Calgary Centre-North),Conservative,Yea,
Mr. Joe Preston (Elgin—Middlesex—London),Conservative,Yea,
Mr. Bob Rae (Toronto Centre),Liberal,Nay,
Mr. John Rafferty (Thunder Bay—Rainy River),NDP,Yea,
Ms. Lisa Raitt (Halton),Conservative,Yea,
Mr. James Rajotte (Edmonton—Leduc),Conservative,,Paired
Ms. Yasmin Ratansi (Don Valley East),Liberal,Nay,
Mr. Brent Rathgeber (Edmonton—St. Albert),Conservative,Yea,
Mr. Geoff Regan (Halifax West),Liberal,Nay,
Mr. Scott Reid (Lanark—Frontenac—Lennox and Addington),Conservative,Yea,
Mr. Blake Richards (Wild Rose),Conservative,Yea,
Mr. Lee Richardson (Calgary Centre),Conservative,Yea,
Mr. Greg Rickford (Kenora),Conservative,Yea,
Mr. Gerry Ritz (Battlefords—Lloydminster),Conservative,Yea,
Mr. Pablo Rodriguez (Honoré-Mercier),Liberal,Nay,
Mr. Anthony Rota (Nipissing—Timiskaming),Liberal,Nay,
Mr. Jean-Yves Roy (Haute-Gaspésie—La Mitis—Matane—Matapédia),Bloc Québécois,Yea,
Mr. Michael Savage (Dartmouth—Cole Harbour),Liberal,Nay,
Ms. Denise Savoie (Victoria),NDP,Yea,
Mr. Andrew Saxton (North Vancouver),Conservative,Yea,
Mr. Francis Scarpaleggia (Lac-Saint-Louis),Liberal,Nay,
Mr. Andrew Scheer (Regina—Qu'Appelle),Conservative,Yea,
Mr. Gary Schellenberger (Perth—Wellington),Conservative,Yea,
Ms. Judy A. Sgro (York West),Liberal,Nay,
Mrs. Gail Shea (Egmont),Conservative,Yea,
Mr. Bev Shipley (Lambton—Kent—Middlesex),Conservative,Yea,
Mr. Devinder Shory (Calgary Northeast),Conservative,Yea,
Mr. Bill Siksay (Burnaby—Douglas),NDP,Yea,
Mr. Mario Silva (Davenport),Liberal,Nay,
Mr. Scott Simms (Bonavista—Gander—Grand Falls—Windsor),Liberal,Nay,
Mrs. Michelle Simson (Scarborough Southwest),Liberal,Nay,
Mrs. Joy Smith (Kildonan—St. Paul),Conservative,Yea,
Mr. Kevin Sorenson (Crowfoot),Conservative,Yea,
Mr. Bruce Stanton (Simcoe North),Conservative,Yea,
Mr. Thierry St-Cyr (Jeanne-Le Ber),Bloc Québécois,Yea,
Mr. Peter Stoffer (Sackville—Eastern Shore),NDP,Yea,
Mr. Brian Storseth (Westlock—St. Paul),Conservative,Yea,
Mr. Chuck Strahl (Chilliwack—Fraser Canyon),Conservative,Yea,
Mr. David Sweet (Ancaster—Dundas—Flamborough—Westdale),Conservative,Yea,
Mr. Paul Szabo (Mississauga South),Liberal,Nay,
Mrs. Ève-Mary Thaï Thi Lac (Saint-Hyacinthe—Bagot),Bloc Québécois,Yea,
Mr. Glenn Thibeault (Sudbury),NDP,Yea,
Mr. Greg Thompson (New Brunswick Southwest),Conservative,Yea,
Mr. David Tilson (Dufferin—Caledon),Conservative,,Paired
Mr. Alan Tonks (York South—Weston),Liberal,Nay,
Mr. Brad Trost (Saskatoon—Humboldt),Conservative,Yea,
Mr. Justin Trudeau (Papineau),Liberal,Nay,
Mr. Merv Tweed (Brandon—Souris),Conservative,Yea,
Mr. Tim Uppal (Edmonton—Sherwood Park),Conservative,Yea,
Mr. Frank Valeriote (Guelph),Liberal,Nay,
Mr. Dave Van Kesteren (Chatham-Kent—Essex),Conservative,Yea,
Mr. Peter Van Loan (York—Simcoe),Conservative,Yea,
Mr. Maurice Vellacott (Saskatoon—Wanuskewin),Conservative,Yea,
Senator Josée Verner (Louis-Saint-Laurent),Conservative,Yea,
Mr. Robert Vincent (Shefford),Bloc Québécois,Yea,
Mr. Joseph Volpe (Eglinton—Lawrence),Liberal,Nay,
Mr. Mike Wallace (Burlington),Conservative,Yea,
Mr. Mark Warawa (Langley),Conservative,Yea,
Mr. Chris Warkentin (Peace River),Conservative,Yea,
Ms. Judy Wasylycia-Leis (Winnipeg North),NDP,Yea,
Mr. Jeff Watson (Essex),Conservative,Yea,
Mr. John Weston (West Vancouver—Sunshine Coast—Sea to Sky Country),Conservative,Yea,
Mr. Rodney Weston (Saint John),Conservative,Yea,
Mr. Bryon Wilfert (Richmond Hill),Liberal,Nay,
Mrs. Alice Wong (Richmond),Conservative,Yea,
Mr. Stephen Woodworth (Kitchener Centre),Conservative,Yea,
Mr. Borys Wrzesnewskyj (Etobicoke Centre),Liberal,Nay,
Mrs. Lynne Yelich (Blackstrap),Conservative,Yea,
Mr. Terence Young (Oakville),Conservative,Yea,
Mrs. Lise Zarac (LaSalle—Émard),Liberal,Nay,
